"wot_key","Shop.y","service_group","wo_type","wot_status","status_duration","time_bucket","wot_description","Project","Activity","asset_id","tag_number","serial_id","asset_description","year_num","week_num","Unit","Work.Order","Task.No.","Sequence","PC.Bus.Unit","Business.Unit","Dependency","Removal.Task","To","Overlap","Duration.x","Asset.Up","Location","Status","Status.Dt.Tm","Required.Start","Start.Time","Scheduled.Start","Start.Time.1","Scheduled.End","End.Time","End","End.Time.1","Act..End.Dttm","Actual.Start","Start.Time.2","Actual.End","End.Time.2","Act..Start.Dttm","Passive.Proj.","Scheduler","Lead.Person","Closed.Dt","Completed.Date","Est..Labor.Cost","Es..Material.Co","Est..Tools.Cost","Est..PO.cost","Schedule.Labor","Material.Cost","Tools.Cost","Purchase.cost","Act..Labor.Cost","Actual.Cost","Act..Tools.Cost","Actual.Cost.1","Downtime.hours","Failure.Date","Rate","Recover.Cost","Name","Supplier","Supp.Cntct","Claim.ID","Problem.Group","Problem","Cause","Resolution","Action","Needs.Repair","Supervisor","Labor","Tools","Inventory","Purchase.OnHand","Requirement.Ln","Requirement.Ln.1","Requirement.Ln.2","Line.No","Requirement.Ln.3","Requirement.Ln.4","Requirement.Ln.5","Requirement.Ln.6","Alert","Chargeback","Rate.Select","Rate.Set","Ret.Type","Cap.Flag","Currency","Filter.ID","Min.Cap","Amount.to","Man.Close","Custodian","Component.of","ID","Dept","WO.Job.Tmplt","WO.Task.Tmplt","Commit.Rule","Status.1","Reserve.Rule","Status.2","Priority","Business.Unit.1","Shop.x","Crew","Area.ID","Type","Last.Sent","Last.Updated","Updated.By","Last.Updt","sched_start_duration","sched_start_month","sched_start_year","pc_bus_unit","Duration.y","asset_key"
"STAUS-717-1","PERTH","DRILL SUPP","PREJB","OPEN",250,"6M-1Y","CL 4 - 6 Gear box",218953,"8000","11581","ER00568","ER00568","API 17D TORQUE TOOL GEAR BOX CL 4-6",2023,30,"STAUS",717,1,10,"B0811","BUSTR",0,NA,0,0,1,NA,"APAC05",1,2022-11-16,"18/11/2022","12:00:00.000000AM",2022-11-18,"12:00:00.000000AM","21/11/2022","11:59:00.000000PM","21/11/2022","11:59:00.000000PM",NA,"","","","",NA,"",1,"","",NA,0,0,0,0,0,0,0,0,0,0,0,0,0,NA,0,"N",NA,NA,0,NA,"","","","",1,"N",NA,"N","N","N","N",1,1,1,1,1,1,1,1,NA,"N",1,"",NA,NA,"AUD",NA,0,0,"N",NA,NA,NA,NA,"","",2,NA,2,NA,999,"","",NA,"","",NA,NA,"TVICAREY","15/05/2023  3:47:51PM",248,11,2022,"B0811",1,"BUSTR-11581"
"STAUS-717-2","PERTH","DRILL SUPP","PREJB","OPEN",250,"6M-1Y","CL 4 - 5 Gear box",218953,"8000","12030","ER01567","ER01567","CLASS 4-5 GEARBOX",2023,30,"STAUS",717,2,20,"B0811","BUSTR",0,NA,0,0,1,NA,"APAC05",1,2022-11-16,"18/11/2022","12:00:00.000000AM",2022-11-18,"12:00:00.000000AM","21/11/2022","11:59:00.000000PM","21/11/2022","11:59:00.000000PM",NA,"","","","",NA,"",1,"","",NA,0,0,0,0,0,0,0,0,0,0,0,0,0,NA,0,"N",NA,NA,0,NA,"","","","",1,"N",NA,"N","N","N","N",1,1,1,1,1,1,1,1,NA,"N",1,"",NA,NA,"AUD",NA,0,0,"N",NA,NA,NA,NA,"","",2,NA,2,NA,999,"","",NA,"","",NA,NA,"TVICAREY","15/05/2023  3:47:51PM",248,11,2022,"B0811",1,"BUSTR-12030"
"STAUS-736-6","PERTH","DRILL SUPP","PSTJB","PSCH",225,"6M-1Y","FLYING LEAD ORIENTATION TOOL",217015,"7000","18072","AU0227","AU0227","FLYING LEAD ORIENTATION TOOL",2023,30,"STAUS",736,6,60,"B0811","BUSTR",0,NA,0,0,7.25,NA,"APAC18",1,2022-12-11,"08/12/2022","12:00:00.000000AM",2022-12-08,"12:00:00.000000AM","09/01/2023","11:59:00.000000PM","01/07/2023","11:59:00.000000PM",NA,"","","","",NA,"",1,"","",NA,0,0,0,0,0,0,0,0,0,0,0,0,0,NA,0,"N",NA,NA,0,NA,"","","","",1,"N",NA,"N","N","N","N",1,2,1,1,1,1,1,1,NA,"N",1,"",NA,NA,"AUD",NA,0,0,"N",NA,NA,NA,NA,"","LFT_PRE_POST",2,NA,2,NA,999,"","",NA,"","",NA,NA,"TVICAREY","29/05/2023 12:58:08AM",228,12,2022,"B0811",1,"BUSTR-18072"
"STAUS-736-9","PERTH","DRILL SUPP","PSTJB","PSCH",225,"6M-1Y","MERLIN PUMP",217015,"7000","26076","AU0665","MSZ-321396","MERLIN PUMP",2023,30,"STAUS",736,9,90,"B0811","BUSTR",0,NA,0,0,1,NA,"ROVMG158",1,2022-12-11,"08/12/2022","12:00:00.000000AM",2022-12-08,"12:00:00.000000AM","09/01/2023","11:59:00.000000PM","01/07/2023","11:59:00.000000PM",NA,"","","","",NA,"",1,"","",NA,0,0,0,0,0,0,0,0,0,0,0,0,0,NA,0,"N",NA,NA,0,NA,"","","","",1,"N",NA,"N","N","N","N",1,1,1,1,1,1,1,1,NA,"N",1,"",NA,NA,"AUD",NA,0,0,"N",NA,NA,NA,NA,"","",2,NA,2,NA,999,"","",NA,"","",NA,NA,"TVICAREY","29/05/2023 12:58:08AM",228,12,2022,"B0811",1,"BUSTR-26076"
"STAUS-728-5","PERTH","CLIENTOWN","PLAN","OHOT",223,"6M-1Y","Place equipment on pallet racking, take photos",198422,"1061",NA,NA,NA,NA,2023,30,"STAUS",728,5,50,"B0811","B0811",0,NA,0,0,4,NA,"",1,2022-12-13,"07/12/2022","12:00:00.000000AM",2022-12-07,"12:00:00.000000AM","09/12/2022","11:59:00.000000PM","09/12/2022","11:59:00.000000PM",NA,"","","","",NA,"",1,"","",NA,0,0,0,0,0,0,0,0,0,0,0,0,0,NA,0,"N",NA,NA,0,NA,"","","","",1,"N",NA,"Y","N","N","N",1,1,2,1,1,1,1,1,NA,"N",1,"",NA,NA,"AUD",NA,0,0,"N",NA,NA,NA,NA,"","",2,NA,2,NA,999,"","",NA,"","",NA,NA,"TVICAREY","15/05/2023  3:50:44PM",229,12,2022,"B0811",24,NA
"STAUS-736-4","PERTH","DRILL SUPP","PSTJB","OHWP",217,"6M-1Y","TORQUE TOOL TEST JIG CLASS 5",217015,"7000","18050","AU0168","AU0168","NM API CLASS TEST JIG 5000NM API CLASS 4",2023,30,"STAUS",736,4,40,"B0811","BUSTR",0,NA,0,0,2,NA,"APAC18",1,2022-12-19,"08/12/2022","12:00:00.000000AM",2022-12-08,"12:00:00.000000AM","09/01/2023","11:59:00.000000PM","01/07/2023","11:59:00.000000PM",NA,"","","","",NA,"",1,"","",NA,0,0,0,0,0,0,0,0,0,0,0,0,0,NA,0,"N",NA,NA,0,NA,"","","","",1,"N",NA,"N","N","N","N",1,1,1,1,1,1,1,1,NA,"N",1,"",NA,NA,"AUD",NA,0,0,"N",NA,NA,NA,NA,"","LC_PRE_POST",2,NA,2,NA,999,"","",NA,"","",NA,NA,"TVICAREY","29/05/2023 12:58:08AM",228,12,2022,"B0811",1,"BUSTR-18050"
"STAUS-724-11","PERTH","DRILL SUPP","PSTJB","OHWP",216,"6M-1Y","17H Hotstab brush",220662,"7000","24669","AU0646","AU0646","17H Hotstab brush",2023,30,"STAUS",724,11,110,"B0811","BUSTR",0,NA,0,0,1,NA,"APAC11",1,2022-12-20,"24/11/2022","12:00:00.000000AM",2022-11-24,"12:00:00.000000AM","23/12/2022","11:59:00.000000PM","23/12/2022","11:59:00.000000PM",NA,"20/12/2022"," 8:00:00.000000AM","20/12/2022"," 5:00:00.000000PM",NA,"",1,"","",NA,0,0,0,0,0,0,0,0,0,0,0,0,0,NA,0,"N",NA,NA,0,NA,"","","","",1,"N",NA,"Y","N","N","N",1,1,1,1,1,1,1,1,NA,"N",1,"",NA,NA,"AUD",NA,0,0,"N",NA,NA,NA,NA,"","",2,NA,2,NA,999,"","",NA,"","",NA,NA,"TVICAREY","18/07/2023  5:53:00PM",242,11,2022,"B0811",1,"BUSTR-24669"
"STAUS-724-3","PERTH","DRILL SUPP","PSTJB","PSCH",214,"6M-1Y","GASKET RRMOVAL RT - AX VX",220662,"7000","18001","AU0076","AU0076","3 INCH GASKET RRT",2023,30,"STAUS",724,3,30,"B0811","BUSTR",0,NA,0,0,8,NA,"APAC20",1,2022-12-22,"24/11/2022","12:00:00.000000AM",2022-11-24,"12:00:00.000000AM","23/12/2022","11:59:00.000000PM","23/12/2022","11:59:00.000000PM",NA,"","","","",NA,"",1,"","",NA,0,0,0,0,0,0,0,0,0,0,0,0,0,NA,0,"N",NA,NA,0,NA,"","","","",1,"N",NA,"N","N","N","N",1,1,1,1,1,1,1,1,NA,"N",1,"",NA,NA,"AUD",NA,0,0,"N",NA,NA,NA,NA,"","APAC_AX/VX GRRT_PST",2,NA,2,NA,999,"","",NA,"","",NA,NA,"TVICAREY","18/07/2023  5:53:00PM",242,11,2022,"B0811",1,"BUSTR-18001"
"STAUS-724-16","PERTH","DRILL SUPP","PSTJB","PSCH",214,"6M-1Y","9 GALLON RESERVOIR",220662,"7000","18119","AU0329","AU0329","9 GALLON RESERVOIR",2023,30,"STAUS",724,16,160,"B0811","BUSTR",0,NA,0,0,1,NA,"APAC22",1,2022-12-22,"24/11/2022","12:00:00.000000AM",2022-11-24,"12:00:00.000000AM","23/12/2022","11:59:00.000000PM","23/12/2022","11:59:00.000000PM",NA,"","","","",NA,"",1,"","",NA,0,0,0,0,0,0,0,0,0,0,0,0,0,NA,0,"N",NA,NA,0,NA,"","","","",1,"N",NA,"N","N","N","N",1,1,1,1,1,1,1,1,NA,"N",1,"",NA,NA,"AUD",NA,0,0,"N",NA,NA,NA,NA,"","",2,NA,2,NA,999,"","",NA,"","",NA,NA,"TVICAREY","18/07/2023  5:53:00PM",242,11,2022,"B0811",1,"BUSTR-18119"
"STAUS-724-20","PERTH","DRILL SUPP","PSTJB","PSCH",214,"6M-1Y","TORQUE TOOL MANIPULATOR API BU",220662,"7000","18252","AU0543","AU0543","ROV MANIPULATOR ASSEMBLY",2023,30,"STAUS",724,20,200,"B0811","BUSTR",0,NA,0,0,1,NA,"APAC05",1,2022-12-22,"24/11/2022","12:00:00.000000AM",2022-11-24,"12:00:00.000000AM","23/12/2022","11:59:00.000000PM","23/12/2022","11:59:00.000000PM",NA,"","","","",NA,"",1,"","",NA,0,0,0,0,0,0,0,0,0,0,0,0,0,NA,0,"N",NA,NA,0,NA,"","","","",1,"N",NA,"N","N","N","N",1,1,1,1,1,1,1,1,NA,"N",1,"",NA,NA,"AUD",NA,0,0,"N",NA,NA,NA,NA,"","",2,NA,2,NA,999,"","",NA,"J-MW-09-A","",NA,NA,"TVICAREY","18/07/2023  5:53:00PM",242,11,2022,"B0811",1,"BUSTR-18252"
"STAUS-724-22","PERTH","DRILL SUPP","PSTJB","PSCH",214,"6M-1Y","INCLINOMETER 10-36 / MINI TILT",220662,"7000","18219","AU0508","AU0508","INCLINOMETER 10-36 C/W MINI TILT (AU0536)",2023,30,"STAUS",724,22,220,"B0811","BUSTR",0,NA,0,0,1,NA,"AUS00014",1,2022-12-22,"24/11/2022","12:00:00.000000AM",2022-11-24,"12:00:00.000000AM","23/12/2022","11:59:00.000000PM","23/12/2022","11:59:00.000000PM",NA,"","","","",NA,"",1,"","",NA,0,0,0,0,0,0,0,0,0,0,0,0,0,NA,0,"N",NA,NA,0,NA,"","","","",1,"N",NA,"N","N","N","N",1,1,1,1,1,1,1,1,NA,"N",1,"",NA,NA,"AUD",NA,0,0,"N",NA,NA,NA,NA,"","",2,NA,2,NA,999,"","",NA,"","",NA,NA,"TVICAREY","18/07/2023  5:53:00PM",242,11,2022,"B0811",1,"BUSTR-18219"
"STAUS-724-23","PERTH","DRILL SUPP","PSTJB","PSCH",214,"6M-1Y","MULTI PURPOSE CLEANING TOOL 10",220662,"7000","18292","SI0300","SI0300","MULTIPURPOSE CLEANING TOOL 10 IN",2023,30,"STAUS",724,23,230,"B0811","BUSTR",0,NA,0,0,1,NA,"APAC20",1,2022-12-22,"24/11/2022","12:00:00.000000AM",2022-11-24,"12:00:00.000000AM","23/12/2022","11:59:00.000000PM","23/12/2022","11:59:00.000000PM",NA,"","","","",NA,"",1,"","",NA,0,0,0,0,0,0,0,0,0,0,0,0,0,NA,0,"N",NA,NA,0,NA,"","","","",1,"N",NA,"N","N","N","N",1,1,1,1,1,1,1,1,NA,"N",1,"",NA,NA,"AUD",NA,0,0,"N",NA,NA,NA,NA,"","",2,NA,2,NA,999,"","",NA,"","",NA,NA,"TVICAREY","18/07/2023  5:53:00PM",242,11,2022,"B0811",1,"BUSTR-18292"
"STAUS-754-1","PERTH","CLIENTOWN","NEWBD","OPEN",203,"6M-1Y","Transfer Stab Plates and Coupler boxes from PW124 & PW125 on to a pallet in Workshop 1",221546,"5000",NA,NA,NA,NA,2023,30,"STAUS",754,1,10,"B0811","B0811",0,NA,0,0,2,NA,"",1,2023-01-02,"03/01/2023","12:00:00.000000AM",2023-01-03,"12:00:00.000000AM","04/01/2023","11:59:00.000000PM","04/01/2023","11:59:00.000000PM",NA,"","","","",NA,"",29,"","",NA,0,0,0,0,0,0,0,0,0,0,0,0,0,NA,0,"N",NA,NA,0,NA,"","","","",1,"N",NA,"N","N","N","N",1,1,1,1,1,1,1,1,NA,"N",1,"",NA,NA,"AUD",NA,0,0,"N",NA,NA,NA,NA,"","",2,NA,2,NA,999,"","",NA,"","",NA,NA,"TVICAREY","11/05/2023  5:54:20PM",202,1,2023,"B0811",1,NA
"STAUS-768-1","PERTH","CLIENTOWN","PLAN","OPEN",194,"6M-1Y","204452 EPRS PFA Tensioners Level 2 PSM",204452,"8213",NA,NA,NA,NA,2023,30,"STAUS",768,1,10,"B0811","",0,NA,0,0,120,NA,"",1,2023-01-11,"09/06/2023","12:00:00.000000AM",2023-01-31,"12:00:00.000000AM","08/02/2023","11:59:00.000000PM","26/06/2023","11:59:00.000000PM",NA,"","","","",NA,"",21,"","",NA,0,0,0,0,0,0,0,0,0,0,0,0,0,NA,0,"N",NA,NA,0,NA,"","","","",1,"N",NA,"Y","N","N","N",1,3,3,1,1,1,1,1,NA,"N",1,"",NA,NA,"AUD",NA,0,0,"N",NA,NA,NA,NA,"","",2,NA,2,NA,999,"","",NA,"","",NA,NA,"TVICAREY","11/05/2023  5:54:20PM",174,1,2023,"B0811",120,NA
"STAUS-769-1","PERTH","CLIENTOWN","PLAN","OPEN",194,"6M-1Y","204452 EPRS PFA Electrical - JB's & LVDT's Level 2 PSM",204452,"8215",NA,NA,NA,NA,2023,30,"STAUS",769,1,10,"B0811","",0,NA,0,0,120,NA,"",1,2023-01-11,"25/07/2023","12:00:00.000000AM",2023-01-11,"12:00:00.000000AM","27/01/2023","11:59:00.000000PM","14/08/2023","11:59:00.000000PM",NA,"","","","",NA,"",21,"","",NA,0,0,0,0,0,0,0,0,0,0,0,0,0,NA,0,"N",NA,NA,0,NA,"","","","",1,"N",NA,"Y","N","N","N",1,3,7,1,1,1,1,1,NA,"N",1,"",NA,NA,"AUD",NA,0,0,"N",NA,NA,NA,NA,"","",2,NA,2,NA,999,"","",NA,"","",NA,NA,"TVICAREY","11/05/2023  5:54:20PM",194,1,2023,"B0811",128,NA
"STAUS-772-1","PERTH","DECOMM","PSTJB","OHWP",183,"90-6M","Recovery Clamps Post Job",222044,"7000","18776","AU0395","AU0395","1024 Pipe Lifter Clamp 990167718",2023,30,"STAUS",772,1,10,"B0811","BUSTR",0,NA,0,0,1.5,NA,"AUS00011",1,2023-01-22,"19/01/2023","12:00:00.000000AM",2023-01-19,"12:00:00.000000AM","20/01/2023","11:59:00.000000PM","20/01/2023","11:59:00.000000PM",NA,"23/01/2023"," 8:00:00.000000AM","24/01/2023"," 5:00:00.000000PM",NA,"",17,"","",NA,0,0,0,0,0,0,0,0,0,0,0,0,0,NA,0,"N",NA,NA,0,NA,"","","","",1,"N",NA,"Y","N","N","N",1,1,2,1,1,1,1,1,NA,"N",1,"",NA,NA,"AUD",NA,0,0,"N",NA,NA,NA,NA,"","",2,NA,2,NA,999,"","",NA,"","",NA,NA,"TVICAREY","11/05/2023  5:54:20PM",186,1,2023,"B0811",3,"BUSTR-18776"
"STAUS-772-2","PERTH","DECOMM","PSTJB","OHWP",183,"90-6M","Recovery Clamps Post Job",222044,"7000","18777","AU0396","AU0396","1024 Pipe Lifter Clamp 990167718",2023,30,"STAUS",772,2,20,"B0811","BUSTR",0,NA,0,0,1.5,NA,"AUS00011",1,2023-01-22,"19/01/2023","12:00:00.000000AM",2023-01-19,"12:00:00.000000AM","20/01/2023","11:59:00.000000PM","20/01/2023","11:59:00.000000PM",NA,"18/01/2023"," 8:00:00.000000AM","24/01/2023"," 5:00:00.000000PM",NA,"",17,"","",NA,0,0,0,0,0,0,0,0,0,0,0,0,0,NA,0,"N",NA,NA,0,NA,"","","","",1,"N",NA,"Y","N","N","N",1,1,3,1,1,1,1,1,NA,"N",1,"",NA,NA,"AUD",NA,0,0,"N",NA,NA,NA,NA,"","",2,NA,2,NA,999,"","",NA,"","",NA,NA,"TVICAREY","11/05/2023  5:54:20PM",186,1,2023,"B0811",3,"BUSTR-18777"
"STAUS-786-1","PERTH","CLIENTOWN","PLAN","OPEN",178,"90-6M","FBS Contingency Tool Level 2 PSM",204452,"8218",NA,NA,NA,NA,2023,30,"STAUS",786,1,10,"B0811","",0,NA,0,0,40,NA,"",1,2023-01-27,"06/09/2023","12:00:00.000000AM",2023-01-27,"12:00:00.000000AM","03/02/2023"," 8:00:00.000000PM","12/09/2023"," 8:00:00.000000PM",NA,"","","","",NA,"",25,"","",NA,0,0,0,0,0,0,0,0,0,0,0,0,0,NA,0,"N",NA,NA,0,NA,"","","","",1,"N",NA,"Y","N","N","N",1,3,1,1,1,1,1,1,NA,"N",1,"",NA,NA,"AUD",NA,0,0,"N",NA,NA,NA,NA,"","",2,NA,2,NA,999,"","",NA,"","",NA,NA,"TVICAREY","11/05/2023  5:54:20PM",178,1,2023,"B0811",40,NA
"STAUS-787-1","PERTH","CLIENTOWN","PLAN","OPEN",178,"90-6M","ROV IS Spare CP & IVP Level 2 PSM",204452,"8204",NA,NA,NA,NA,2023,30,"STAUS",787,1,10,"B0811","",0,NA,0,0,48,NA,"",1,2023-01-27,"23/11/2023","12:00:00.000000AM",2023-01-27,"12:00:00.000000AM","03/02/2023"," 8:00:00.000000PM","30/11/2023"," 8:00:00.000000PM",NA,"","","","",NA,"",25,"","",NA,0,0,0,0,0,0,0,0,0,0,0,0,0,NA,0,"N",NA,NA,0,NA,"","","","",1,"N",NA,"Y","N","N","N",1,3,7,1,1,1,1,1,NA,"N",1,"",NA,NA,"AUD",NA,0,0,"N",NA,NA,NA,NA,"","",2,NA,2,NA,999,"","",NA,"","",NA,NA,"TVICAREY","11/05/2023  5:54:20PM",178,1,2023,"B0811",48,NA
"STAUS-792-1","PERTH","DECOMM","PSTJB","TSCD",161,"90-6M","GR29 DEMOB",223743,"7000","18461","SI0277","SI0277","Stanley GR29",2023,30,"STAUS",792,1,10,"B0811","BUSTR",0,NA,0,0,8,NA,"APAC01",1,2023-02-13,"01/02/2023","12:00:00.000000AM",2023-02-01,"12:00:00.000000AM","22/02/2023","11:59:00.000000PM","22/02/2023","11:59:00.000000PM",NA,"","","","",NA,"",10,"","",NA,0,0,0,0,0,0,0,0,0,0,0,0,0,NA,0,"N",NA,NA,0,NA,"","","","",1,"N",NA,"Y","N","N","N",1,1,1,1,1,1,1,1,NA,"N",1,"",NA,NA,"AUD",NA,0,0,"N",NA,NA,NA,NA,"","APAC_GR29-STANLEY_PST",2,NA,2,NA,999,"","",NA,"LOSB-26-03","",NA,NA,"TVICAREY","11/05/2023  5:54:20PM",173,2,2023,"B0811",1,"BUSTR-18461"
"STAUS-792-2","PERTH","DECOMM","PSTJB","PSCH",161,"90-6M","FUGRO - IMPACT AND GRINDER DEMOB",223743,"7000","25535","AU0661","AU0661","IW 07 Impact Wrench",2023,30,"STAUS",792,2,20,"B0811","BUSTR",0,NA,0,0,1,NA,"AUS00002",1,2023-02-13,"01/02/2023","12:00:00.000000AM",2023-02-01,"12:00:00.000000AM","22/02/2023","11:59:00.000000PM","22/02/2023","11:59:00.000000PM",NA,"","","","",NA,"",10,"","",NA,0,0,0,0,0,0,0,0,0,0,0,0,0,NA,0,"N",NA,NA,0,NA,"","","","",1,"N",NA,"Y","N","N","N",1,1,1,1,1,1,1,1,NA,"N",1,"",NA,NA,"AUD",NA,0,0,"N",NA,NA,NA,NA,"","",2,NA,2,NA,999,"","",NA,"","",NA,NA,"TVICAREY","11/05/2023  5:54:20PM",173,2,2023,"B0811",1,"BUSTR-25535"
"STAUS-724-19","PERTH","DRILL SUPP","PSTJB","OHWP",160,"90-6M","40 Gallon Bladder",220662,"7000","18218","AU0507","AU0507","40 Gallon Bladder",2023,30,"STAUS",724,19,190,"B0811","BUSTR",0,NA,0,0,1,NA,"APAC20",1,2023-02-14,"24/11/2022","12:00:00.000000AM",2022-11-24,"12:00:00.000000AM","23/12/2022","11:59:00.000000PM","23/12/2022","11:59:00.000000PM",NA,"13/02/2023"," 8:00:00.000000AM","14/02/2023"," 5:00:00.000000PM",NA,"",1,"","",NA,0,0,0,0,0,0,0,0,0,0,0,0,0,NA,0,"N",NA,NA,0,NA,"","","","",1,"N",NA,"Y","N","N","N",1,1,2,1,1,1,1,1,NA,"N",1,"",NA,NA,"AUD",NA,0,0,"N",NA,NA,NA,NA,"","",2,NA,2,NA,999,"","",NA,"","",NA,NA,"TVICAREY","18/07/2023  5:53:00PM",242,11,2022,"B0811",1,"BUSTR-18218"
"STAUS-819-4","PERTH","C&I","PSTJB","PSCH",134,"90-6M","9 GALLON RESERVOIR",221988,"7000","18119","AU0329","AU0329","9 GALLON RESERVOIR",2023,30,"STAUS",819,4,40,"B0811","BUSTR",0,NA,0,0,1,NA,"AUS00002",1,2023-03-12,"14/03/2023","12:00:00.000000AM",2023-03-14,"12:00:00.000000AM","31/03/2023","11:59:00.000000PM","31/03/2023","11:59:00.000000PM",NA,"","","","",NA,"",11,"","",NA,0,0,0,0,0,0,0,0,0,0,0,0,0,NA,0,"N",NA,NA,0,NA,"","","","",1,"N",NA,"N","N","N","N",1,1,1,1,1,1,1,1,NA,"N",1,"",NA,NA,"AUD",NA,0,0,"N",NA,NA,NA,NA,"","",2,NA,2,NA,999,"","",NA,"","",NA,NA,"TVICAREY","18/07/2023 11:35:49PM",132,3,2023,"B0811",1,"BUSTR-18119"
"STAUS-804-50","PERTH","DRILL SUPP","PREJB","TSCD",133,"90-6M","Meas Current Meter",220132,"7000","18237","AU0527","AU0527","Meas Current Meter",2023,30,"STAUS",804,50,500,"B0811","BUSTR",0,NA,0,0,1,NA,"AGO00014",1,2023-03-13,"20/02/2023","12:00:00.000000AM",2023-02-20,"12:00:00.000000AM","10/03/2023","11:59:00.000000PM","10/03/2023","11:59:00.000000PM",NA,"","","","",NA,"",12,"","",NA,0,0,0,0,0,0,0,0,0,0,0,0,0,NA,0,"N",NA,NA,0,NA,"","","","",1,"N",NA,"Y","N","N","N",1,1,1,1,1,1,1,1,NA,"N",1,"",NA,NA,"AUD",NA,0,0,"N",NA,NA,NA,NA,"","",2,NA,2,NA,999,"","",NA,"","",NA,NA,"TVICAREY","10/07/2023  6:58:31PM",154,2,2023,"B0811",20,"BUSTR-18237"
"STABO-509-1","ABERDEEN","DRILL SUPP","PLAN","PSCH",132,"90-6M","17D CLASS 4 TORQUE TOOL POSTJOB",184031,"4260","13608","ER00030","ER00030","17D CL 4 TEST JIG",2023,30,"STABO",509,1,10,"B0551","BUSTR",0,NA,0,0,4,NA,"EMEA0500",1,2023-03-14,"14/03/2023","12:00:00.000000AM",2023-03-14,"12:00:00.000000AM","04/04/2023","11:59:00.000000PM","04/04/2023","11:59:00.000000PM",NA,"","","","",NA,"",16,"","",NA,0,0,0,0,0,0,0,0,0,0,0,0,0,NA,0,"N",NA,NA,0,NA,"","","","",1,"N",2020502,"Y","N","N","N",1,1,1,1,1,1,1,1,NA,"N",1,"WOMUK",NA,NA,"GBP",NA,0,0,"N",NA,NA,NA,NA,"","ABO_TT17D_CL4_PST",2,NA,2,NA,999,"STABO","ABERDEEN",NA,"","",NA,NA,"DCARLIER","09/05/2023  7:48:10AM",132,3,2023,"B0551",1,"BUSTR-13608"
"STAUS-824-3","PERTH","C&I","NEWBD","PSCH",131,"90-6M","Chasing Drone",223873,"4000",NA,NA,NA,NA,2023,30,"STAUS",824,3,20,"B0811","",0,NA,0,0,2,NA,"",1,2023-03-15,"16/03/2023","12:00:00.000000AM",2023-03-16,"12:00:00.000000AM","22/03/2023","11:59:00.000000PM","22/03/2023","11:59:00.000000PM",NA,"","","","",NA,"",1,"","",NA,0,0,0,0,0,0,0,0,0,0,0,0,0,NA,0,"N",NA,NA,0,NA,"","","","",1,"N",NA,"Y","N","N","N",1,1,1,1,1,1,1,1,NA,"N",1,"",NA,NA,"AUD",NA,0,0,"N",NA,NA,NA,NA,"","",2,NA,2,NA,999,"","",NA,"","",NA,NA,"TVICAREY","11/05/2023  5:54:20PM",130,3,2023,"B0811",8,NA
"STABO-519-1","ABERDEEN","DRILL SUPP","PLAN","PSCH",125,"90-6M","TDU Grabber (Standard / Heavy Duty)",184031,"4260","8882","BP00052","BP00052","Grabber (TDU), Standard",2023,30,"STABO",519,1,10,"B0551","BUSTR",0,NA,0,0,2.75,NA,"EMEA0081",1,2023-03-21,"21/03/2023","12:00:00.000000AM",2023-03-21,"12:00:00.000000AM","30/04/2023","11:59:00.000000PM","30/04/2023","11:59:00.000000PM",NA,"22/03/2023"," 8:00:00.000000AM","22/03/2023"," 5:00:00.000000PM",NA,"",16,"","",NA,0,0,0,0,0,0,0,0,0,0,0,0,0,NA,0,"N",NA,NA,0,NA,"","","","",1,"N",2020502,"Y","N","N","N",1,1,1,1,1,1,1,1,NA,"N",1,"WOMUK",NA,NA,"GBP",NA,0,0,"N",NA,NA,NA,NA,"","BP_ABO_TDU_GRABBER_PP",2,NA,2,NA,999,"","",NA,"","",NA,NA,"DCARLIER","09/05/2023  7:48:10AM",125,3,2023,"B0551",1,"BUSTR-8882"
"STABO-526-1","ABERDEEN","DRILL SUPP","PLAN","PSCH",125,"90-6M","17H TORQUE TOOL",184031,"4260","9243","BP00430","BP00430","Torque Tool - 17H, Medium (20-500 Nm) - Manip Deployed",2023,30,"STABO",526,1,10,"B0551","BUSTR",0,NA,0,0,2.5,NA,"EMEA0500",1,2023-03-21,"21/03/2023","12:00:00.000000AM",2023-03-21,"12:00:00.000000AM","30/04/2023","11:59:00.000000PM","30/04/2023","11:59:00.000000PM",NA,"","","","",NA,"",16,"","",NA,0,0,0,0,0,0,0,0,0,0,0,0,0,NA,0,"N",NA,NA,0,NA,"","","","",1,"N",2020502,"Y","N","N","N",1,1,1,1,1,1,1,1,NA,"N",1,"WOMUK",NA,NA,"GBP",NA,0,0,"N",NA,NA,NA,NA,"","BP_ABO_17H_TORQUE_TOOL_PP",2,NA,2,NA,999,"STABO","ABERDEEN",NA,"","",NA,NA,"DCARLIER","09/05/2023  7:48:10AM",125,3,2023,"B0551",1,"BUSTR-9243"
"STABO-527-1","ABERDEEN","DRILL SUPP","PLAN","PSCH",125,"90-6M","17H TORQUE TOOL",184031,"4260","9062","BP00248","BP00248","Torque Tool - 17H, Medium (20-500 Nm)",2023,30,"STABO",527,1,10,"B0551","BUSTR",0,NA,0,0,2.5,NA,"EMEA0501",1,2023-03-21,"21/03/2023","12:00:00.000000AM",2023-03-21,"12:00:00.000000AM","30/04/2023","11:59:00.000000PM","30/04/2023","11:59:00.000000PM",NA,"","","","",NA,"",16,"","",NA,0,0,0,0,0,0,0,0,0,0,0,0,0,NA,0,"N",NA,NA,0,NA,"","","","",1,"N",2020502,"Y","N","N","N",1,1,1,1,1,1,1,1,NA,"N",1,"WOMUK",NA,NA,"GBP",NA,0,0,"N",NA,NA,NA,NA,"","BP_ABO_17H_TORQUE_TOOL_PP",2,NA,2,NA,999,"STABO","ABERDEEN",NA,"","",NA,NA,"DCARLIER","09/05/2023  7:48:10AM",125,3,2023,"B0551",1,"BUSTR-9062"
"STABO-528-1","ABERDEEN","DRILL SUPP","PLAN","PSCH",125,"90-6M","17H TORQUE TOOL",184031,"4260","9234","BP00421","BP00421","Torque Tool - Paddle, Low (Short Nose)",2023,30,"STABO",528,1,10,"B0551","BUSTR",0,NA,0,0,2,NA,"EMEA0501",1,2023-03-21,"21/03/2023","12:00:00.000000AM",2023-03-21,"12:00:00.000000AM","30/04/2023","11:59:00.000000PM","30/04/2023","11:59:00.000000PM",NA,"","","","",NA,"",16,"","",NA,0,0,0,0,0,0,0,0,0,0,0,0,0,NA,0,"N",NA,NA,0,NA,"","","","",1,"N",2020502,"Y","N","N","N",1,1,1,1,1,1,1,1,NA,"N",1,"WOMUK",NA,NA,"GBP",NA,0,0,"N",NA,NA,NA,NA,"","BP_ABO_17H_TORQUE_TOOL-PP",2,NA,2,NA,999,"","",NA,"","",NA,NA,"DCARLIER","09/05/2023  7:48:10AM",125,3,2023,"B0551",1,"BUSTR-9234"
"STABO-529-1","ABERDEEN","DRILL SUPP","PLAN","PSCH",125,"90-6M","Actuator Ovrrd Tool, Push/Pul",184031,"4260","8950","BP00128","BP00128","Actuator Override Tool, Push/Pull",2023,30,"STABO",529,1,10,"B0551","BUSTR",0,NA,0,0,4,NA,"EMEA0081",1,2023-03-21,"21/03/2023","12:00:00.000000AM",2023-03-21,"12:00:00.000000AM","30/04/2023","11:59:00.000000PM","30/04/2023","11:59:00.000000PM",NA,"","","","",NA,"",16,"","",NA,0,0,0,0,0,0,0,0,0,0,0,0,0,NA,0,"N",NA,NA,0,NA,"","","","",1,"N",2020502,"Y","N","N","N",1,1,1,1,1,1,1,1,NA,"N",1,"WOMUK",NA,NA,"GBP",NA,0,0,"N",NA,NA,NA,NA,"","BP_ABO_AOT_PUSH_PULL",2,NA,2,NA,999,"STABO","ABERDEEN",NA,"","",NA,NA,"DCARLIER","09/05/2023  7:48:10AM",125,3,2023,"B0551",1,"BUSTR-8950"
"STABO-530-1","ABERDEEN","DRILL SUPP","PLAN","OPEN",125,"90-6M","SIT WO - BP00328",184031,"4260","9141","BP00328","BP00328","SIT Equipment - Hydraulic Control Panel",2023,30,"STABO",530,1,10,"B0551","BUSTR",0,NA,0,0,1,NA,"EMEA0500",1,2023-03-21,"21/03/2023","12:00:00.000000AM",2023-03-21,"12:00:00.000000AM","30/04/2023","11:59:00.000000PM","30/04/2023","11:59:00.000000PM",NA,"","","","",NA,"",16,"","",NA,0,0,0,0,0,0,0,0,0,0,0,0,0,NA,0,"N",NA,NA,0,NA,"","","","",1,"N",2020502,"N","N","N","N",1,1,1,1,1,1,1,1,NA,"N",1,"WOMUK",NA,NA,"GBP",NA,0,0,"N",NA,NA,NA,NA,"","",2,NA,2,NA,999,"STABO","ABERDEEN",NA,"","",NA,NA,"PMAHAJAN","21/03/2023  7:51:45AM",125,3,2023,"B0551",1,"BUSTR-9141"
"STAUS-827-2","PERTH","C&I","PSTJB","OPEN",122,"90-6M","ROV BASKET CAGE MOUNTED POST-JOB",222656,"7000","18274","AUX0031","AUX0031","ROV TOOLING BASKET",2023,30,"STAUS",827,2,20,"B0811","BUSTR",0,NA,0,0,1,NA,"SGP00011",1,2023-03-24,"24/04/2023","12:00:00.000000AM",2023-04-24,"12:00:00.000000AM","23/06/2023","11:59:00.000000PM","01/06/2023","11:59:00.000000PM",NA,"","","","",NA,"",11,"","",NA,0,0,0,0,0,0,0,0,0,0,0,0,0,NA,0,"N",NA,NA,0,NA,"","","","",1,"N",NA,"N","N","N","N",1,1,1,1,1,1,1,1,NA,"N",1,"",NA,NA,"AUD",NA,0,0,"N",NA,NA,NA,NA,"","",2,NA,2,NA,999,"","",NA,"","",NA,NA,"TVICAREY","23/07/2023  6:57:26PM",91,4,2023,"B0811",1,"BUSTR-18274"
"STAUS-827-6","PERTH","C&I","PSTJB","OPEN",122,"90-6M","ELECTRONIC TOPSIDE CONTROLLER POST-JOB",222656,"7000","18059","AU0199","AU0199","TOOLING LAPTOP KIT",2023,30,"STAUS",827,6,60,"B0811","BUSTR",0,NA,0,0,1,NA,"AGO00014",1,2023-03-24,"24/04/2023","12:00:00.000000AM",2023-04-24,"12:00:00.000000AM","23/06/2023","11:59:00.000000PM","01/06/2023","11:59:00.000000PM",NA,"","","","",NA,"",11,"","",NA,0,0,0,0,0,0,0,0,0,0,0,0,0,NA,0,"N",NA,NA,0,NA,"","","","",1,"N",NA,"N","N","N","N",1,1,1,1,1,1,1,1,NA,"N",1,"",NA,NA,"AUD",NA,0,0,"N",NA,NA,NA,NA,"","",2,NA,2,NA,999,"","",NA,"","",NA,NA,"TVICAREY","23/07/2023  6:57:26PM",91,4,2023,"B0811",1,"BUSTR-18059"
"STAUS-827-7","PERTH","C&I","PSTJB","OPEN",122,"90-6M","SID HOFFER POST-JOB",222656,"7000","18064","AU0209","AU0209","KIT, SPARE HOFFER FLOW METER - SID",2023,30,"STAUS",827,7,70,"B0811","BUSTR",0,NA,0,0,1,NA,"AUS00014",1,2023-03-24,"24/04/2023","12:00:00.000000AM",2023-04-24,"12:00:00.000000AM","23/06/2023","11:59:00.000000PM","01/06/2023","11:59:00.000000PM",NA,"","","","",NA,"",11,"","",NA,0,0,0,0,0,0,0,0,0,0,0,0,0,NA,0,"N",NA,NA,0,NA,"","","","",1,"N",NA,"N","N","N","N",1,1,1,1,1,1,1,1,NA,"N",1,"",NA,NA,"AUD",NA,0,0,"N",NA,NA,NA,NA,"","",2,NA,2,NA,999,"","",NA,"","",NA,NA,"TVICAREY","23/07/2023  6:57:26PM",91,4,2023,"B0811",1,"BUSTR-18064"
"STAUS-827-8","PERTH","C&I","PSTJB","OPEN",122,"90-6M","DUAL LINE TEST TRAY POST-JOB",222656,"7000","26516","AU0679","AU0679","Dual Line Test Tray",2023,30,"STAUS",827,8,80,"B0811","BUSTR",0,NA,0,0,1,NA,"APAC05",1,2023-03-24,"24/04/2023","12:00:00.000000AM",2023-04-24,"12:00:00.000000AM","23/06/2023","11:59:00.000000PM","01/06/2023","11:59:00.000000PM",NA,"","","","",NA,"",11,"","",NA,0,0,0,0,0,0,0,0,0,0,0,0,0,NA,0,"N",NA,NA,0,NA,"","","","",1,"N",NA,"N","N","N","N",1,1,1,1,1,1,1,1,NA,"N",1,"",NA,NA,"AUD",NA,0,0,"N",NA,NA,NA,NA,"","",2,NA,2,NA,999,"","",NA,"","",NA,NA,"TVICAREY","23/07/2023  6:57:26PM",91,4,2023,"B0811",1,"BUSTR-26516"
"STAUS-827-9","PERTH","C&I","PSTJB","OPEN",122,"90-6M","9 GALLON RESERVOIR POST-JOB",222656,"7000","18119","AU0329","AU0329","9 GALLON RESERVOIR",2023,30,"STAUS",827,9,90,"B0811","BUSTR",0,NA,0,0,1,NA,"AUS00002",1,2023-03-24,"24/04/2023","12:00:00.000000AM",2023-04-24,"12:00:00.000000AM","23/06/2023","11:59:00.000000PM","01/06/2023","11:59:00.000000PM",NA,"","","","",NA,"",11,"","",NA,0,0,0,0,0,0,0,0,0,0,0,0,0,NA,0,"N",NA,NA,0,NA,"","","","",1,"N",NA,"N","N","N","N",1,1,1,1,1,1,1,1,NA,"N",1,"",NA,NA,"AUD",NA,0,0,"N",NA,NA,NA,NA,"","",2,NA,2,NA,999,"","",NA,"","",NA,NA,"TVICAREY","23/07/2023  6:57:26PM",91,4,2023,"B0811",1,"BUSTR-18119"
"STAUS-827-18","PERTH","C&I","PSTJB","OPEN",122,"90-6M","DUAL LINE TEST TRAY POST-JOB",222656,"7000","26516","AU0679","AU0679","Dual Line Test Tray",2023,30,"STAUS",827,18,180,"B0811","BUSTR",0,NA,0,0,1,NA,"APAC05",1,2023-03-24,"24/04/2023","12:00:00.000000AM",2023-04-24,"12:00:00.000000AM","23/06/2023","11:59:00.000000PM","01/06/2023","11:59:00.000000PM",NA,"","","","",NA,"",11,"","",NA,0,0,0,0,0,0,0,0,0,0,0,0,0,NA,0,"N",NA,NA,0,NA,"","","","",1,"N",NA,"N","N","N","N",1,1,1,1,1,1,1,1,NA,"N",1,"",NA,NA,"AUD",NA,0,0,"N",NA,NA,NA,NA,"","",2,NA,2,NA,999,"","",NA,"","",NA,NA,"TVICAREY","23/07/2023  6:57:26PM",91,4,2023,"B0811",1,"BUSTR-26516"
"STAUS-827-19","PERTH","C&I","PSTJB","OPEN",122,"90-6M","ROV CAGE MOUNTED BASKET POST-JOB",222656,"7000","21912","AU0564","AU0564","ROV Cage Mount Basket",2023,30,"STAUS",827,19,190,"B0811","BUSTR",0,NA,0,0,1,NA,"SGP00007",1,2023-03-24,"24/04/2023","12:00:00.000000AM",2023-04-24,"12:00:00.000000AM","23/06/2023","11:59:00.000000PM","01/06/2023","11:59:00.000000PM",NA,"","","","",NA,"",11,"","",NA,0,0,0,0,0,0,0,0,0,0,0,0,0,NA,0,"N",NA,NA,0,NA,"","","","",1,"N",NA,"N","N","N","N",1,1,1,1,1,1,1,1,NA,"N",1,"",NA,NA,"AUD",NA,0,0,"N",NA,NA,NA,NA,"","",2,NA,2,NA,999,"","",NA,"","",NA,NA,"TVICAREY","23/07/2023  6:57:26PM",91,4,2023,"B0811",1,"BUSTR-21912"
"STAUS-736-2","PERTH","DRILL SUPP","PSTJB","PSCH",119,"90-6M","TORQUE TOOL CLASS 5",217015,"7000","18038","AU0150","AU0150","CLASS 5 TORQUE TOOL",2023,30,"STAUS",736,2,20,"B0811","BUSTR",0,NA,0,0,4,NA,"APAC18",1,2023-03-27,"08/12/2022","12:00:00.000000AM",2022-12-08,"12:00:00.000000AM","09/01/2023","11:59:00.000000PM","01/07/2023","11:59:00.000000PM",NA,"","","","",NA,"",1,"","",NA,0,0,0,0,0,0,0,0,0,0,0,0,0,NA,0,"N",NA,NA,0,NA,"","","","",1,"N",NA,"Y","N","N","N",1,1,2,1,1,1,1,1,NA,"N",1,"",NA,NA,"AUD",NA,0,0,"N",NA,NA,NA,NA,"","CLASS5_TT_PRE_POST",2,NA,2,NA,999,"","",NA,"","",NA,NA,"TVICAREY","29/05/2023 12:58:08AM",228,12,2022,"B0811",1,"BUSTR-18038"
"STLAD-224-1","LUANDA","DRILL SUPP","PSTJB","WIP",117,"90-6M","Spectrum arm SN: 06332A.152619 / 06332A.300531 to be assessed and raise requisition of spares needed for repairs",178391,"1",NA,NA,NA,NA,2023,30,"STLAD",224,1,10,"B0078","BUOII",0,NA,0,0,1,NA,"",1,2023-03-29,"14/10/2022","12:00:00.000000AM",2022-10-14,"12:00:00.000000AM","30/11/2022","11:59:00.000000PM","30/11/2022","11:59:00.000000PM",NA,"29/03/2023"," 8:00:00.000000AM","29/03/2023"," 5:00:00.000000PM",NA,"",14,"","",NA,0,0,0,0,0,0,0,0,0,0,0,0,0,NA,0,"N",NA,NA,0,NA,"","","","",1,"N",NA,"Y","N","N","N",1,1,1,1,1,1,1,1,NA,"N",1,"WORKORDER",NA,NA,"AOA",NA,0,0,"N",NA,NA,NA,NA,"","",2,NA,2,NA,999,"","",NA,"","",NA,NA,"DANTONIO","14/04/2023  9:26:38AM",283,10,2022,"B0078",72,NA
"STAUS-756-6","PERTH","C&I","NEWBD","OHOT",113,"90-6M","Annulus Panel Assembly",221770,"4000",NA,NA,NA,NA,2023,30,"STAUS",756,6,60,"B0811","",0,NA,0,0,32,NA,"",1,2023-04-02,"06/03/2023","12:00:00.000000AM",2023-01-24,"12:00:00.000000AM","24/02/2023","11:59:00.000000PM","09/03/2023","11:59:00.000000PM",NA,"21/03/2023"," 8:00:00.000000AM","24/03/2023"," 5:00:00.000000PM",NA,"",30,"","",NA,0,0,0,0,0,0,0,0,0,0,0,0,0,NA,0,"N",NA,NA,0,NA,"","","","",1,"N",NA,"Y","N","N","N",1,1,4,1,1,1,1,1,NA,"N",1,"",NA,NA,"AUD",NA,0,0,"N",NA,NA,NA,NA,"","",2,NA,2,NA,999,"","",NA,"","",NA,NA,"LSORIANO","19/07/2023  9:45:21PM",181,1,2023,"B0811",336,NA
"STAUS-830-1","PERTH","C&I","PSTJB","OPEN",112,"90-6M","ASSIMILATE ALL SJDF GEAR NEAR WAREHOUSE FOR TEAM TO PREPARE PACKING LIST",192493,"1",NA,NA,NA,NA,2023,30,"STAUS",830,1,10,"B0811","",0,NA,0,0,4,NA,"",1,2023-04-03,"04/04/2023","12:00:00.000000AM",2023-04-03,"12:00:00.000000AM","03/04/2023","11:59:00.000000PM","06/04/2023","11:59:00.000000PM",NA,"","","","",NA,"",5,"","",NA,0,0,0,0,0,0,0,0,0,0,0,0,0,NA,0,"N",NA,NA,0,NA,"","","","",1,"N",NA,"Y","N","N","N",1,1,1,1,1,1,1,1,NA,"N",1,"",NA,NA,"AUD",NA,0,0,"N",NA,NA,NA,NA,"","",2,NA,2,NA,999,"","",NA,"","",NA,NA,"TVICAREY","11/05/2023  5:54:20PM",112,4,2023,"B0811",4,NA
"STAUS-835-7","PERTH","INTV SLTN","PREJB","OPEN",111,"90-6M","PRE-JOB ACTIVITIES",219032,"7000",NA,NA,NA,NA,2023,30,"STAUS",835,7,10,"B0811","BUSTR",0,NA,0,0,60,NA,"",1,2023-04-04,"04/04/2023","12:00:00.000000AM",2023-04-04,"12:00:00.000000AM","20/04/2023","11:59:00.000000PM","01/05/2023","11:59:00.000000PM",NA,"","","","",NA,"",10,"","",NA,0,0,0,0,0,0,0,0,0,0,0,0,0,NA,0,"N",NA,NA,0,NA,"","","","",1,"N",NA,"Y","N","N","N",1,1,1,1,1,1,1,1,NA,"N",1,"",NA,NA,"AUD",NA,0,0,"N",NA,NA,NA,NA,"","",2,NA,2,NA,999,"","",NA,"","",NA,NA,"TVICAREY","11/05/2023  5:54:20PM",111,4,2023,"B0811",60,NA
"STAUS-824-1","PERTH","C&I","NEWBD","OHWP",109,"90-6M","2 x CRAWLER SERVICING",223873,"4000",NA,NA,NA,NA,2023,30,"STAUS",824,1,10,"B0811","",0,NA,0,0,8,NA,"APAC05",1,2023-04-06,"16/03/2023","12:00:00.000000AM",2023-03-16,"12:00:00.000000AM","22/03/2023","11:59:00.000000PM","22/03/2023","11:59:00.000000PM",NA,"03/04/2023"," 8:00:00.000000AM","03/04/2023"," 5:00:00.000000PM",NA,"",1,"","",NA,0,0,0,0,0,0,0,0,0,0,0,0,0,NA,0,"N",NA,NA,0,NA,"","","","",1,"N",NA,"Y","N","N","N",1,1,1,1,1,1,1,1,NA,"N",1,"",NA,NA,"AUD",NA,0,0,"N",NA,NA,NA,NA,"","",2,NA,2,NA,999,"","",NA,"","",NA,NA,"TVICAREY","11/05/2023  5:54:20PM",130,3,2023,"B0811",8,NA
"STABO-546-1","ABERDEEN","DRILL SUPP","PLAN","OPEN",108,"90-6M","Hotstab / Manifold (Various Manufacturers)",184031,"4260","26533","BP00597","BP00597","STAB HIGH FLOW Ø75MM 2 PORT KIT",2023,30,"STABO",546,1,10,"B0551","BUSTR",0,NA,0,0,4,NA,"EMEA0081",1,2023-04-07,"07/04/2023","12:00:00.000000AM",2023-04-07,"12:00:00.000000AM","30/04/2023","11:59:00.000000PM","30/04/2023","11:59:00.000000PM",NA,"","","","",NA,"",2,"","",NA,0,0,0,0,0,0,0,0,0,0,0,0,0,NA,0,"N",NA,NA,0,NA,"","","","",1,"N",2020502,"N","N","N","N",1,1,1,1,1,1,1,1,NA,"N",1,"WOMUK",NA,NA,"GBP",NA,0,0,"N",NA,NA,NA,NA,"","BP_ABO_HF_STAB_75MM_2PORT",2,NA,2,NA,999,"STABO","ABERDEEN",NA,"","",NA,NA,"PMAHAJAN","07/04/2023  4:27:55AM",108,4,2023,"B0551",1,"BUSTR-26533"
"STABO-556-1","ABERDEEN","DRILL SUPP","PLAN","PSCH",105,"90-6M","DMAC PULL IN TOOL",184031,"4260","9128","BP00315","BP00315","SIT Equipment, Dummy - Tool, Pull-In (DMaC)",2023,30,"STABO",556,1,10,"B0551","BUSTR",0,NA,0,0,37.5,NA,"EMEA0500",1,2023-04-10,"10/04/2023","12:00:00.000000AM",2023-04-10,"12:00:00.000000AM","30/04/2023","11:59:00.000000PM","30/04/2023","11:59:00.000000PM",NA,"","","","",NA,"",16,"","",NA,0,0,0,0,0,0,0,0,0,0,0,0,0,NA,0,"N",NA,NA,0,NA,"","","","",1,"N",2020502,"Y","N","N","N",1,1,1,1,1,1,1,1,NA,"N",1,"WOMUK",NA,NA,"GBP",NA,0,0,"N",NA,NA,NA,NA,"","BP_ABO_SIT_PULL_IN_TOOL",2,NA,2,NA,999,"STABO","ABERDEEN",NA,"","",NA,NA,"DCARLIER","09/05/2023  7:48:10AM",105,4,2023,"B0551",1,"BUSTR-9128"
"STAUS-838-1","PERTH","CLIENTOWN","ADHOC","OHOT",105,"90-6M","Tube work at Expro / Oceaneering",224576,"8000",NA,NA,NA,NA,2023,30,"STAUS",838,1,10,"B0811","",0,NA,0,0,8,NA,"",1,2023-04-10,"06/04/2023","12:00:00.000000AM",2023-04-06,"12:00:00.000000AM","14/01/2024","11:59:00.000000PM","14/01/2024","11:59:00.000000PM",NA,"04/04/2023"," 8:00:00.000000AM","06/04/2023"," 5:00:00.000000PM",NA,"",21,"","",NA,0,0,0,0,0,0,0,0,0,0,0,0,0,NA,0,"N",NA,NA,0,NA,"","","","",1,"N",NA,"Y","N","N","N",1,1,3,1,1,1,1,1,NA,"N",1,"",NA,NA,"AUD",NA,0,0,"N",NA,NA,NA,NA,"","",2,NA,2,NA,999,"","",NA,"","",NA,NA,"TVICAREY","11/05/2023  5:54:20PM",109,4,2023,"B0811",8,NA
"STABO-541-1","ABERDEEN","DRILL SUPP","PLAN","QC",103,"90-6M","COT - Latch Mechanism, Choke (Willis)",184031,"4260","9082","BP00269","BP00269","Change Out Tool (COT) - Latch Mechanism, Choke (Willis)",2023,30,"STABO",541,1,10,"B0551","BUSTR",0,NA,0,0,4,NA,"EMEA0081",1,2023-04-12,"07/04/2023","12:00:00.000000AM",2023-04-07,"12:00:00.000000AM","30/04/2023","11:59:00.000000PM","30/04/2023","11:59:00.000000PM",NA,"","","","",NA,"",16,"","",NA,0,0,0,0,0,0,0,0,0,0,0,0,0,NA,0,"N",NA,NA,0,NA,"","","","",1,"N",2020502,"Y","N","N","N",1,1,1,1,1,1,1,1,NA,"N",1,"WOMUK",NA,NA,"GBP",NA,0,0,"N",NA,NA,NA,NA,"","BP_ABO_COT_LTCH_WILLIS_PP",2,NA,2,NA,999,"","",NA,"","",NA,NA,"DCHRISTIE","25/04/2023  9:16:51AM",108,4,2023,"B0551",1,"BUSTR-9082"
"STAUS-831-5","PERTH","CLIENTOWN","PLAN","OPEN",97,"90-6M","Hose verification - PPTs",204452,"8631",NA,NA,NA,NA,2023,30,"STAUS",831,5,50,"B0811","",0,NA,0,0,16,NA,"",1,2023-04-18,"03/07/2023","12:00:00.000000AM",2023-04-04,"12:00:00.000000AM","06/04/2023","11:59:00.000000PM","14/07/2023","11:59:00.000000PM",NA,"","","","",NA,"",21,"","",NA,0,0,0,0,0,0,0,0,0,0,0,0,0,NA,0,"N",NA,NA,0,NA,"","","","",1,"N",NA,"N","N","N","N",1,2,1,1,1,1,1,1,NA,"N",1,"",NA,NA,"AUD",NA,0,0,"N",NA,NA,NA,NA,"","",2,NA,2,NA,999,"","",NA,"","",NA,NA,"JKAUR3","19/06/2023  6:37:44AM",111,4,2023,"B0811",1,NA
"STAUS-841-1","PERTH","C&I","PREJB","OHOT",97,"90-6M","STRIPPING OF 4"" VECTOR CAPS AND REPORTING",206017,"5091",NA,NA,NA,NA,2023,30,"STAUS",841,1,10,"B0811","",0,NA,0,0,40,NA,"",1,2023-04-18,"17/04/2023","12:00:00.000000AM",2023-04-17,"12:00:00.000000AM","15/05/2023","11:59:00.000000PM","24/04/2023","11:59:00.000000PM",NA,"17/04/2023"," 8:00:00.000000AM","18/04/2023"," 5:00:00.000000PM",NA,"",5,"","",NA,0,0,0,0,0,0,0,0,0,0,0,0,0,NA,0,"N",NA,NA,0,NA,"","","","",1,"N",NA,"Y","N","N","N",1,1,2,1,1,1,1,1,NA,"N",1,"",NA,NA,"AUD",NA,0,0,"N",NA,NA,NA,NA,"","",2,NA,2,NA,999,"","",NA,"","",NA,NA,"LSORIANO","27/06/2023  3:32:36AM",98,4,2023,"B0811",140,NA
"STAUS-848-8","PERTH","INTV SLTN","PREJB","OPEN",96,"90-6M","18.75 FX HDRAULIC WELLHEAD CLT - new brush head",221546,"4655","18416","SI0616","SI0616","CLEANER FX-2 VX ROTARY HUB ASSEMBLY",2023,30,"STAUS",848,8,80,"B0811","BUSTR",0,NA,0,0,1,NA,"APAC05",1,2023-04-19,"26/04/2023","12:00:00.000000AM",2023-04-26,"12:00:00.000000AM","20/06/2023","11:59:00.000000PM","20/06/2023","11:59:00.000000PM",NA,"","","","",NA,"",29,"","",NA,0,0,0,0,0,0,0,0,0,0,0,0,0,NA,0,"N",NA,NA,0,NA,"","","","",1,"N",NA,"N","N","N","N",1,1,1,1,1,1,1,1,NA,"N",1,"",NA,NA,"AUD",NA,0,0,"N",NA,NA,NA,NA,"","",2,NA,2,NA,999,"","",NA,"","",NA,NA,"JKAUR3","19/07/2023  5:20:43AM",89,4,2023,"B0811",1,"BUSTR-18416"
"STAUS-848-13","PERTH","INTV SLTN","PREJB","OPEN",96,"90-6M","Linear Valve Override Tool (LVOT) Type A",221546,"4655","18402","SI0312","SI0312","Linear Valve Override Tool  LVOT - Type A Interface",2023,30,"STAUS",848,13,130,"B0811","BUSTR",0,NA,0,0,1,NA,"USALA034",1,2023-04-19,"26/04/2023","12:00:00.000000AM",2023-04-26,"12:00:00.000000AM","20/06/2023","11:59:00.000000PM","20/06/2023","11:59:00.000000PM",NA,"","","","",NA,"",29,"","",NA,0,0,0,0,0,0,0,0,0,0,0,0,0,NA,0,"N",NA,NA,0,NA,"","","","",1,"N",NA,"N","N","N","N",1,1,1,1,1,1,1,1,NA,"N",1,"",NA,NA,"AUD",NA,0,0,"N",NA,NA,NA,NA,"","",2,NA,2,NA,999,"","",NA,"","",NA,NA,"JKAUR3","19/07/2023  5:20:43AM",89,4,2023,"B0811",1,"BUSTR-18402"
"STLAD-315-1","LUANDA","INTV SLTN","PM3MT","PSCH",96,"90-6M","IRIS MAINTENANCE VARIOUS: Quarterly Maintenance, Flushing + Testing; Biannual Maintenance; Yearly Maintenance + Testing; 4 Year Maintenance; 5 Year Mantenance",704286,"604","7662","IRIS-001","IRIS-001","IRIS
Well Control Package",2023,30,"STLAD",315,1,10,"B0078","BUSTR",0,NA,0,0,40,NA,"EMEA0089",1,2023-04-19,"19/04/2023","12:00:00.000000AM",2023-04-19,"12:00:00.000000AM","21/04/2023","11:59:00.000000PM","21/04/2023","11:59:00.000000PM",NA,"","","","",NA,"N",8,"","",NA,0,0,0,0,0,0,0,0,0,0,0,0,0,NA,0,"N",NA,NA,0,NA,"","","","",1,"",NA,"Y","N","N","N",1,1,1,1,1,1,1,1,NA,"",1,"WORKORDER",NA,NA,"AOA",NA,0,0,"N",NA,NA,NA,NA,"IRIS_TEMPLATE","IRIS_MAINTENANCE",2,NA,2,NA,999,"STLAD","LUANDA",NA,"","PM3MT",NA,NA,"OIIBATCH","",96,4,2023,"B0078",40,"BUSTR-7662"
"STAUS-804-10","PERTH","DRILL SUPP","PREJB","PSCH",95,"90-6M","Class 4 torque bucket - Acid pressure cap",220132,"7000","18261","AU0552","AU0552","ACID PLUG CLASS1-4",2023,30,"STAUS",804,10,100,"B0811","BUSTR",0,NA,0,0,2,NA,"APAC05",1,2023-04-20,"27/02/2023","12:00:00.000000AM",2023-02-20,"12:00:00.000000AM","31/03/2023","11:59:00.000000PM","24/03/2023","11:59:00.000000PM",NA,"14/03/2023"," 8:00:00.000000AM","15/03/2023"," 5:00:00.000000PM",NA,"",12,"","",NA,0,0,0,0,0,0,0,0,0,0,0,0,0,NA,0,"N",NA,NA,0,NA,"","","","",1,"N",2026320,"Y","N","N","N",1,1,2,1,1,1,1,1,NA,"N",1,"",NA,NA,"AUD",NA,0,0,"N",NA,NA,NA,NA,"","",2,NA,2,NA,999,"","",NA,"J-MW-09-C","",NA,NA,"TVICAREY","10/07/2023  6:58:31PM",154,2,2023,"B0811",20,"BUSTR-18261"
"STLAD-271-1","LUANDA","INTV SLTN","PM5YR","OHOT",95,"90-6M","Carry Out 5 Yearly PSL 3 Recertification on Lubricator Assembly",214718,"8000","7668","LUB-001","BO-014-0030","7-1/16” 10K x 7-1/16” 10K x 20’ SPOOL",2023,30,"STLAD",271,1,10,"B0078","BUSTR",0,NA,0,0,1,NA,"EMEA0089",1,2023-04-20,"17/02/2023","12:00:00.000000AM",2023-02-17,"12:00:00.000000AM","17/10/2023","11:59:00.000000PM","17/10/2023","11:59:00.000000PM",NA,"","","","",NA,"",8,"","",NA,0,0,0,0,0,0,0,0,0,0,0,0,0,NA,0,"N",NA,NA,0,NA,"","","","",1,"N",NA,"Y","N","N","N",1,1,2,1,1,1,1,1,NA,"N",1,"WORKORDER",NA,NA,"AOA",NA,0,0,"N",NA,NA,NA,NA,"","",2,NA,2,NA,999,"","",NA,"","",NA,NA,"MKILLOH","20/04/2023  8:19:31AM",157,2,2023,"B0078",1,"BUSTR-7668"
"STLAD-271-2","LUANDA","INTV SLTN","PM5YR","OHOT",95,"90-6M","Carry Out 5 Yearly PSL 3 Recertification on Lubricator Assembly",214718,"8000","7669","LUB-002","BO-014-0050","7-1/16"" 10K x 7-1/16"" 10K API FLANGE PROFILE 20' SPOOL",2023,30,"STLAD",271,2,20,"B0078","BUSTR",0,NA,0,0,1,NA,"EMEA0089",1,2023-04-20,"17/02/2023","12:00:00.000000AM",2023-02-17,"12:00:00.000000AM","17/10/2023","11:59:00.000000PM","17/10/2023","11:59:00.000000PM",NA,"","","","",NA,"",8,"","",NA,0,0,0,0,0,0,0,0,0,0,0,0,0,NA,0,"N",NA,NA,0,NA,"","","","",1,"N",NA,"Y","N","N","N",2,2,3,2,2,2,2,2,NA,"N",1,"WORKORDER",NA,NA,"AOA",NA,0,0,"N",NA,NA,NA,NA,"","",2,NA,2,NA,999,"","",NA,"","",NA,NA,"MKILLOH","20/04/2023  8:19:31AM",157,2,2023,"B0078",1,"BUSTR-7669"
"STLAD-271-4","LUANDA","INTV SLTN","PM5YR","OHOT",95,"90-6M","Carry Out 5 Yearly PSL 3 Recertification on Lubricator Assembly",214718,"8000","7679","LUB-012","BO-014-0029","LUBRICATOR DEPLOYMENT TEE SPOOL - 7.06 - 10K x 10FT",2023,30,"STLAD",271,4,40,"B0078","BUSTR",0,NA,0,0,1,NA,"EMEA0089",1,2023-04-20,"17/02/2023","12:00:00.000000AM",2023-02-17,"12:00:00.000000AM","17/10/2023","11:59:00.000000PM","17/10/2023","11:59:00.000000PM",NA,"","","","",NA,"",8,"","",NA,0,0,0,0,0,0,0,0,0,0,0,0,0,NA,0,"N",NA,NA,0,NA,"","","","",1,"N",NA,"Y","N","N","N",3,3,4,3,3,3,3,3,NA,"N",1,"WORKORDER",NA,NA,"AOA",NA,0,0,"N",NA,NA,NA,NA,"","",2,NA,2,NA,999,"","",NA,"","",NA,NA,"MKILLOH","20/04/2023  8:19:31AM",157,2,2023,"B0078",1,"BUSTR-7679"
"STLAD-271-5","LUANDA","INTV SLTN","PM5YR","OHOT",95,"90-6M","Carry Out 5 Yearly PSL 3 Recertification on Lubricator Assembly",214718,"8000","7671","LUB-004","BO-010-1190","7-1/16” 10K LUB SPOOL - 10’-0” LG.",2023,30,"STLAD",271,5,50,"B0078","BUSTR",0,NA,0,0,1,NA,"EMEA0089",1,2023-04-20,"17/02/2023","12:00:00.000000AM",2023-02-17,"12:00:00.000000AM","17/10/2023","11:59:00.000000PM","17/10/2023","11:59:00.000000PM",NA,"","","","",NA,"",8,"","",NA,0,0,0,0,0,0,0,0,0,0,0,0,0,NA,0,"N",NA,NA,0,NA,"","","","",1,"N",NA,"Y","N","N","N",4,4,5,4,4,4,4,4,NA,"N",1,"WORKORDER",NA,NA,"AOA",NA,0,0,"N",NA,NA,NA,NA,"","",2,NA,2,NA,999,"","",NA,"","",NA,NA,"MKILLOH","20/04/2023  8:19:31AM",157,2,2023,"B0078",1,"BUSTR-7671"
"STLAD-271-7","LUANDA","INTV SLTN","PM5YR","OHOT",95,"90-6M","Carry Out 5 Yearly PSL 3 Recertification on Lubricator Assembly",214718,"8000","7673","LUB-006","BO-014-0044","7-1/16” 10K x 7-1/16” 10K API FLANGE PROFILE 10’ SPOOL",2023,30,"STLAD",271,7,70,"B0078","BUSTR",0,NA,0,0,1,NA,"EMEA0089",1,2023-04-20,"17/02/2023","12:00:00.000000AM",2023-02-17,"12:00:00.000000AM","17/10/2023","11:59:00.000000PM","17/10/2023","11:59:00.000000PM",NA,"","","","",NA,"",8,"","",NA,0,0,0,0,0,0,0,0,0,0,0,0,0,NA,0,"N",NA,NA,0,NA,"","","","",1,"N",NA,"Y","N","N","N",5,5,6,5,5,5,5,5,NA,"N",1,"WORKORDER",NA,NA,"AOA",NA,0,0,"N",NA,NA,NA,NA,"","",2,NA,2,NA,999,"","",NA,"","",NA,NA,"MKILLOH","20/04/2023  8:19:31AM",157,2,2023,"B0078",1,"BUSTR-7673"
"STLAD-271-8","LUANDA","INTV SLTN","PM5YR","OHOT",95,"90-6M","Carry Out 5 Yearly PSL 3 Recertification on Lubricator Assembly",214718,"8000","7676","LUB-009","BO-014-0047","7-1/16” 10K x 7-1/16” 10K API FLANGE PROFILE 10’ SPOOL",2023,30,"STLAD",271,8,80,"B0078","BUSTR",0,NA,0,0,1,NA,"EMEA0089",1,2023-04-20,"17/02/2023","12:00:00.000000AM",2023-02-17,"12:00:00.000000AM","17/10/2023","11:59:00.000000PM","17/10/2023","11:59:00.000000PM",NA,"","","","",NA,"",8,"","",NA,0,0,0,0,0,0,0,0,0,0,0,0,0,NA,0,"N",NA,NA,0,NA,"","","","",1,"N",NA,"Y","N","N","N",6,6,7,6,6,6,6,6,NA,"N",1,"WORKORDER",NA,NA,"AOA",NA,0,0,"N",NA,NA,NA,NA,"","",2,NA,2,NA,999,"","",NA,"","",NA,NA,"MKILLOH","20/04/2023  8:19:31AM",157,2,2023,"B0078",1,"BUSTR-7676"
"STLAD-271-15","LUANDA","INTV SLTN","PM5YR","OHOT",95,"90-6M","Carry Out 5 Yearly PSL 3 Recertification on Lubricator Assembly",214718,"8000","7678","LUB-011","BO-014-0049","7-1/16” 10K x 7-1/16” 10K API FLANGE PROFILE 10’ SPOOL",2023,30,"STLAD",271,15,90,"B0078","BUSTR",0,NA,0,0,1,NA,"USATX001",1,2023-04-20,"17/02/2023","12:00:00.000000AM",2023-02-17,"12:00:00.000000AM","17/10/2023","11:59:00.000000PM","17/10/2023","11:59:00.000000PM",NA,"","","","",NA,"",8,"","",NA,0,0,0,0,0,0,0,0,0,0,0,0,0,NA,0,"N",NA,NA,0,NA,"","","","",1,"N",NA,"Y","N","N","N",7,7,8,7,7,7,7,7,NA,"N",1,"WORKORDER",NA,NA,"AOA",NA,0,0,"N",NA,NA,NA,NA,"","",2,NA,2,NA,999,"","",NA,"","",NA,NA,"MKILLOH","20/04/2023  8:19:31AM",157,2,2023,"B0078",1,"BUSTR-7678"
"STLAD-272-1","LUANDA","INTV SLTN","PM5YR","OHWP",95,"90-6M","Carry out 5 yearly recertification on IRIS.",214718,"8000","7662","IRIS-001","IRIS-001","IRIS
Well Control Package",2023,30,"STLAD",272,1,10,"B0078","BUSTR",0,NA,0,0,1,NA,"EMEA0089",1,2023-04-20,"15/03/2023","12:00:00.000000AM",2023-03-15,"12:00:00.000000AM","27/10/2023","11:59:00.000000PM","27/10/2023","11:59:00.000000PM",NA,"","","","",NA,"",8,"","",NA,0,0,0,0,0,0,0,0,0,0,0,0,0,NA,0,"N",NA,NA,0,NA,"","","","",1,"N",NA,"N","N","N","N",1,1,1,1,1,1,1,1,NA,"N",1,"WORKORDER",NA,NA,"AOA",NA,0,0,"N",NA,NA,NA,NA,"","",2,NA,2,NA,999,"","",NA,"","",NA,NA,"MKILLOH","20/04/2023  8:12:32AM",131,3,2023,"B0078",1,"BUSTR-7662"
"STLAD-272-2","LUANDA","INTV SLTN","PM5YR","OHWP",95,"90-6M","Carry out 5 yearly recertification on dual block ATV",214718,"8000","27375","ATVB-003","13540","ATV Valve - Dual 2.06-10K API 6BX SLAB",2023,30,"STLAD",272,2,20,"B0078","BUSTR",0,NA,0,0,1,NA,"USATX027",1,2023-04-20,"15/03/2023","12:00:00.000000AM",2023-03-15,"12:00:00.000000AM","27/10/2023","11:59:00.000000PM","27/10/2023","11:59:00.000000PM",NA,"","","","",NA,"",8,"","",NA,0,0,0,0,0,0,0,0,0,0,0,0,0,NA,0,"N",NA,NA,0,NA,"","","","",1,"N",NA,"N","N","N","N",1,1,1,1,1,1,1,1,NA,"N",1,"WORKORDER",NA,NA,"AOA",NA,0,0,"N",NA,NA,NA,NA,"","",2,NA,2,NA,999,"","",NA,"","",NA,NA,"MKILLOH","20/04/2023  8:12:32AM",131,3,2023,"B0078",1,"BUSTR-27375"
"STLAD-272-3","LUANDA","INTV SLTN","PM5YR","OHWP",95,"90-6M","Carry out 5 yearly recertification on T-3 Gate Valve",214718,"8000","27289","GTV-004","EE01C05788-0001-1","T-3 GATE VALVE , 7"" 10K MANUAL",2023,30,"STLAD",272,3,30,"B0078","BUSTR",0,NA,0,0,1,NA,"EMEA0089",1,2023-04-20,"15/03/2023","12:00:00.000000AM",2023-03-15,"12:00:00.000000AM","27/10/2023","11:59:00.000000PM","27/10/2023","11:59:00.000000PM",NA,"","","","",NA,"",8,"","",NA,0,0,0,0,0,0,0,0,0,0,0,0,0,NA,0,"N",NA,NA,0,NA,"","","","",1,"N",NA,"N","N","N","N",1,1,1,1,1,1,1,1,NA,"N",1,"WORKORDER",NA,NA,"AOA",NA,0,0,"N",NA,NA,NA,NA,"","",2,NA,2,NA,999,"","",NA,"","",NA,NA,"MKILLOH","20/04/2023  8:12:32AM",131,3,2023,"B0078",1,"BUSTR-27289"
"STLAD-272-4","LUANDA","INTV SLTN","PM5YR","OHWP",95,"90-6M","Carry out 5 yearly recertification on IRIS.",214718,"8000","27295","SRM-004","151-47585","7.06"" 10k SINGLE BOP",2023,30,"STLAD",272,4,40,"B0078","BUSTR",0,NA,0,0,1,NA,"EMEA0089",1,2023-04-20,"15/03/2023","12:00:00.000000AM",2023-03-15,"12:00:00.000000AM","27/10/2023","11:59:00.000000PM","27/10/2023","11:59:00.000000PM",NA,"","","","",NA,"",8,"","",NA,0,0,0,0,0,0,0,0,0,0,0,0,0,NA,0,"N",NA,NA,0,NA,"","","","",1,"N",NA,"N","N","N","N",1,1,1,1,1,1,1,1,NA,"N",1,"WORKORDER",NA,NA,"AOA",NA,0,0,"N",NA,NA,NA,NA,"","",2,NA,2,NA,999,"","",NA,"","",NA,NA,"MKILLOH","20/04/2023  8:12:32AM",131,3,2023,"B0078",1,"BUSTR-27295"
"STLAD-272-6","LUANDA","INTV SLTN","PM5YR","OHWP",95,"90-6M","Carry out 5 yearly recertification on IRIS Pump in spool",214718,"8000","27287","LUB-035","28600-01-01","PUMP IN SPOOL, 7-1/16"" 15M X 7-1/16"" 10M WITH 2X 2-1/16"" 10M OUTLETS-10,000 PSI",2023,30,"STLAD",272,6,60,"B0078","BUSTR",0,NA,0,0,1,NA,"EMEA0089",1,2023-04-20,"15/03/2023","12:00:00.000000AM",2023-03-15,"12:00:00.000000AM","27/10/2023","11:59:00.000000PM","27/10/2023","11:59:00.000000PM",NA,"","","","",NA,"",8,"","",NA,0,0,0,0,0,0,0,0,0,0,0,0,0,NA,0,"N",NA,NA,0,NA,"","","","",1,"N",NA,"N","N","N","N",2,2,2,2,2,2,2,2,NA,"N",1,"WORKORDER",NA,NA,"AOA",NA,0,0,"N",NA,NA,NA,NA,"","",2,NA,2,NA,999,"","",NA,"","",NA,NA,"MKILLOH","20/04/2023  8:12:32AM",131,3,2023,"B0078",1,"BUSTR-27287"
"STLAD-272-7","LUANDA","INTV SLTN","PM5YR","OHWP",95,"90-6M","Carry out 5 yearly recertification on IRIS Spool Adapter",214718,"8000","27294","LUB-036","116985-02","SPOOL ADAPTER, API6A 7.06""-10K - 10K x 7.06"" -10K COMPONENT",2023,30,"STLAD",272,7,70,"B0078","BUSTR",0,NA,0,0,1,NA,"EMEA0089",1,2023-04-20,"15/03/2023","12:00:00.000000AM",2023-03-15,"12:00:00.000000AM","27/10/2023","11:59:00.000000PM","27/10/2023","11:59:00.000000PM",NA,"","","","",NA,"",8,"","",NA,0,0,0,0,0,0,0,0,0,0,0,0,0,NA,0,"N",NA,NA,0,NA,"","","","",1,"N",NA,"N","N","N","N",3,3,3,3,3,3,3,3,NA,"N",1,"WORKORDER",NA,NA,"AOA",NA,0,0,"N",NA,NA,NA,NA,"","",2,NA,2,NA,999,"","",NA,"","",NA,NA,"MKILLOH","20/04/2023  8:12:33AM",131,3,2023,"B0078",1,"BUSTR-27294"
"STLAD-272-8","LUANDA","INTV SLTN","PM5YR","OHWP",95,"90-6M","Carry out 5 yearly recertification on IRIS Frame spool",214718,"8000","27296","LUB-037","116985-01","FRAME SPOOL ADAPTER, API6A 7.06""-10K X 7.06""-10K COMPONENT. FLANGE INTERFACE IS 7-1/16"", 10M, API 6A, TYPE BX, WITH INCONEL 625 INLAID BX-156 RING GROOVE",2023,30,"STLAD",272,8,80,"B0078","BUSTR",0,NA,0,0,1,NA,"EMEA0089",1,2023-04-20,"15/03/2023","12:00:00.000000AM",2023-03-15,"12:00:00.000000AM","27/10/2023","11:59:00.000000PM","27/10/2023","11:59:00.000000PM",NA,"","","","",NA,"",8,"","",NA,0,0,0,0,0,0,0,0,0,0,0,0,0,NA,0,"N",NA,NA,0,NA,"","","","",1,"N",NA,"N","N","N","N",4,4,4,4,4,4,4,4,NA,"N",1,"WORKORDER",NA,NA,"AOA",NA,0,0,"N",NA,NA,NA,NA,"","",2,NA,2,NA,999,"","",NA,"","",NA,NA,"MKILLOH","20/04/2023  8:12:33AM",131,3,2023,"B0078",1,"BUSTR-27296"
"STLAD-272-9","LUANDA","INTV SLTN","PM5YR","OHWP",95,"90-6M","Carry out 5 yearly recertification on IRIS Flushing spool",214718,"8000","27302","LUB-038","116985-03","FLUSHING SPOOL API6A 7.06""-10K COMPONENT. FLANGE INTERFACE IS 7-1/16"", 10M, API 6A, TYPE BX, WITH INCONEL 625 INLAID BX-156 RING GROOVE.",2023,30,"STLAD",272,9,90,"B0078","BUSTR",0,NA,0,0,1,NA,"EMEA0089",1,2023-04-20,"15/03/2023","12:00:00.000000AM",2023-03-15,"12:00:00.000000AM","27/10/2023","11:59:00.000000PM","27/10/2023","11:59:00.000000PM",NA,"","","","",NA,"",8,"","",NA,0,0,0,0,0,0,0,0,0,0,0,0,0,NA,0,"N",NA,NA,0,NA,"","","","",1,"N",NA,"N","N","N","N",5,5,5,5,5,5,5,5,NA,"N",1,"WORKORDER",NA,NA,"AOA",NA,0,0,"N",NA,NA,NA,NA,"","",2,NA,2,NA,999,"","",NA,"","",NA,NA,"MKILLOH","20/04/2023  8:12:33AM",131,3,2023,"B0078",1,"BUSTR-27302"
"STLAD-272-10","LUANDA","INTV SLTN","PM5YR","OHWP",95,"90-6M","Carry out 5 yearly recertification on 2.06"" Elbow",214718,"8000","27283","ELB-003","119660-01","ELBOW API 6A 2.06-10K x 2.50"" SCH PIPE, W/UNS N06625 INLAY.",2023,30,"STLAD",272,10,100,"B0078","BUSTR",0,NA,0,0,1,NA,"EMEA0089",1,2023-04-20,"15/03/2023","12:00:00.000000AM",2023-03-15,"12:00:00.000000AM","27/10/2023","11:59:00.000000PM","27/10/2023","11:59:00.000000PM",NA,"","","","",NA,"",8,"","",NA,0,0,0,0,0,0,0,0,0,0,0,0,0,NA,0,"N",NA,NA,0,NA,"","","","",1,"N",NA,"N","N","N","N",6,6,6,6,6,6,6,6,NA,"N",1,"WORKORDER",NA,NA,"AOA",NA,0,0,"N",NA,NA,NA,NA,"","",2,NA,2,NA,999,"","",NA,"","",NA,NA,"MKILLOH","20/04/2023  8:12:33AM",131,3,2023,"B0078",1,"BUSTR-27283"
"STLAD-272-11","LUANDA","INTV SLTN","PM5YR","OHWP",95,"90-6M","Carry out 5 yearly recertification on 2.06"" Elbow",214718,"8000","27284","ELB-004","119660-02","ELBOW API 6A 2.06-10K x 2.50"" SCH PIPE, W/UNS N06625 INLAY.",2023,30,"STLAD",272,11,110,"B0078","BUSTR",0,NA,0,0,1,NA,"EMEA0089",1,2023-04-20,"15/03/2023","12:00:00.000000AM",2023-03-15,"12:00:00.000000AM","27/10/2023","11:59:00.000000PM","27/10/2023","11:59:00.000000PM",NA,"","","","",NA,"",8,"","",NA,0,0,0,0,0,0,0,0,0,0,0,0,0,NA,0,"N",NA,NA,0,NA,"","","","",1,"N",NA,"N","N","N","N",7,7,7,7,7,7,7,7,NA,"N",1,"WORKORDER",NA,NA,"AOA",NA,0,0,"N",NA,NA,NA,NA,"","",2,NA,2,NA,999,"","",NA,"","",NA,NA,"MKILLOH","20/04/2023  8:12:33AM",131,3,2023,"B0078",1,"BUSTR-27284"
"STLAD-272-12","LUANDA","INTV SLTN","PM5YR","OHWP",95,"90-6M","Carry out 5 yearly recertification on 2.06"" Pipe spool",214718,"8000","27286","LUB-034","120625-01","PIPE SPOOL-2.06-10K API FLG To 2.00XX HUB-1.50 Bore",2023,30,"STLAD",272,12,120,"B0078","BUSTR",0,NA,0,0,1,NA,"EMEA0089",1,2023-04-20,"15/03/2023","12:00:00.000000AM",2023-03-15,"12:00:00.000000AM","27/10/2023","11:59:00.000000PM","27/10/2023","11:59:00.000000PM",NA,"","","","",NA,"",8,"","",NA,0,0,0,0,0,0,0,0,0,0,0,0,0,NA,0,"N",NA,NA,0,NA,"","","","",1,"N",NA,"N","N","N","N",8,8,8,8,8,8,8,8,NA,"N",1,"WORKORDER",NA,NA,"AOA",NA,0,0,"N",NA,NA,NA,NA,"","",2,NA,2,NA,999,"","",NA,"","",NA,NA,"MKILLOH","20/04/2023  8:12:33AM",131,3,2023,"B0078",1,"BUSTR-27286"
"STLAD-273-1","LUANDA","INTV SLTN","PM5YR","OHWP",95,"90-6M","Carry out manufacturer's 5 yearly recertification on Tool Trap.",214718,"8000","7665","TLTRP-003","374289-02","TOOL TRAP",2023,30,"STLAD",273,1,10,"B0078","BUSTR",0,NA,0,0,1,NA,"EMEA0089",1,2023-04-20,"20/02/2023","12:00:00.000000AM",2023-02-20,"12:00:00.000000AM","27/09/2023","11:59:00.000000PM","27/09/2023","11:59:00.000000PM",NA,"","","","",NA,"",8,"","",NA,0,0,0,0,0,0,0,0,0,0,0,0,0,NA,0,"N",NA,NA,0,NA,"","","","",1,"N",NA,"Y","N","N","N",1,1,2,1,1,1,1,1,NA,"N",1,"WORKORDER",NA,NA,"AOA",NA,0,0,"N",NA,NA,NA,NA,"","",2,NA,2,NA,999,"","",NA,"","",NA,NA,"LPETTITT","20/04/2023  2:27:17PM",154,2,2023,"B0078",1,"BUSTR-7665"
"STLAD-316-1","LUANDA","INTV SLTN","PM3MT","PSCH",95,"90-6M","GREASE SKID VARIOUS: Quarterly Maintenance, Flushing + Testing; Biannual Maintenance; Yearly Maintenance + Testing; 4 Year Maintenance; 5 Year Mantenance",704286,"604","7755","GRSK-001","IGB-01","GREASE SKID",2023,30,"STLAD",316,1,10,"B0078","BUSTR",0,NA,0,0,40,NA,"EMEA0089",1,2023-04-20,"04/05/2023","12:00:00.000000AM",2023-05-04,"12:00:00.000000AM","06/05/2023","11:59:00.000000PM","06/05/2023","11:59:00.000000PM",NA,"","","","",NA,"N",8,"","",NA,0,0,0,0,0,0,0,0,0,0,0,0,0,NA,0,"N",NA,NA,0,NA,"","","","",1,"",NA,"Y","N","N","N",1,1,1,1,1,1,1,1,NA,"",1,"WORKORDER",NA,NA,"AOA",NA,0,0,"N",NA,NA,NA,NA,"GREASE_TEMPLATE","GREASE_SKID_MAINT",2,NA,2,NA,999,"STLAD","LUANDA",NA,"","PM3MT",NA,NA,"OIIBATCH","",81,5,2023,"B0078",40,"BUSTR-7755"
"STABO-559-1","ABERDEEN","DRILL SUPP","PLAN","WIP",91,"90-6M","Flowline Override Skid",184031,"4260","8951","BP00129","BP00129","Skid -> Flowline Override",2023,30,"STABO",559,1,10,"B0551","BUSTR",0,NA,0,0,4,NA,"EMEA0500",1,2023-04-24,"19/04/2023","12:00:00.000000AM",2023-04-19,"12:00:00.000000AM","30/04/2023","11:59:00.000000PM","30/04/2023","11:59:00.000000PM",NA,"","","","",NA,"",16,"","",NA,0,0,0,0,0,0,0,0,0,0,0,0,0,NA,0,"N",NA,NA,0,NA,"","","","",1,"N",2020502,"Y","N","N","N",1,1,1,1,1,1,1,1,NA,"N",1,"WOMUK",NA,NA,"GBP",NA,0,0,"N",NA,NA,NA,NA,"","BP_ABO_FLOWLINE_SKID",2,NA,2,NA,999,"","",NA,"","",NA,NA,"DCARLIER","09/05/2023  7:49:07AM",96,4,2023,"B0551",1,"BUSTR-8951"
"STABO-539-1","ABERDEEN","DRILL SUPP","PLAN","QC",88,"60-90","SIT Equipment, Change Out Tool (COT)",184031,"4260","8839","BP00006","BP00006","Change Out Tool (COT)",2023,30,"STABO",539,1,10,"B0551","BUSTR",0,NA,0,0,7.5,NA,"EMEA0501",1,2023-04-27,"07/04/2023","12:00:00.000000AM",2023-04-07,"12:00:00.000000AM","30/04/2023","11:59:00.000000PM","30/04/2023","11:59:00.000000PM",NA,"","","","",NA,"",16,"","",NA,0,0,0,0,0,0,0,0,0,0,0,0,0,NA,0,"N",NA,NA,0,NA,"","","","",1,"N",2020502,"Y","N","N","N",1,1,1,1,1,1,1,1,NA,"N",1,"WOMUK",NA,NA,"GBP",NA,0,0,"N",NA,NA,NA,NA,"","BP_ABO_COT_SIT_PP",2,NA,2,NA,999,"","",NA,"","",NA,NA,"JKAUR3","27/04/2023  5:14:53AM",108,4,2023,"B0551",1,"BUSTR-8839"
"STABO-549-1","ABERDEEN","DRILL SUPP","PLAN","QC",88,"60-90","Basket Deployment Regan Post Pre/ Post",184031,"4260","8988","BP00169","BP00169","Basket, Deployment - Guide Post",2023,30,"STABO",549,1,10,"B0551","BUSTR",0,NA,0,0,4,NA,"EMEA0500",1,2023-04-27,"07/04/2023","12:00:00.000000AM",2023-04-07,"12:00:00.000000AM","30/04/2023","11:59:00.000000PM","30/04/2023","11:59:00.000000PM",NA,"","","","",NA,"",16,"","",NA,0,0,0,0,0,0,0,0,0,0,0,0,0,NA,0,"N",NA,NA,0,NA,"","","","",1,"N",2020502,"Y","N","N","N",1,2,2,1,1,1,1,1,NA,"N",1,"WOMUK",NA,NA,"GBP",NA,0,0,"N",NA,NA,NA,NA,"","BP_ABO_BASKET_REGAN_PST",2,NA,2,NA,999,"","",NA,"","",NA,NA,"JKAUR3","27/04/2023  5:14:23AM",108,4,2023,"B0551",1,"BUSTR-8988"
"STABO-550-1","ABERDEEN","DRILL SUPP","PLAN","QC",88,"60-90","GL4 Guide Post Ext - 1865mm",184031,"4260","20921","BP00504","BP00504","Extension, GL4 Guide Post - 1865mm (Imenco) - MODIFIED",2023,30,"STABO",550,1,10,"B0551","BUSTR",0,NA,0,0,4,NA,"EMEA0500",1,2023-04-27,"07/04/2023","12:00:00.000000AM",2023-04-07,"12:00:00.000000AM","30/04/2023","11:59:00.000000PM","30/04/2023","11:59:00.000000PM",NA,"","","","",NA,"",16,"","",NA,0,0,0,0,0,0,0,0,0,0,0,0,0,NA,0,"N",NA,NA,0,NA,"","","","",1,"N",2020502,"Y","N","N","N",1,1,1,1,1,1,1,1,NA,"N",1,"WOMUK",NA,NA,"GBP",NA,0,0,"N",NA,NA,NA,NA,"","BP_ABO_GUIDE_POST_EXT_PP",2,NA,2,NA,999,"","",NA,"","",NA,NA,"JKAUR3","27/04/2023  5:14:07AM",108,4,2023,"B0551",1,"BUSTR-20921"
"STABO-551-1","ABERDEEN","DRILL SUPP","PLAN","QC",88,"60-90","GL4 Guide Post Ext - 1865mm",184031,"4260","20917","BP00505","BP00505","Extension, GL4 Guide Post - 1865mm (Imenco) - MODIFIED",2023,30,"STABO",551,1,10,"B0551","BUSTR",0,NA,0,0,4,NA,"EMEA0500",1,2023-04-27,"07/04/2023","12:00:00.000000AM",2023-04-07,"12:00:00.000000AM","30/04/2023","11:59:00.000000PM","30/04/2023","11:59:00.000000PM",NA,"","","","",NA,"",16,"","",NA,0,0,0,0,0,0,0,0,0,0,0,0,0,NA,0,"N",NA,NA,0,NA,"","","","",1,"N",2020502,"Y","N","N","N",1,1,1,1,1,1,1,1,NA,"N",1,"WOMUK",NA,NA,"GBP",NA,0,0,"N",NA,NA,NA,NA,"","BP_ABO_GUIDE_POST_EXT_PP",2,NA,2,NA,999,"","",NA,"","",NA,NA,"JKAUR3","27/04/2023  4:38:49AM",108,4,2023,"B0551",1,"BUSTR-20917"
"STABO-552-1","ABERDEEN","DRILL SUPP","PLAN","QC",88,"60-90","GL4 Guide Post Ext - 1865mm",184031,"4260","20918","BP00506","BP00506","Extension, GL4 Guide Post - 1865mm (Imenco) - MODIFIED",2023,30,"STABO",552,1,10,"B0551","BUSTR",0,NA,0,0,4,NA,"EMEA0500",1,2023-04-27,"07/04/2023","12:00:00.000000AM",2023-04-07,"12:00:00.000000AM","30/04/2023","11:59:00.000000PM","30/04/2023","11:59:00.000000PM",NA,"","","","",NA,"",16,"","",NA,0,0,0,0,0,0,0,0,0,0,0,0,0,NA,0,"N",NA,NA,0,NA,"","","","",1,"N",2020502,"Y","N","N","N",1,1,1,1,1,1,1,1,NA,"N",1,"WOMUK",NA,NA,"GBP",NA,0,0,"N",NA,NA,NA,NA,"","BP_ABO_GUIDE_POST_EXT_PP",2,NA,2,NA,999,"","",NA,"","",NA,NA,"JKAUR3","27/04/2023  4:38:24AM",108,4,2023,"B0551",1,"BUSTR-20918"
"STABO-553-1","ABERDEEN","DRILL SUPP","PLAN","QC",88,"60-90","Anchor, Guide Wire - Padeye (Imenco)",184031,"4260","20946","BP00507","BP00507","Anchor, Guide Wire - Padeye (Imenco)",2023,30,"STABO",553,1,10,"B0551","BUSTR",0,NA,0,0,4,NA,"EMEA0500",1,2023-04-27,"07/04/2023","12:00:00.000000AM",2023-04-07,"12:00:00.000000AM","30/04/2023","11:59:00.000000PM","30/04/2023","11:59:00.000000PM",NA,"","","","",NA,"",16,"","",NA,0,0,0,0,0,0,0,0,0,0,0,0,0,NA,0,"N",NA,NA,0,NA,"","","","",1,"N",2020502,"Y","N","N","N",1,1,1,1,1,1,1,1,NA,"N",1,"WOMUK",NA,NA,"GBP",NA,0,0,"N",NA,NA,NA,NA,"","BP_ABO_IMENCO_ANCHOR_PP",2,NA,2,NA,999,"","",NA,"","",NA,NA,"JKAUR3","27/04/2023  4:38:07AM",108,4,2023,"B0551",1,"BUSTR-20946"
"STABO-554-1","ABERDEEN","DRILL SUPP","PLAN","QC",88,"60-90","Anchor, Guide Wire - Padeye (Imenco)",184031,"4260","20947","BP00508","BP00508","Anchor, Guide Wire - Padeye (Imenco)",2023,30,"STABO",554,1,10,"B0551","BUSTR",0,NA,0,0,4,NA,"EMEA0500",1,2023-04-27,"07/04/2023","12:00:00.000000AM",2023-04-07,"12:00:00.000000AM","30/04/2023","11:59:00.000000PM","30/04/2023","11:59:00.000000PM",NA,"","","","",NA,"",16,"","",NA,0,0,0,0,0,0,0,0,0,0,0,0,0,NA,0,"N",NA,NA,0,NA,"","","","",1,"N",2020502,"Y","N","N","N",1,1,1,1,1,1,1,1,NA,"N",1,"WOMUK",NA,NA,"GBP",NA,0,0,"N",NA,NA,NA,NA,"","BP_ABO_IMENCO_ANCHOR_PP",2,NA,2,NA,999,"","",NA,"","",NA,NA,"JKAUR3","27/04/2023  4:37:50AM",108,4,2023,"B0551",1,"BUSTR-20947"
"STABO-555-1","ABERDEEN","DRILL SUPP","PLAN","QC",88,"60-90","Anchor, Guide Wire - Padeye (Imenco)",184031,"4260","20950","BP00509","BP00509","Anchor, Guide Wire - Padeye (Imenco)",2023,30,"STABO",555,1,10,"B0551","BUSTR",0,NA,0,0,4,NA,"EMEA0500",1,2023-04-27,"07/04/2023","12:00:00.000000AM",2023-04-07,"12:00:00.000000AM","30/04/2023","11:59:00.000000PM","30/04/2023","11:59:00.000000PM",NA,"","","","",NA,"",16,"","",NA,0,0,0,0,0,0,0,0,0,0,0,0,0,NA,0,"N",NA,NA,0,NA,"","","","",1,"N",2020502,"Y","N","N","N",1,1,1,1,1,1,1,1,NA,"N",1,"WOMUK",NA,NA,"GBP",NA,0,0,"N",NA,NA,NA,NA,"","BP_ABO_IMENCO_ANCHOR_PP",2,NA,2,NA,999,"","",NA,"","",NA,NA,"JKAUR3","27/04/2023  4:37:33AM",108,4,2023,"B0551",1,"BUSTR-20950"
"STABO-558-1","ABERDEEN","DRILL SUPP","PLAN","QC",88,"60-90","HPU",184031,"4260","8907","BP00079","BP00079","SIT Equipment, Hydraulic Power Unit",2023,30,"STABO",558,1,10,"B0551","BUSTR",0,NA,0,0,4,NA,"EMEA0500",1,2023-04-27,"19/04/2023","12:00:00.000000AM",2023-04-19,"12:00:00.000000AM","30/04/2023","11:59:00.000000PM","30/04/2023","11:59:00.000000PM",NA,"21/04/2023"," 8:00:00.000000AM","21/04/2023"," 5:00:00.000000PM",NA,"",16,"","",NA,0,0,0,0,0,0,0,0,0,0,0,0,0,NA,0,"N",NA,NA,0,NA,"","","","",1,"N",2020502,"Y","N","N","N",1,1,1,1,1,1,1,1,NA,"N",1,"WOMUK",NA,NA,"GBP",NA,0,0,"N",NA,NA,NA,NA,"","BP_ABO_HPU_PP",2,NA,2,NA,999,"","",NA,"","",NA,NA,"JKAUR3","27/04/2023  4:37:09AM",96,4,2023,"B0551",1,"BUSTR-8907"
"STABO-560-1","ABERDEEN","DRILL SUPP","PLAN","QC",88,"60-90","FTP Skid",184031,"4260","9133","BP00320","BP00320","Fly-to-Place (FTP) Tool, Skid",2023,30,"STABO",560,1,10,"B0551","BUSTR",0,NA,0,0,4,NA,"EMEA0502",1,2023-04-27,"19/04/2023","12:00:00.000000AM",2023-04-19,"12:00:00.000000AM","30/04/2023","11:59:00.000000PM","30/04/2023","11:59:00.000000PM",NA,"24/04/2023"," 8:00:00.000000AM","24/04/2023"," 5:00:00.000000PM",NA,"",16,"","",NA,0,0,0,0,0,0,0,0,0,0,0,0,0,NA,0,"N",NA,NA,0,NA,"","","","",1,"N",2020502,"Y","N","N","N",1,1,1,1,1,1,1,1,NA,"N",1,"WOMUK",NA,NA,"GBP",NA,0,0,"N",NA,NA,NA,NA,"","BP_ABO_17H_FTP_SKID_PP",2,NA,2,NA,999,"","",NA,"","",NA,NA,"JKAUR3","27/04/2023  4:36:51AM",96,4,2023,"B0551",1,"BUSTR-9133"
"STABO-561-1","ABERDEEN","DRILL SUPP","PLAN","QC",88,"60-90","FTP Single / Dual Drive Unit",184031,"4260","9086","BP00273","BP00273","Fly-to-Place (FTP) Tool, Single Drive Unit",2023,30,"STABO",561,1,10,"B0551","BUSTR",0,NA,0,0,3,NA,"EMEA0501",1,2023-04-27,"19/04/2023","12:00:00.000000AM",2023-04-19,"12:00:00.000000AM","30/04/2023","11:59:00.000000PM","30/04/2023","11:59:00.000000PM",NA,"","","","",NA,"",16,"","",NA,0,0,0,0,0,0,0,0,0,0,0,0,0,NA,0,"N",NA,NA,0,NA,"","","","",1,"N",2020502,"Y","N","N","N",1,1,1,1,1,1,1,1,NA,"N",1,"WOMUK",NA,NA,"GBP",NA,0,0,"N",NA,NA,NA,NA,"","BP_ABO_FTP_DRIVE_PP",2,NA,2,NA,999,"","",NA,"","",NA,NA,"JKAUR3","27/04/2023  4:36:29AM",96,4,2023,"B0551",1,"BUSTR-9086"
"STABO-562-1","ABERDEEN","DRILL SUPP","PLAN","QC",88,"60-90","SIT Equipment, Change Out Tool (COT)",184031,"4260","8840","BP00007","BP00007","SIT Equipment, Change Out Tool (COT)",2023,30,"STABO",562,1,10,"B0551","BUSTR",0,NA,0,0,7.5,NA,"EMEA0081",1,2023-04-27,"19/04/2023","12:00:00.000000AM",2023-04-19,"12:00:00.000000AM","30/04/2023","11:59:00.000000PM","30/04/2023","11:59:00.000000PM",NA,"","","","",NA,"",16,"","",NA,0,0,0,0,0,0,0,0,0,0,0,0,0,NA,0,"N",NA,NA,0,NA,"","","","",1,"N",2020502,"Y","N","N","N",1,1,1,1,1,1,1,1,NA,"N",1,"WOMUK",NA,NA,"GBP",NA,0,0,"N",NA,NA,NA,NA,"","BP_ABO_COT_SIT_PP",2,NA,2,NA,999,"","",NA,"","",NA,NA,"JKAUR3","27/04/2023  4:36:03AM",96,4,2023,"B0551",1,"BUSTR-8840"
"STABO-563-1","ABERDEEN","DRILL SUPP","PLAN","QC",88,"60-90","COT Transport Frame",184031,"4260","8878","BP00047","BP00047","Transportation Frame, Change Out Tool (COT)",2023,30,"STABO",563,1,10,"B0551","BUSTR",0,NA,0,0,4,NA,"EMEA0081",1,2023-04-27,"19/04/2023","12:00:00.000000AM",2023-04-19,"12:00:00.000000AM","30/04/2023","11:59:00.000000PM","30/04/2023","11:59:00.000000PM",NA,"","","","",NA,"",16,"","",NA,0,0,0,0,0,0,0,0,0,0,0,0,0,NA,0,"N",NA,NA,0,NA,"","","","",1,"N",2020502,"Y","N","N","N",1,1,1,1,1,1,1,1,NA,"N",1,"WOMUK",NA,NA,"GBP",NA,0,0,"N",NA,NA,NA,NA,"","BP_ABO_COT_TRANS_FRAME_PP",2,NA,2,NA,999,"","",NA,"","",NA,NA,"JKAUR3","27/04/2023  4:35:39AM",96,4,2023,"B0551",1,"BUSTR-8878"
"STABO-564-1","ABERDEEN","DRILL SUPP","PLAN","QC",88,"60-90","COT - Latch Mechanism, Choke (Willis)",184031,"4260","9082","BP00269","BP00269","Change Out Tool (COT) - Latch Mechanism, Choke (Willis)",2023,30,"STABO",564,1,10,"B0551","BUSTR",0,NA,0,0,4,NA,"EMEA0081",1,2023-04-27,"19/04/2023","12:00:00.000000AM",2023-04-19,"12:00:00.000000AM","30/04/2023","11:59:00.000000PM","30/04/2023","11:59:00.000000PM",NA,"","","","",NA,"",16,"","",NA,0,0,0,0,0,0,0,0,0,0,0,0,0,NA,0,"N",NA,NA,0,NA,"","","","",1,"N",2020502,"Y","N","N","N",1,1,1,1,1,1,1,1,NA,"N",1,"WOMUK",NA,NA,"GBP",NA,0,0,"N",NA,NA,NA,NA,"","BP_ABO_COT_LTCH_WILLIS_PP",2,NA,2,NA,999,"","",NA,"","",NA,NA,"JKAUR3","27/04/2023  4:35:21AM",96,4,2023,"B0551",1,"BUSTR-9082"
"STABO-565-1","ABERDEEN","DRILL SUPP","PLAN","QC",88,"60-90","17H TORQUE TOOL",184031,"4260","9056","BP00242","BP00242","Torque Tool, Change Out Tool (COT) - 17H High (KFL Pod)",2023,30,"STABO",565,1,10,"B0551","BUSTR",0,NA,0,0,2.5,NA,"EMEA0501",1,2023-04-27,"19/04/2023","12:00:00.000000AM",2023-04-19,"12:00:00.000000AM","30/04/2023","11:59:00.000000PM","30/04/2023","11:59:00.000000PM",NA,"","","","",NA,"",16,"","",NA,0,0,0,0,0,0,0,0,0,0,0,0,0,NA,0,"N",NA,NA,0,NA,"","","","",1,"N",2020502,"Y","N","N","N",1,1,1,1,1,1,1,1,NA,"N",1,"WOMUK",NA,NA,"GBP",NA,0,0,"N",NA,NA,NA,NA,"","BP_ABO_17H_T/T_COT",2,NA,2,NA,999,"","",NA,"","",NA,NA,"JKAUR3","27/04/2023  4:35:04AM",96,4,2023,"B0551",1,"BUSTR-9056"
"STABO-566-1","ABERDEEN","DRILL SUPP","PLAN","QC",88,"60-90","Torque Tool - 17H, High (100-2000 Nm)",184031,"4260","9057","BP00243","BP00243","Torque Tool, Change Out Tool (COT) - 17H High (KFL Pod)",2023,30,"STABO",566,1,10,"B0551","BUSTR",0,NA,0,0,3,NA,"EMEA0501",1,2023-04-27,"19/04/2023","12:00:00.000000AM",2023-04-19,"12:00:00.000000AM","30/04/2023","11:59:00.000000PM","30/04/2023","11:59:00.000000PM",NA,"","","","",NA,"",16,"","",NA,0,0,0,0,0,0,0,0,0,0,0,0,0,NA,0,"N",NA,NA,0,NA,"","","","",1,"N",2020502,"Y","N","N","N",1,1,1,1,1,1,1,1,NA,"N",1,"WOMUK",NA,NA,"GBP",NA,0,0,"N",NA,NA,NA,NA,"","BP_ABO_17H_S7_TT-PP",2,NA,2,NA,999,"","",NA,"","",NA,NA,"JKAUR3","27/04/2023  4:34:50AM",96,4,2023,"B0551",1,"BUSTR-9057"
"STAUS-854-1","PERTH","CLIENTOWN","ADHOC","PSCH",88,"60-90","Moving KC4-3 tool from SCM to work bench for Surface Technology inspection. Tool to be moved back to SCM when inspection is complete.",221703,"3000",NA,NA,NA,NA,2023,30,"STAUS",854,1,10,"B0811","",0,NA,0,0,1,NA,"",1,2023-04-27,"01/05/2023","12:00:00.000000AM",2023-05-01,"12:00:00.000000AM","01/05/2023","11:59:00.000000PM","01/05/2023","11:59:00.000000PM",NA,"","","","",NA,"",1,"FBHATTI","",NA,0,0,0,0,0,0,0,0,0,0,0,0,0,NA,0,"N",NA,NA,0,NA,"","","","",1,"N",NA,"N","N","N","N",1,1,1,1,1,1,1,1,NA,"N",1,"",NA,NA,"AUD",NA,0,0,"N",NA,NA,NA,NA,"","",2,NA,2,NA,999,"","",NA,"","",NA,NA,"AWTAYLOR","18/07/2023  6:24:51PM",84,5,2023,"B0811",1,NA
"STAUS-854-5","PERTH","CLIENTOWN","ADHOC","OPEN",83,"60-90","Perform inspections and send gate valves. Send KC4-3 hub and gate valves for fabricators for welding",221703,"4100",NA,NA,NA,NA,2023,30,"STAUS",854,5,50,"B0811","",0,NA,0,0,8,NA,"",1,2023-05-02,"22/06/2023","12:00:00.000000AM",2023-05-01,"12:00:00.000000AM","01/05/2023","11:59:00.000000PM","22/06/2023","11:59:00.000000PM",NA,"","","","",NA,"",1,"FBHATTI","",NA,0,0,0,0,0,0,0,0,0,0,0,0,0,NA,0,"N",NA,NA,0,NA,"","","","",1,"N",NA,"N","N","N","N",1,1,1,1,1,1,1,1,NA,"N",1,"",NA,NA,"AUD",NA,0,0,"N",NA,NA,NA,NA,"","",2,NA,2,NA,999,"","",NA,"","",NA,NA,"AWTAYLOR","18/07/2023  6:24:51PM",84,5,2023,"B0811",1,NA
"STAUS-854-12","PERTH","CLIENTOWN","ADHOC","OPEN",83,"60-90","Pack equipment - Collection by TFMC",221703,"4000",NA,NA,NA,NA,2023,30,"STAUS",854,12,120,"B0811","",0,NA,0,0,8,NA,"",1,2023-05-02,"18/10/2023","12:00:00.000000AM",2023-05-01,"12:00:00.000000AM","01/05/2023","11:59:00.000000PM","18/10/2023","11:59:00.000000PM",NA,"","","","",NA,"",1,"FBHATTI","",NA,0,0,0,0,0,0,0,0,0,0,0,0,0,NA,0,"N",NA,NA,0,NA,"","","","",1,"N",NA,"N","N","N","N",1,1,1,1,1,1,1,1,NA,"N",1,"",NA,NA,"AUD",NA,0,0,"N",NA,NA,NA,NA,"","",2,NA,2,NA,999,"","",NA,"","",NA,NA,"AWTAYLOR","18/07/2023  6:24:51PM",84,5,2023,"B0811",1,NA
"STABO-567-1","ABERDEEN","DRILL SUPP","PLAN","QC",81,"60-90","Seal Plate COT, Single Bore - 8""/10"" Pre/Post",184031,"4260","9162","BP00349","BP00349","Seal Plate Change-Out Tool, Single Bore - 8""/10""",2023,30,"STABO",567,1,10,"B0551","BUSTR",0,NA,0,0,3,NA,"EMEA0501",1,2023-05-04,"27/04/2023","12:00:00.000000AM",2023-04-27,"12:00:00.000000AM","31/05/2023","11:59:00.000000PM","31/05/2023","11:59:00.000000PM",NA,"","","","",NA,"",16,"","",NA,0,0,0,0,0,0,0,0,0,0,0,0,0,NA,0,"N",NA,NA,0,NA,"","","","",1,"N",2020502,"Y","N","N","N",1,1,1,1,1,1,1,1,NA,"N",1,"WOMUK",NA,NA,"GBP",NA,0,0,"N",NA,NA,NA,NA,"","BP_ABO_COT_SNGBORE_8""/10""",2,NA,2,NA,999,"","",NA,"","",NA,NA,"JKAUR3","04/05/2023  4:43:45AM",88,4,2023,"B0551",1,"BUSTR-9162"
"STABO-568-1","ABERDEEN","DRILL SUPP","PLAN","QC",81,"60-90","HUB CLEANING TOOL, SINGLE / MULTI",184031,"4260","8846","BP00013","BP00013","Hub Cleaning Tool, Single Bore - 8""/10"" (Sch/Foin)",2023,30,"STABO",568,1,10,"B0551","BUSTR",0,NA,0,0,2.5,NA,"EMEA0081",1,2023-05-04,"27/04/2023","12:00:00.000000AM",2023-04-27,"12:00:00.000000AM","31/05/2023","11:59:00.000000PM","31/05/2023","11:59:00.000000PM",NA,"","","","",NA,"",16,"","",NA,0,0,0,0,0,0,0,0,0,0,0,0,0,NA,0,"N",NA,NA,0,NA,"","","","",1,"N",2020502,"Y","N","N","N",1,1,1,1,1,1,1,1,NA,"N",1,"WOMUK",NA,NA,"GBP",NA,0,0,"N",NA,NA,NA,NA,"","BP_ABO_HUB8-10_CT_PP",2,NA,2,NA,999,"","",NA,"","",NA,NA,"JKAUR3","04/05/2023  4:43:22AM",88,4,2023,"B0551",1,"BUSTR-8846"
"STABO-569-1","ABERDEEN","DRILL SUPP","PLAN","QC",81,"60-90","Seal Plate COT, Single Bore - 8""/10"" Pre/Post",184031,"4260","9163","BP00350","BP00350","Seal Plate Change-Out Tool, Single Bore - 8""/10""",2023,30,"STABO",569,1,10,"B0551","BUSTR",0,NA,0,0,3,NA,"EMEA0501",1,2023-05-04,"27/04/2023","12:00:00.000000AM",2023-04-27,"12:00:00.000000AM","31/05/2023","11:59:00.000000PM","31/05/2023","11:59:00.000000PM",NA,"","","","",NA,"",16,"","",NA,0,0,0,0,0,0,0,0,0,0,0,0,0,NA,0,"N",NA,NA,0,NA,"","","","",1,"N",2020502,"Y","N","N","N",1,1,1,1,1,1,1,1,NA,"N",1,"WOMUK",NA,NA,"GBP",NA,0,0,"N",NA,NA,NA,NA,"","BP_ABO_COT_SNGBORE_8""/10""",2,NA,2,NA,999,"","",NA,"","",NA,NA,"JKAUR3","04/05/2023  4:43:04AM",88,4,2023,"B0551",1,"BUSTR-9163"
"STABO-570-1","ABERDEEN","DRILL SUPP","PLAN","QC",81,"60-90","HUB CLEANING TOOL, ANNULUS (Sch/Foin)",184031,"4260","8844","BP00011","BP00011","Hub Cleaning Tool, Annulus (Sch/Foin)",2023,30,"STABO",570,1,10,"B0551","BUSTR",0,NA,0,0,3,NA,"EMEA0501",1,2023-05-04,"27/04/2023","12:00:00.000000AM",2023-04-27,"12:00:00.000000AM","31/05/2023","11:59:00.000000PM","31/05/2023","11:59:00.000000PM",NA,"","","","",NA,"",16,"","",NA,0,0,0,0,0,0,0,0,0,0,0,0,0,NA,0,"N",NA,NA,0,NA,"","","","",1,"N",2020502,"N","N","N","N",1,1,1,1,1,1,1,1,NA,"N",1,"WOMUK",NA,NA,"GBP",NA,0,0,"N",NA,NA,NA,NA,"","BP_ABO_HUB_CT_ANNULUS_PP",2,NA,2,NA,999,"","",NA,"","",NA,NA,"JKAUR3","04/05/2023  4:42:24AM",88,4,2023,"B0551",1,"BUSTR-8844"
"STAUS-841-2","PERTH","C&I","PREJB","OHOT",81,"60-90","INSPECTION OF 6"" CVC FLOODING CAPS",206017,"5091",NA,NA,NA,NA,2023,30,"STAUS",841,2,20,"B0811","",0,NA,0,0,30,NA,"",1,2023-05-04,"25/04/2023","12:00:00.000000AM",2023-04-17,"12:00:00.000000AM","15/05/2023","11:59:00.000000PM","02/05/2023","11:59:00.000000PM",NA,"","","","",NA,"",5,"","",NA,0,0,0,0,0,0,0,0,0,0,0,0,0,NA,0,"N",NA,NA,0,NA,"","","","",1,"N",NA,"Y","N","N","N",1,2,1,1,1,1,1,1,NA,"N",1,"",NA,NA,"AUD",NA,0,0,"N",NA,NA,NA,NA,"","",2,NA,2,NA,999,"","",NA,"","",NA,NA,"LSORIANO","27/06/2023  3:32:36AM",98,4,2023,"B0811",140,NA
"STAUS-819-1","PERTH","C&I","PSTJB","OHWP",77,"60-90","TRITECH SUPER ZIP JET PUMP",221988,"7000","18161","AU0413","AU0413","PUMP SUPER ZIPJET EXCAVATION AND JETTING",2023,30,"STAUS",819,1,10,"B0811","BUSTR",0,NA,0,0,16,NA,"APAC05",1,2023-05-08,"14/03/2023","12:00:00.000000AM",2023-03-14,"12:00:00.000000AM","31/03/2023","11:59:00.000000PM","31/03/2023","11:59:00.000000PM",NA,"16/03/2023"," 8:00:00.000000AM","08/05/2023"," 5:00:00.000000PM",NA,"",11,"","",NA,0,0,0,0,0,0,0,0,0,0,0,0,0,NA,0,"N",NA,NA,0,NA,"","","","",1,"N",NA,"Y","N","N","N",1,3,5,1,1,1,1,1,NA,"N",1,"",NA,NA,"AUD",NA,0,0,"N",NA,NA,NA,NA,"","APAC_SUPER ZIPJET_PST",2,NA,2,NA,999,"","",NA,"J-MW-08-D","",NA,NA,"TVICAREY","18/07/2023 11:35:49PM",132,3,2023,"B0811",1,"BUSTR-18161"
"STABO-491-1","ABERDEEN","DRILL SUPP","PLAN","OHWD",76,"60-90","TDU Grabber (Standard / Heavy Duty)",184031,"4060","8881","BP00051","BP00051","Grabber (TDU), Standard",2023,30,"STABO",491,1,10,"B0551","BUSTR",0,NA,0,0,2.75,NA,"EMEA0081",1,2023-05-09,"13/01/2023","12:00:00.000000AM",2023-01-13,"12:00:00.000000AM","31/01/2023","11:59:00.000000PM","31/01/2023","11:59:00.000000PM",NA,"","","","",NA,"",16,"","",NA,0,0,0,0,0,0,0,0,0,0,0,0,0,NA,0,"N",NA,NA,0,NA,"","","","",1,"N",2020502,"Y","N","N","N",1,1,1,1,1,1,1,1,NA,"N",1,"WOMUK",NA,NA,"GBP",NA,0,0,"N",NA,NA,NA,NA,"","BP_ABO_TDU_GRABBER_PP",2,NA,2,NA,999,"","",NA,"","",NA,NA,"DCARLIER","09/05/2023  7:49:07AM",192,1,2023,"B0551",1,"BUSTR-8881"
"STABO-491-2","ABERDEEN","DRILL SUPP","PLAN","OHWD",76,"60-90","TDU Grabber (Standard / Heavy Duty)",184031,"4060","8882","BP00052","BP00052","Grabber (TDU), Standard",2023,30,"STABO",491,2,20,"B0551","BUSTR",0,NA,0,0,2.75,NA,"EMEA0501",1,2023-05-09,"13/01/2023","12:00:00.000000AM",2023-01-13,"12:00:00.000000AM","31/01/2023","11:59:00.000000PM","31/01/2023","11:59:00.000000PM",NA,"","","","",NA,"",16,"","",NA,0,0,0,0,0,0,0,0,0,0,0,0,0,NA,0,"N",NA,NA,0,NA,"","","","",1,"N",2020502,"Y","N","N","N",1,1,1,1,1,1,1,1,NA,"N",1,"WOMUK",NA,NA,"GBP",NA,0,0,"N",NA,NA,NA,NA,"","BP_ABO_TDU_GRABBER_PP",2,NA,2,NA,999,"","",NA,"","",NA,NA,"DCARLIER","09/05/2023  7:49:07AM",192,1,2023,"B0551",1,"BUSTR-8882"
"STABO-491-3","ABERDEEN","DRILL SUPP","PLAN","OHWD",76,"60-90","TDU Grabber (Standard / Heavy Duty)",184031,"4060","8887","BP00057","BP00057","Grabber (TDU), Standard",2023,30,"STABO",491,3,30,"B0551","BUSTR",0,NA,0,0,2.75,NA,"EMEA0501",1,2023-05-09,"13/01/2023","12:00:00.000000AM",2023-01-13,"12:00:00.000000AM","31/01/2023","11:59:00.000000PM","31/01/2023","11:59:00.000000PM",NA,"","","","",NA,"",16,"","",NA,0,0,0,0,0,0,0,0,0,0,0,0,0,NA,0,"N",NA,NA,0,NA,"","","","",1,"N",2020502,"Y","N","N","N",1,1,1,1,1,1,1,1,NA,"N",1,"WOMUK",NA,NA,"GBP",NA,0,0,"N",NA,NA,NA,NA,"","BP_ABO_TDU_GRABBER_PP",2,NA,2,NA,999,"","",NA,"","",NA,NA,"DCARLIER","09/05/2023  7:49:07AM",192,1,2023,"B0551",1,"BUSTR-8887"
"STAUS-848-20","PERTH","INTV SLTN","PREJB","OPEN",75,"60-90","ROV Intensifier panel 10,000 psi",221546,"5655","18280","AUX0040","AUX0040","INTENSIFIER 4:1 1/4"" BSPP PORTS STEEL HYD OIL HC2-4.0-B-1",2023,30,"STAUS",848,20,200,"B0811","BUSTR",0,NA,0,0,1,NA,"AUSST003",1,2023-05-10,"26/04/2023","12:00:00.000000AM",2023-04-26,"12:00:00.000000AM","20/06/2023","11:59:00.000000PM","20/06/2023","11:59:00.000000PM",NA,"","","","",NA,"",29,"","",NA,0,0,0,0,0,0,0,0,0,0,0,0,0,NA,0,"N",NA,NA,0,NA,"","","","",1,"N",NA,"N","N","N","N",1,1,1,1,1,1,1,1,NA,"N",1,"",NA,NA,"AUD",NA,0,0,"N",NA,NA,NA,NA,"","",2,NA,2,NA,999,"","",NA,"","",NA,NA,"JKAUR3","19/07/2023  5:20:43AM",89,4,2023,"B0811",1,"BUSTR-18280"
"STAUS-827-23","PERTH","C&I","PSTJB","OHWP",74,"60-90","18.75 FX HDRAULIC WELLHEAD CLT POST-JOB",222656,"7000","18416","SI0616","SI0616","CLEANER FX-2 VX ROTARY HUB ASSEMBLY",2023,30,"STAUS",827,23,230,"B0811","BUSTR",0,NA,0,0,1,NA,"APAC05",1,2023-05-11,"24/04/2023","12:00:00.000000AM",2023-04-24,"12:00:00.000000AM","23/06/2023","11:59:00.000000PM","01/06/2023","11:59:00.000000PM",NA,"08/05/2023"," 8:00:00.000000AM","09/05/2023"," 5:00:00.000000PM",NA,"",11,"","",NA,0,0,0,0,0,0,0,0,0,0,0,0,0,NA,0,"N",NA,NA,0,NA,"","","","",1,"N",NA,"Y","N","N","N",1,1,2,1,1,1,1,1,NA,"N",1,"",NA,NA,"AUD",NA,0,0,"N",NA,NA,NA,NA,"","",2,NA,2,NA,999,"","",NA,"","",NA,NA,"TVICAREY","23/07/2023  6:57:26PM",91,4,2023,"B0811",1,"BUSTR-18416"
"STABO-540-2","ABERDEEN","DRILL SUPP","PLAN","QC",71,"60-90","COT Transport Frame",184031,"4260","9074","BP00260","BP00260","Transportation Frame, Change Out Tool (COT)",2023,30,"STABO",540,2,20,"B0551","BUSTR",0,NA,0,0,4,NA,"EMEA0501",1,2023-05-14,"07/04/2023","12:00:00.000000AM",2023-04-07,"12:00:00.000000AM","30/04/2023","11:59:00.000000PM","30/04/2023","11:59:00.000000PM",NA,"","","","",NA,"",2,"","",NA,0,0,0,0,0,0,0,0,0,0,0,0,0,NA,0,"N",NA,NA,0,NA,"","","","",1,"N",2020502,"Y","N","N","N",1,1,1,1,1,1,1,1,NA,"N",1,"WOMUK",NA,NA,"GBP",NA,0,0,"N",NA,NA,NA,NA,"","BP_ABO_COT_TRANS_FRAME_PP",2,NA,2,NA,999,"","",NA,"","",NA,NA,"JKAUR3","14/05/2023  4:26:49AM",108,4,2023,"B0551",1,"BUSTR-9074"
"STAUS-867-1","PERTH","C&I","NEWBD","OPEN",70,"60-90","Asset ID # SI0353
To inspect the ID07 wrench 2 off . Please provide the maintenance required report for the tools so that it can be used for up coming project.",225129,"2020",NA,NA,NA,NA,2023,30,"STAUS",867,1,10,"B0811","B0018",0,NA,0,0,2,NA,"",1,2023-05-15,"16/05/2023","12:00:00.000000AM",2023-05-16,"12:00:00.000000AM","17/05/2023","11:59:00.000000PM","17/05/2023","11:59:00.000000PM",NA,"","","","",NA,"",1,"","",NA,0,0,0,0,0,0,0,0,0,0,0,0,0,NA,0,"N",NA,NA,0,NA,"","","","",1,"N",NA,"N","N","N","N",1,1,1,1,1,1,1,1,NA,"N",1,"",NA,NA,"AUD",NA,0,0,"N",NA,NA,NA,NA,"","",2,NA,2,NA,999,"","",NA,"","",NA,NA,"AKHINE","16/05/2023 12:14:44AM",69,5,2023,"B0811",1,NA
"STAUS-854-6","PERTH","CLIENTOWN","ADHOC","PSCH",69,"60-90","Workshop to conduct inventory of all COTS items",221703,"3700",NA,NA,NA,NA,2023,30,"STAUS",854,6,60,"B0811","",0,NA,0,0,2,NA,"",1,2023-05-16,"13/07/2023","12:00:00.000000AM",2023-05-01,"12:00:00.000000AM","01/05/2023","11:59:00.000000PM","13/07/2023","11:59:00.000000PM",NA,"","","","",NA,"",1,"FBHATTI","",NA,0,0,0,0,0,0,0,0,0,0,0,0,0,NA,0,"N",NA,NA,0,NA,"","","","",1,"N",NA,"N","N","N","N",1,1,1,1,1,1,1,1,NA,"N",1,"",NA,NA,"AUD",NA,0,0,"N",NA,NA,NA,NA,"","",2,NA,2,NA,999,"","",NA,"","",NA,NA,"AWTAYLOR","18/07/2023  6:24:51PM",84,5,2023,"B0811",1,NA
"STAUS-854-7","PERTH","CLIENTOWN","ADHOC","PSCH",69,"60-90","Controls skid assembly as per GA drawings",221703,"5100",NA,NA,NA,NA,2023,30,"STAUS",854,7,70,"B0811","",0,NA,0,0,80,NA,"",1,2023-05-16,"22/08/2023","12:00:00.000000AM",2023-05-01,"12:00:00.000000AM","01/05/2023","11:59:00.000000PM","11/09/2023","11:59:00.000000PM",NA,"","","","",NA,"",1,"FBHATTI","",NA,0,0,0,0,0,0,0,0,0,0,0,0,0,NA,0,"N",NA,NA,0,NA,"","","","",1,"N",NA,"N","N","N","N",1,1,1,1,1,1,1,1,NA,"N",1,"",NA,NA,"AUD",NA,0,0,"N",NA,NA,NA,NA,"","",2,NA,2,NA,999,"","",NA,"","",NA,NA,"AWTAYLOR","18/07/2023  6:24:51PM",84,5,2023,"B0811",1,NA
"STAUS-854-8","PERTH","CLIENTOWN","ADHOC","PSCH",69,"60-90","Prepare test area - Ready for FAT",221703,"4000",NA,NA,NA,NA,2023,30,"STAUS",854,8,80,"B0811","",0,NA,0,0,32,NA,"",1,2023-05-16,"29/08/2023","12:00:00.000000AM",2023-05-01,"12:00:00.000000AM","01/05/2023","11:59:00.000000PM","30/08/2023","11:59:00.000000PM",NA,"","","","",NA,"",1,"FBHATTI","",NA,0,0,0,0,0,0,0,0,0,0,0,0,0,NA,0,"N",NA,NA,0,NA,"","","","",1,"N",NA,"N","N","N","N",1,1,1,1,1,1,1,1,NA,"N",1,"",NA,NA,"AUD",NA,0,0,"N",NA,NA,NA,NA,"","",2,NA,2,NA,999,"","",NA,"","",NA,NA,"AWTAYLOR","18/07/2023  6:24:51PM",84,5,2023,"B0811",1,NA
"STAUS-854-9","PERTH","CLIENTOWN","ADHOC","PSCH",69,"60-90","Receive TFMC CPI Item - MQC Test & Flush plate; SCMMB test and flush plate; KC-4 test and flush plate, SCM Running tool, SCM workshop lifting tool",221703,"3000",NA,NA,NA,NA,2023,30,"STAUS",854,9,90,"B0811","",0,NA,0,0,8,NA,"",1,2023-05-16,"11/09/2023","12:00:00.000000AM",2023-05-01,"12:00:00.000000AM","01/05/2023","11:59:00.000000PM","11/09/2023","11:59:00.000000PM",NA,"","","","",NA,"",1,"FBHATTI","",NA,0,0,0,0,0,0,0,0,0,0,0,0,0,NA,0,"N",NA,NA,0,NA,"","","","",1,"N",NA,"N","N","N","N",1,1,1,1,1,1,1,1,NA,"N",1,"",NA,NA,"AUD",NA,0,0,"N",NA,NA,NA,NA,"","",2,NA,2,NA,999,"","",NA,"","",NA,NA,"AWTAYLOR","18/07/2023  6:24:51PM",84,5,2023,"B0811",1,NA
"STAUS-854-10","PERTH","CLIENTOWN","ADHOC","PSCH",69,"60-90","Perform FAT",221703,"5100",NA,NA,NA,NA,2023,30,"STAUS",854,10,100,"B0811","",0,NA,0,0,80,NA,"",1,2023-05-16,"12/09/2023","12:00:00.000000AM",2023-05-01,"12:00:00.000000AM","01/05/2023","11:59:00.000000PM","18/09/2023","11:59:00.000000PM",NA,"","","","",NA,"",1,"FBHATTI","",NA,0,0,0,0,0,0,0,0,0,0,0,0,0,NA,0,"N",NA,NA,0,NA,"","","","",1,"N",NA,"N","N","N","N",1,1,1,1,1,1,1,1,NA,"N",1,"",NA,NA,"AUD",NA,0,0,"N",NA,NA,NA,NA,"","",2,NA,2,NA,999,"","",NA,"","",NA,NA,"AWTAYLOR","18/07/2023  6:24:51PM",84,5,2023,"B0811",1,NA
"STAUS-854-11","PERTH","CLIENTOWN","ADHOC","PSCH",69,"60-90","Close punch list items",221703,"4100",NA,NA,NA,NA,2023,30,"STAUS",854,11,110,"B0811","",0,NA,0,0,32,NA,"",1,2023-05-16,"19/09/2023","12:00:00.000000AM",2023-05-01,"12:00:00.000000AM","01/05/2023","11:59:00.000000PM","20/09/2023","11:59:00.000000PM",NA,"","","","",NA,"",1,"FBHATTI","",NA,0,0,0,0,0,0,0,0,0,0,0,0,0,NA,0,"N",NA,NA,0,NA,"","","","",1,"N",NA,"N","N","N","N",1,1,1,1,1,1,1,1,NA,"N",1,"",NA,NA,"AUD",NA,0,0,"N",NA,NA,NA,NA,"","",2,NA,2,NA,999,"","",NA,"","",NA,NA,"AWTAYLOR","18/07/2023  6:24:51PM",84,5,2023,"B0811",1,NA
"STLAD-250-1","LUANDA","DRILL SUPP","PSTJB","RWRK",69,"60-90","TSR 227 - X-Part Cameras for repair Pegasus 4KM SN: PEG 618; SN: PEG 1095; SN: PEG 043; SN: PEG 211; SN: PEG 1046; SN: PEG 754 6x",703088,"1",NA,NA,NA,NA,2023,30,"STLAD",250,1,10,"B0078","",0,NA,0,0,1,NA,"",1,2023-05-16,"29/01/2023","12:00:00.000000AM",2023-01-29,"12:00:00.000000AM","31/01/2023","11:59:00.000000PM","31/01/2023","11:59:00.000000PM",NA,"","","","",NA,"",16,"","",NA,0,0,0,0,0,0,0,0,0,0,0,0,0,NA,0,"N",NA,NA,0,NA,"","","","",1,"N",NA,"Y","N","N","N",1,1,1,1,1,1,1,1,NA,"N",1,"WORKORDER",NA,NA,"AOA",NA,0,0,"N",NA,NA,NA,NA,"","",2,NA,2,NA,999,"","",NA,"","",NA,NA,"DANTONIO","21/07/2023  9:13:21AM",176,1,2023,"B0078",1,NA
"STABO-571-1","ABERDEEN","DRILL SUPP","PLAN","QC",68,"60-90","PIT CTR",184031,"4260","9116","BP00303","BP00303","Tool, Pull-In (DMaC) - #1",2023,30,"STABO",571,1,10,"B0551","BUSTR",0,NA,0,0,4,NA,"EMEA0501",1,2023-05-17,"10/05/2023","12:00:00.000000AM",2023-05-10,"12:00:00.000000AM","31/05/2023","11:59:00.000000PM","31/05/2023","11:59:00.000000PM",NA,"","","","",NA,"",16,"","",NA,0,0,0,0,0,0,0,0,0,0,0,0,0,NA,0,"N",NA,NA,0,NA,"","","","",1,"N",2020502,"Y","N","N","N",1,2,2,1,1,1,1,1,NA,"N",1,"WOMUK",NA,NA,"GBP",NA,0,0,"N",NA,NA,NA,NA,"","BP_ABO_PULL_IN_PP",2,NA,2,NA,999,"","",NA,"","",NA,NA,"JKAUR3","17/05/2023  1:01:55AM",75,5,2023,"B0551",1,"BUSTR-9116"
"STAUS-854-4","PERTH","CLIENTOWN","ADHOC","PSCH",67,"60-90","Inspect CPI items from TFMC",221703,"3000",NA,NA,NA,NA,2023,30,"STAUS",854,4,40,"B0811","",0,NA,0,0,2,NA,"",1,2023-05-18,"30/05/2023","12:00:00.000000AM",2023-05-01,"12:00:00.000000AM","01/05/2023","11:59:00.000000PM","30/05/2023","11:59:00.000000PM",NA,"","","","",NA,"",1,"FBHATTI","",NA,0,0,0,0,0,0,0,0,0,0,0,0,0,NA,0,"N",NA,NA,0,NA,"","","","",1,"N",NA,"N","N","N","N",1,1,1,1,1,1,1,1,NA,"N",1,"",NA,NA,"AUD",NA,0,0,"N",NA,NA,NA,NA,"","",2,NA,2,NA,999,"","",NA,"","",NA,NA,"AWTAYLOR","18/07/2023  6:24:51PM",84,5,2023,"B0811",1,NA
"STAUS-854-13","PERTH","CLIENTOWN","ADHOC","PSCH",67,"60-90","Inspection of CPI items from TFMC",221703,"4100",NA,NA,NA,NA,2023,30,"STAUS",854,13,130,"B0811","",0,NA,0,0,1,NA,"",1,2023-05-18,"25/05/2023","12:00:00.000000AM",2023-05-01,"12:00:00.000000AM","06/10/2023","11:59:00.000000PM","25/10/2023","11:59:00.000000PM",NA,"","","","",NA,"",1,"","",NA,0,0,0,0,0,0,0,0,0,0,0,0,0,NA,0,"N",NA,NA,0,NA,"","","","",1,"N",NA,"N","N","N","N",1,1,1,1,1,1,1,1,NA,"N",1,"",NA,NA,"AUD",NA,0,0,"N",NA,NA,NA,NA,"","",2,NA,2,NA,999,"","",NA,"","",NA,NA,"AWTAYLOR","18/07/2023  6:24:51PM",84,5,2023,"B0811",1,NA
"STABO-572-1","ABERDEEN","DRILL SUPP","PLAN","QC",63,"60-90","SIT Equipment, Change Out Tool (COT)",184031,"4260","8840","BP00007","BP00007","SIT Equipment, Change Out Tool (COT)",2023,30,"STABO",572,1,10,"B0551","BUSTR",0,NA,0,0,7.5,NA,"EMEA0081",1,2023-05-22,"11/05/2023","12:00:00.000000AM",2023-05-11,"12:00:00.000000AM","31/05/2023","11:59:00.000000PM","31/05/2023","11:59:00.000000PM",NA,"","","","",NA,"",16,"","",NA,0,0,0,0,0,0,0,0,0,0,0,0,0,NA,0,"N",NA,NA,0,NA,"","","","",1,"N",2020502,"Y","N","N","N",1,1,1,1,1,1,1,1,NA,"N",1,"WOMUK",NA,NA,"GBP",NA,0,0,"N",NA,NA,NA,NA,"","BP_ABO_COT_SIT_PP",2,NA,2,NA,999,"","",NA,"","",NA,NA,"JKAUR3","22/05/2023  2:19:08AM",74,5,2023,"B0551",1,"BUSTR-8840"
"STAUS-875-1","PERTH","CLIENTOWN","PLAN","OPEN",62,"60-90","204452 EPRS PFADF Level 3 PSM",204452,"8312",NA,NA,NA,NA,2023,30,"STAUS",875,1,10,"B0811","",0,NA,0,0,128,NA,"",1,2023-05-23,"07/08/2023","12:00:00.000000AM",2023-05-23,"12:00:00.000000AM","26/05/2023","11:59:00.000000PM","28/08/2023","11:59:00.000000PM",NA,"","","","",NA,"",21,"","",NA,0,0,0,0,0,0,0,0,0,0,0,0,0,NA,0,"N",NA,NA,0,NA,"","","","",1,"N",NA,"N","N","N","N",1,2,1,1,1,1,1,1,NA,"N",1,"",NA,NA,"AUD",NA,0,0,"N",NA,NA,NA,NA,"","",2,NA,2,NA,999,"","",NA,"","",NA,NA,"ASHARMA21","23/05/2023 10:18:12PM",62,5,2023,"B0811",128,NA
"STLAD-329-1","LUANDA","INTV SLTN","PLAN","PSCH",62,"60-90","MOONPOOL AND WIRELINE MAST BRIDGES MAINTENANCE: Quarterly Maintenance, Biannual Maintenance, and Yearly Maintenance",704286,"604","7754","MPB-001","MBP-001","MOON POOL BRIDGE",2023,30,"STLAD",329,1,10,"B0078","BUSTR",0,NA,0,0,40,NA,"EMEA0089",1,2023-05-23,"06/06/2023","12:00:00.000000AM",2023-06-06,"12:00:00.000000AM","08/06/2023","11:59:00.000000PM","08/06/2023","11:59:00.000000PM",NA,"","","","",NA,"N",8,"","",NA,0,0,0,0,0,0,0,0,0,0,0,0,0,NA,0,"N",NA,NA,0,NA,"","","","",1,"",NA,"Y","N","N","N",1,1,1,1,1,1,1,1,NA,"",1,"WORKORDER",NA,NA,"AOA",NA,0,0,"N",NA,NA,NA,NA,"MOONPOOL__TEMPLATE","MNPOOL_WRLN_MAST",2,NA,2,NA,999,"STLAD","LUANDA",NA,"","PM3MT",NA,NA,"OIIBATCH","",48,6,2023,"B0078",40,"BUSTR-7754"
"STLAD-330-1","LUANDA","INTV SLTN","PLAN","PSCH",62,"60-90","IRIS WIRELINE LUBRICATOR ASSEMBLY MAINTENANCE PROCEDURE: Quarterly Maintenance, Yearly Maintenance and Testing, 4 Year Maintenance, and 5 Year Maintenance",704286,"604","7668","LUB-001","BO-014-0030","7-1/16” 10K x 7-1/16” 10K x 20’ SPOOL",2023,30,"STLAD",330,1,10,"B0078","BUSTR",0,NA,0,0,40,NA,"EMEA0089",1,2023-05-23,"06/06/2023","12:00:00.000000AM",2023-06-06,"12:00:00.000000AM","08/06/2023","11:59:00.000000PM","08/06/2023","11:59:00.000000PM",NA,"","","","",NA,"N",8,"","",NA,0,0,0,0,0,0,0,0,0,0,0,0,0,NA,0,"N",NA,NA,0,NA,"","","","",1,"",NA,"Y","N","N","N",1,1,1,1,1,1,1,1,NA,"",1,"WORKORDER",NA,NA,"AOA",NA,0,0,"N",NA,NA,NA,NA,"LUBRICATOR_TEMPLATE","LUBRICATOR",2,NA,2,NA,999,"STLAD","LUANDA",NA,"","PM3MT",NA,NA,"OIIBATCH","",48,6,2023,"B0078",40,"BUSTR-7668"
"STLAD-330-2","LUANDA","INTV SLTN","PLAN","PSCH",62,"60-90","IRIS WIRELINE LUBRICATOR ASSEMBLY MAINTENANCE PROCEDURE: Quarterly Maintenance, Yearly Maintenance and Testing, 4 Year Maintenance, and 5 Year Maintenance",704286,"604","7669","LUB-002","BO-014-0050","7-1/16"" 10K x 7-1/16"" 10K API FLANGE PROFILE 20' SPOOL",2023,30,"STLAD",330,2,10,"B0078","BUSTR",0,NA,0,0,40,NA,"EMEA0089",1,2023-05-23,"06/06/2023","12:00:00.000000AM",2023-06-06,"12:00:00.000000AM","08/06/2023","11:59:00.000000PM","08/06/2023","11:59:00.000000PM",NA,"","","","",NA,"N",8,"","",NA,0,0,0,0,0,0,0,0,0,0,0,0,0,NA,0,"N",NA,NA,0,NA,"","","","",1,"",NA,"Y","N","N","N",1,1,1,1,1,1,1,1,NA,"",1,"WORKORDER",NA,NA,"AOA",NA,0,0,"N",NA,NA,NA,NA,"LUBRICATOR_TEMPLATE","LUBRICATOR",2,NA,2,NA,999,"STLAD","LUANDA",NA,"","PM3MT",NA,NA,"OIIBATCH","",48,6,2023,"B0078",40,"BUSTR-7669"
"STLAD-330-3","LUANDA","INTV SLTN","PLAN","PSCH",62,"60-90","IRIS WIRELINE LUBRICATOR ASSEMBLY MAINTENANCE PROCEDURE: Quarterly Maintenance, Yearly Maintenance and Testing, 4 Year Maintenance, and 5 Year Maintenance",704286,"604","7671","LUB-004","BO-010-1190","7-1/16” 10K LUB SPOOL - 10’-0” LG.",2023,30,"STLAD",330,3,10,"B0078","BUSTR",0,NA,0,0,40,NA,"EMEA0089",1,2023-05-23,"06/06/2023","12:00:00.000000AM",2023-06-06,"12:00:00.000000AM","08/06/2023","11:59:00.000000PM","08/06/2023","11:59:00.000000PM",NA,"","","","",NA,"N",8,"","",NA,0,0,0,0,0,0,0,0,0,0,0,0,0,NA,0,"N",NA,NA,0,NA,"","","","",1,"",NA,"Y","N","N","N",1,1,1,1,1,1,1,1,NA,"",1,"WORKORDER",NA,NA,"AOA",NA,0,0,"N",NA,NA,NA,NA,"LUBRICATOR_TEMPLATE","LUBRICATOR",2,NA,2,NA,999,"STLAD","LUANDA",NA,"","PM3MT",NA,NA,"OIIBATCH","",48,6,2023,"B0078",40,"BUSTR-7671"
"STLAD-330-4","LUANDA","INTV SLTN","PLAN","PSCH",62,"60-90","IRIS WIRELINE LUBRICATOR ASSEMBLY MAINTENANCE PROCEDURE: Quarterly Maintenance, Yearly Maintenance and Testing, 4 Year Maintenance, and 5 Year Maintenance",704286,"604","7672","LUB-005","BO-010-1189","7-1/16” 10K LUB SPOOL - 10’-0” LG. W/ 6” BORE (Exist.Spool)",2023,30,"STLAD",330,4,10,"B0078","BUSTR",0,NA,0,0,40,NA,"EMEA0089",1,2023-05-23,"06/06/2023","12:00:00.000000AM",2023-06-06,"12:00:00.000000AM","08/06/2023","11:59:00.000000PM","08/06/2023","11:59:00.000000PM",NA,"","","","",NA,"N",8,"","",NA,0,0,0,0,0,0,0,0,0,0,0,0,0,NA,0,"N",NA,NA,0,NA,"","","","",1,"",NA,"Y","N","N","N",1,1,1,1,1,1,1,1,NA,"",1,"WORKORDER",NA,NA,"AOA",NA,0,0,"N",NA,NA,NA,NA,"LUBRICATOR_TEMPLATE","LUBRICATOR",2,NA,2,NA,999,"STLAD","LUANDA",NA,"","PM3MT",NA,NA,"OIIBATCH","",48,6,2023,"B0078",40,"BUSTR-7672"
"STLAD-330-5","LUANDA","INTV SLTN","PLAN","PSCH",62,"60-90","IRIS WIRELINE LUBRICATOR ASSEMBLY MAINTENANCE PROCEDURE: Quarterly Maintenance, Yearly Maintenance and Testing, 4 Year Maintenance, and 5 Year Maintenance",704286,"604","7673","LUB-006","BO-014-0044","7-1/16” 10K x 7-1/16” 10K API FLANGE PROFILE 10’ SPOOL",2023,30,"STLAD",330,5,10,"B0078","BUSTR",0,NA,0,0,40,NA,"EMEA0089",1,2023-05-23,"06/06/2023","12:00:00.000000AM",2023-06-06,"12:00:00.000000AM","08/06/2023","11:59:00.000000PM","08/06/2023","11:59:00.000000PM",NA,"","","","",NA,"N",8,"","",NA,0,0,0,0,0,0,0,0,0,0,0,0,0,NA,0,"N",NA,NA,0,NA,"","","","",1,"",NA,"Y","N","N","N",1,1,1,1,1,1,1,1,NA,"",1,"WORKORDER",NA,NA,"AOA",NA,0,0,"N",NA,NA,NA,NA,"LUBRICATOR_TEMPLATE","LUBRICATOR",2,NA,2,NA,999,"STLAD","LUANDA",NA,"","PM3MT",NA,NA,"OIIBATCH","",48,6,2023,"B0078",40,"BUSTR-7673"
"STLAD-330-6","LUANDA","INTV SLTN","PLAN","PSCH",62,"60-90","IRIS WIRELINE LUBRICATOR ASSEMBLY MAINTENANCE PROCEDURE: Quarterly Maintenance, Yearly Maintenance and Testing, 4 Year Maintenance, and 5 Year Maintenance",704286,"604","7679","LUB-012","BO-014-0029","LUBRICATOR DEPLOYMENT TEE SPOOL - 7.06 - 10K x 10FT",2023,30,"STLAD",330,6,10,"B0078","BUSTR",0,NA,0,0,40,NA,"EMEA0089",1,2023-05-23,"06/06/2023","12:00:00.000000AM",2023-06-06,"12:00:00.000000AM","08/06/2023","11:59:00.000000PM","08/06/2023","11:59:00.000000PM",NA,"","","","",NA,"N",8,"","",NA,0,0,0,0,0,0,0,0,0,0,0,0,0,NA,0,"N",NA,NA,0,NA,"","","","",1,"",NA,"Y","N","N","N",1,1,1,1,1,1,1,1,NA,"",1,"WORKORDER",NA,NA,"AOA",NA,0,0,"N",NA,NA,NA,NA,"LUBRICATOR_TEMPLATE","LUBRICATOR",2,NA,2,NA,999,"STLAD","LUANDA",NA,"","PM3MT",NA,NA,"OIIBATCH","",48,6,2023,"B0078",40,"BUSTR-7679"
"STLAD-330-7","LUANDA","INTV SLTN","PLAN","PSCH",62,"60-90","IRIS WIRELINE LUBRICATOR ASSEMBLY MAINTENANCE PROCEDURE: Quarterly Maintenance, Yearly Maintenance and Testing, 4 Year Maintenance, and 5 Year Maintenance",704286,"604","7676","LUB-009","BO-014-0047","7-1/16” 10K x 7-1/16” 10K API FLANGE PROFILE 10’ SPOOL",2023,30,"STLAD",330,7,10,"B0078","BUSTR",0,NA,0,0,40,NA,"EMEA0089",1,2023-05-23,"06/06/2023","12:00:00.000000AM",2023-06-06,"12:00:00.000000AM","08/06/2023","11:59:00.000000PM","08/06/2023","11:59:00.000000PM",NA,"","","","",NA,"N",8,"","",NA,0,0,0,0,0,0,0,0,0,0,0,0,0,NA,0,"N",NA,NA,0,NA,"","","","",1,"",NA,"Y","N","N","N",1,1,1,1,1,1,1,1,NA,"",1,"WORKORDER",NA,NA,"AOA",NA,0,0,"N",NA,NA,NA,NA,"LUBRICATOR_TEMPLATE","LUBRICATOR",2,NA,2,NA,999,"STLAD","LUANDA",NA,"","PM3MT",NA,NA,"OIIBATCH","",48,6,2023,"B0078",40,"BUSTR-7676"
"STLAD-330-8","LUANDA","INTV SLTN","PLAN","PSCH",62,"60-90","IRIS WIRELINE LUBRICATOR ASSEMBLY MAINTENANCE PROCEDURE: Quarterly Maintenance, Yearly Maintenance and Testing, 4 Year Maintenance, and 5 Year Maintenance",704286,"604","7683","LUB-016","W57867/1-1","CONNECTOR No 8 072 OPTIMA FEMALE HUB-API 1-1/16 IN SPOOL A694-F65+625 INLAY",2023,30,"STLAD",330,8,10,"B0078","BUSTR",0,NA,0,0,40,NA,"EMEA0089",1,2023-05-23,"06/06/2023","12:00:00.000000AM",2023-06-06,"12:00:00.000000AM","08/06/2023","11:59:00.000000PM","08/06/2023","11:59:00.000000PM",NA,"","","","",NA,"N",8,"","",NA,0,0,0,0,0,0,0,0,0,0,0,0,0,NA,0,"N",NA,NA,0,NA,"","","","",1,"",NA,"Y","N","N","N",1,1,1,1,1,1,1,1,NA,"",1,"WORKORDER",NA,NA,"AOA",NA,0,0,"N",NA,NA,NA,NA,"LUBRICATOR_TEMPLATE","LUBRICATOR",2,NA,2,NA,999,"STLAD","LUANDA",NA,"","PM3MT",NA,NA,"OIIBATCH","",48,6,2023,"B0078",40,"BUSTR-7683"
"STLAD-330-9","LUANDA","INTV SLTN","PLAN","PSCH",62,"60-90","IRIS WIRELINE LUBRICATOR ASSEMBLY MAINTENANCE PROCEDURE: Quarterly Maintenance, Yearly Maintenance and Testing, 4 Year Maintenance, and 5 Year Maintenance",704286,"604","7684","LUB-017","W58563/1-1","CONNECTOR NO 8 OPTIMA 7.06-10K FLG - 7.06 IN BORE. MALE HUB ASSY",2023,30,"STLAD",330,9,10,"B0078","BUSTR",0,NA,0,0,40,NA,"EMEA0089",1,2023-05-23,"06/06/2023","12:00:00.000000AM",2023-06-06,"12:00:00.000000AM","08/06/2023","11:59:00.000000PM","08/06/2023","11:59:00.000000PM",NA,"","","","",NA,"N",8,"","",NA,0,0,0,0,0,0,0,0,0,0,0,0,0,NA,0,"N",NA,NA,0,NA,"","","","",1,"",NA,"Y","N","N","N",1,1,1,1,1,1,1,1,NA,"",1,"WORKORDER",NA,NA,"AOA",NA,0,0,"N",NA,NA,NA,NA,"LUBRICATOR_TEMPLATE","LUBRICATOR",2,NA,2,NA,999,"STLAD","LUANDA",NA,"","PM3MT",NA,NA,"OIIBATCH","",48,6,2023,"B0078",40,"BUSTR-7684"
"STLAD-275-1","LUANDA","INTV SLTN","PSTJB","OHWP",61,"60-90","Rebuild T4 arm SN 181290, PN1990295",703088,"1",NA,NA,NA,NA,2023,30,"STLAD",275,1,10,"B0078","",0,NA,0,0,1,NA,"",1,2023-05-24,"02/03/2023","12:00:00.000000AM",2023-03-02,"12:00:00.000000AM","10/03/2023","11:59:00.000000PM","10/03/2023","11:59:00.000000PM",NA,"","","","",NA,"",16,"","",NA,0,0,0,0,0,0,0,0,0,0,0,0,0,NA,0,"N",NA,NA,0,NA,"","","","",1,"N",NA,"Y","N","N","N",1,1,1,1,1,1,1,1,NA,"N",1,"WORKORDER",NA,NA,"AOA",NA,0,0,"N",NA,NA,NA,NA,"","",2,NA,2,NA,999,"","",NA,"","",NA,NA,"DANTONIO","21/07/2023  9:13:21AM",144,3,2023,"B0078",1,NA
"STLAD-332-1","LUANDA","C&I","PREJB","OPEN",61,"60-90","MAERSK FORZA ESSO - HRS ADDITIONAL ITEMS MAC Pump
Methanol Wand/Jetting Wand
Methanol Pump and PPE (Already on Forza for HRS scope)
2 x 50KG Buoyancy Ball
2 x 20kg Buoyancy Ball  
70 metre Hose from SSP",212153,"7000",NA,NA,NA,NA,2023,30,"STLAD",332,1,10,"B0078","",0,NA,0,0,1,NA,"",1,2023-05-24,"20/05/2023","",NA,"","","","24/05/2023","",NA,"","","","",NA,"",NA,"","",NA,0,0,0,0,0,0,0,0,0,0,0,0,0,NA,0,"N",NA,NA,0,NA,"","","","",1,"N",NA,"N","N","N","N",1,1,1,1,1,1,1,1,NA,"N",1,"WORKORDER",NA,NA,"AOA",NA,0,0,"N",NA,NA,NA,NA,"","",2,NA,2,NA,999,"","",NA,"","",NA,NA,"MFOFANA","24/05/2023 10:12:27AM",NA,NA,NA,"B0078",1,NA
"STABO-584-1","ABERDEEN","DRILL SUPP","PLAN","PSCH",60,"31-60","Subsea 7 Hotstab Tool (Male / Female)",184031,"4260","8934","BP00110","BP00110","Hotstab Tool, Single Port Female (690 Bar W.P.)",2023,30,"STABO",584,1,10,"B0551","BUSTR",0,NA,0,0,2.5,NA,"EMEA0500",1,2023-05-25,"25/05/2023","12:00:00.000000AM",2023-05-25,"12:00:00.000000AM","31/05/2023","11:59:00.000000PM","31/05/2023","11:59:00.000000PM",NA,"","","","",NA,"",16,"","",NA,0,0,0,0,0,0,0,0,0,0,0,0,0,NA,0,"N",NA,NA,0,NA,"","","","",1,"N",2020502,"Y","N","N","N",1,1,1,1,1,1,1,1,NA,"N",1,"WOMUK",NA,NA,"GBP",NA,0,0,"N",NA,NA,NA,NA,"","BP-ABO-HS-TOOL-PP",2,NA,2,NA,999,"STABO","ABERDEEN",NA,"","",NA,NA,"PMAHAJAN","25/05/2023  9:38:43AM",60,5,2023,"B0551",1,"BUSTR-8934"
"STLAD-335-1","LUANDA","INTV SLTN","PLAN","PSCH",57,"31-60","SURFACE ACCUMULATION RACKS - IRIS MAINTENANCE PROCEDURE",704286,"604","25344","IAR-01","IAR-01","ACCUMULATOR RACK - 60 GALLON",2023,30,"STLAD",335,1,10,"B0078","BUSTR",0,NA,0,0,40,NA,"EMEA0089",1,2023-05-28,"11/06/2023","12:00:00.000000AM",2023-06-11,"12:00:00.000000AM","13/06/2023","11:59:00.000000PM","13/06/2023","11:59:00.000000PM",NA,"","","","",NA,"N",8,"","",NA,0,0,0,0,0,0,0,0,0,0,0,0,0,NA,0,"N",NA,NA,0,NA,"","","","",1,"",NA,"Y","N","N","N",1,1,1,1,1,1,1,1,NA,"",1,"WORKORDER",NA,NA,"AOA",NA,0,0,"N",NA,NA,NA,NA,"SURFACE_RACK_TEMPLATE","SURFACE_ACCUMULATION_RACK",2,NA,2,NA,999,"STLAD","LUANDA",NA,"","PM3MT",NA,NA,"OIIBATCH","",43,6,2023,"B0078",40,"BUSTR-25344"
"STLAD-335-2","LUANDA","INTV SLTN","PLAN","PSCH",57,"31-60","SURFACE ACCUMULATION RACKS - IRIS MAINTENANCE PROCEDURE",704286,"604","25346","IAR-02","IAR-02","ACCUMULATOR RACK - 40 GALLON
MFG DATE: 5/01/99",2023,30,"STLAD",335,2,10,"B0078","BUSTR",0,NA,0,0,40,NA,"EMEA0089",1,2023-05-28,"11/06/2023","12:00:00.000000AM",2023-06-11,"12:00:00.000000AM","13/06/2023","11:59:00.000000PM","13/06/2023","11:59:00.000000PM",NA,"","","","",NA,"N",8,"","",NA,0,0,0,0,0,0,0,0,0,0,0,0,0,NA,0,"N",NA,NA,0,NA,"","","","",1,"",NA,"Y","N","N","N",1,1,1,1,1,1,1,1,NA,"",1,"WORKORDER",NA,NA,"AOA",NA,0,0,"N",NA,NA,NA,NA,"SURFACE_RACK_TEMPLATE","SURFACE_ACCUMULATION_RACK",2,NA,2,NA,999,"STLAD","LUANDA",NA,"","PM3MT",NA,NA,"OIIBATCH","",43,6,2023,"B0078",40,"BUSTR-25346"
"STABO-573-1","ABERDEEN","DRILL SUPP","PLAN","QC",56,"31-60","COT Transport Frame",184031,"4260","8878","BP00047","BP00047","Transportation Frame, Change Out Tool (COT)",2023,30,"STABO",573,1,10,"B0551","BUSTR",0,NA,0,0,4,NA,"EMEA0081",1,2023-05-29,"17/05/2023","12:00:00.000000AM",2023-05-17,"12:00:00.000000AM","31/05/2023","11:59:00.000000PM","31/05/2023","11:59:00.000000PM",NA,"","","","",NA,"",16,"","",NA,0,0,0,0,0,0,0,0,0,0,0,0,0,NA,0,"N",NA,NA,0,NA,"","","","",1,"N",2020502,"Y","N","N","N",1,1,1,1,1,1,1,1,NA,"N",1,"WOMUK",NA,NA,"GBP",NA,0,0,"N",NA,NA,NA,NA,"","BP_ABO_COT_TRANS_FRAME_PP",2,NA,2,NA,999,"","",NA,"","",NA,NA,"JKAUR3","29/05/2023  1:34:45AM",68,5,2023,"B0551",1,"BUSTR-8878"
"STABO-574-1","ABERDEEN","DRILL SUPP","PLAN","QC",56,"31-60","Basket Deployment Regan Post Pre/ Post",184031,"4260","8988","BP00169","BP00169","Basket, Deployment - Guide Post",2023,30,"STABO",574,1,10,"B0551","BUSTR",0,NA,0,0,4,NA,"EMEA0081",1,2023-05-29,"25/05/2023","12:00:00.000000AM",2023-05-25,"12:00:00.000000AM","30/06/2023","11:59:00.000000PM","30/06/2023","11:59:00.000000PM",NA,"","","","",NA,"",16,"","",NA,0,0,0,0,0,0,0,0,0,0,0,0,0,NA,0,"N",NA,NA,0,NA,"","","","",1,"N",2020502,"Y","N","N","N",1,1,1,1,1,1,1,1,NA,"N",1,"WOMUK",NA,NA,"GBP",NA,0,0,"N",NA,NA,NA,NA,"","BP_ABO_BASKET_REGAN_PST",2,NA,2,NA,999,"","",NA,"","",NA,NA,"JKAUR3","29/05/2023  1:34:22AM",60,5,2023,"B0551",1,"BUSTR-8988"
"STABO-575-1","ABERDEEN","DRILL SUPP","PLAN","QC",56,"31-60","GL4 Guide Post Ext - 1865mm",184031,"4260","20921","BP00504","BP00504","Extension, GL4 Guide Post - 1865mm (Imenco) - MODIFIED",2023,30,"STABO",575,1,10,"B0551","BUSTR",0,NA,0,0,4,NA,"EMEA0081",1,2023-05-29,"25/05/2023","12:00:00.000000AM",2023-05-25,"12:00:00.000000AM","30/06/2023","11:59:00.000000PM","30/06/2023","11:59:00.000000PM",NA,"","","","",NA,"",16,"","",NA,0,0,0,0,0,0,0,0,0,0,0,0,0,NA,0,"N",NA,NA,0,NA,"","","","",1,"N",2020502,"Y","N","N","N",1,1,1,1,1,1,1,1,NA,"N",1,"WOMUK",NA,NA,"GBP",NA,0,0,"N",NA,NA,NA,NA,"","BP_ABO_GUIDE_POST_EXT_PP",2,NA,2,NA,999,"","",NA,"","",NA,NA,"JKAUR3","29/05/2023  1:34:02AM",60,5,2023,"B0551",1,"BUSTR-20921"
"STABO-576-1","ABERDEEN","DRILL SUPP","PLAN","QC",56,"31-60","GL4 Guide Post Ext - 1865mm",184031,"4260","20917","BP00505","BP00505","Extension, GL4 Guide Post - 1865mm (Imenco) - MODIFIED",2023,30,"STABO",576,1,10,"B0551","BUSTR",0,NA,0,0,4,NA,"EMEA0081",1,2023-05-29,"25/05/2023","12:00:00.000000AM",2023-05-25,"12:00:00.000000AM","30/06/2023","11:59:00.000000PM","30/06/2023","11:59:00.000000PM",NA,"","","","",NA,"",16,"","",NA,0,0,0,0,0,0,0,0,0,0,0,0,0,NA,0,"N",NA,NA,0,NA,"","","","",1,"N",2020502,"Y","N","N","N",1,1,1,1,1,1,1,1,NA,"N",1,"WOMUK",NA,NA,"GBP",NA,0,0,"N",NA,NA,NA,NA,"","BP_ABO_GUIDE_POST_EXT_PP",2,NA,2,NA,999,"","",NA,"","",NA,NA,"JKAUR3","29/05/2023  1:33:33AM",60,5,2023,"B0551",1,"BUSTR-20917"
"STABO-577-1","ABERDEEN","DRILL SUPP","PLAN","QC",56,"31-60","GL4 Guide Post Ext - 1865mm",184031,"4260","20918","BP00506","BP00506","Extension, GL4 Guide Post - 1865mm (Imenco) - MODIFIED",2023,30,"STABO",577,1,10,"B0551","BUSTR",0,NA,0,0,4,NA,"EMEA0081",1,2023-05-29,"25/05/2023","12:00:00.000000AM",2023-05-25,"12:00:00.000000AM","30/06/2023","11:59:00.000000PM","30/06/2023","11:59:00.000000PM",NA,"","","","",NA,"",16,"","",NA,0,0,0,0,0,0,0,0,0,0,0,0,0,NA,0,"N",NA,NA,0,NA,"","","","",1,"N",2020502,"Y","N","N","N",1,1,1,1,1,1,1,1,NA,"N",1,"WOMUK",NA,NA,"GBP",NA,0,0,"N",NA,NA,NA,NA,"","BP_ABO_GUIDE_POST_EXT_PP",2,NA,2,NA,999,"","",NA,"","",NA,NA,"JKAUR3","29/05/2023  1:33:17AM",60,5,2023,"B0551",1,"BUSTR-20918"
"STABO-578-1","ABERDEEN","DRILL SUPP","PLAN","QC",56,"31-60","Anchor, Guide Wire - Padeye (Imenco)",184031,"4260","20946","BP00507","BP00507","Anchor, Guide Wire - Padeye (Imenco)",2023,30,"STABO",578,1,10,"B0551","BUSTR",0,NA,0,0,4,NA,"EMEA0081",1,2023-05-29,"25/05/2023","12:00:00.000000AM",2023-05-25,"12:00:00.000000AM","30/06/2023","11:59:00.000000PM","30/06/2023","11:59:00.000000PM",NA,"","","","",NA,"",16,"","",NA,0,0,0,0,0,0,0,0,0,0,0,0,0,NA,0,"N",NA,NA,0,NA,"","","","",1,"N",2020502,"Y","N","N","N",1,1,1,1,1,1,1,1,NA,"N",1,"WOMUK",NA,NA,"GBP",NA,0,0,"N",NA,NA,NA,NA,"","BP_ABO_IMENCO_ANCHOR_PP",2,NA,2,NA,999,"","",NA,"","",NA,NA,"JKAUR3","29/05/2023  1:33:00AM",60,5,2023,"B0551",1,"BUSTR-20946"
"STABO-579-1","ABERDEEN","DRILL SUPP","PLAN","QC",56,"31-60","Anchor, Guide Wire - Padeye (Imenco)",184031,"4260","20947","BP00508","BP00508","Anchor, Guide Wire - Padeye (Imenco)",2023,30,"STABO",579,1,10,"B0551","BUSTR",0,NA,0,0,4,NA,"EMEA0081",1,2023-05-29,"25/05/2023","12:00:00.000000AM",2023-05-25,"12:00:00.000000AM","30/06/2023","11:59:00.000000PM","30/06/2023","11:59:00.000000PM",NA,"","","","",NA,"",16,"","",NA,0,0,0,0,0,0,0,0,0,0,0,0,0,NA,0,"N",NA,NA,0,NA,"","","","",1,"N",2020502,"Y","N","N","N",1,1,1,1,1,1,1,1,NA,"N",1,"WOMUK",NA,NA,"GBP",NA,0,0,"N",NA,NA,NA,NA,"","BP_ABO_IMENCO_ANCHOR_PP",2,NA,2,NA,999,"","",NA,"","",NA,NA,"JKAUR3","29/05/2023  1:32:42AM",60,5,2023,"B0551",1,"BUSTR-20947"
"STABO-580-1","ABERDEEN","DRILL SUPP","PLAN","QC",56,"31-60","Anchor, Guide Wire - Padeye (Imenco)",184031,"4260","20950","BP00509","BP00509","Anchor, Guide Wire - Padeye (Imenco)",2023,30,"STABO",580,1,10,"B0551","BUSTR",0,NA,0,0,4,NA,"EMEA0081",1,2023-05-29,"25/05/2023","12:00:00.000000AM",2023-05-25,"12:00:00.000000AM","30/06/2023","11:59:00.000000PM","30/06/2023","11:59:00.000000PM",NA,"","","","",NA,"",16,"","",NA,0,0,0,0,0,0,0,0,0,0,0,0,0,NA,0,"N",NA,NA,0,NA,"","","","",1,"N",2020502,"Y","N","N","N",1,1,1,1,1,1,1,1,NA,"N",1,"WOMUK",NA,NA,"GBP",NA,0,0,"N",NA,NA,NA,NA,"","BP_ABO_IMENCO_ANCHOR_PP",2,NA,2,NA,999,"","",NA,"","",NA,NA,"JKAUR3","29/05/2023  1:30:26AM",60,5,2023,"B0551",1,"BUSTR-20950"
"STABO-581-1","ABERDEEN","DRILL SUPP","PLAN","QC",56,"31-60","CONTAINER PRE & POST JOB",184031,"4260","8854","BP00021","BP00021","Container, Storage - 10' x 8' (COT)",2023,30,"STABO",581,1,10,"B0551","BUSTR",0,NA,0,0,2,NA,"EMEA0081",1,2023-05-29,"25/05/2023","12:00:00.000000AM",2023-05-25,"12:00:00.000000AM","30/06/2023","11:59:00.000000PM","30/06/2023","11:59:00.000000PM",NA,"","","","",NA,"",16,"","",NA,0,0,0,0,0,0,0,0,0,0,0,0,0,NA,0,"N",NA,NA,0,NA,"","","","",1,"N",2020502,"Y","N","N","N",1,1,1,1,1,1,1,1,NA,"N",1,"WOMUK",NA,NA,"GBP",NA,0,0,"N",NA,NA,NA,NA,"","BP_ABO_CONTAINER_PP",2,NA,2,NA,999,"","",NA,"","",NA,NA,"JKAUR3","29/05/2023  1:30:02AM",60,5,2023,"B0551",1,"BUSTR-8854"
"STABO-582-1","ABERDEEN","DRILL SUPP","PLAN","QC",56,"31-60","TDU",184031,"4260","9024","BP00208","BP00208","Tool Deployment Unit, TDU 02",2023,30,"STABO",582,1,10,"B0551","BUSTR",0,NA,0,0,4,NA,"EMEA0501",1,2023-05-29,"25/05/2023","12:00:00.000000AM",2023-05-25,"12:00:00.000000AM","30/06/2023","11:59:00.000000PM","30/06/2023","11:59:00.000000PM",NA,"24/05/2023"," 8:00:00.000000AM","25/05/2023"," 5:00:00.000000PM",NA,"",16,"","",NA,0,0,0,0,0,0,0,0,0,0,0,0,0,NA,0,"N",NA,NA,0,NA,"","","","",1,"N",2020502,"Y","N","N","N",1,1,2,1,1,1,1,1,NA,"N",1,"WOMUK",NA,NA,"GBP",NA,0,0,"N",NA,NA,NA,NA,"","BP_ABO_TDU-PP",2,NA,2,NA,999,"","",NA,"","",NA,NA,"JKAUR3","29/05/2023  1:27:56AM",60,5,2023,"B0551",1,"BUSTR-9024"
"STAUS-858-3","PERTH","C&I","PREJB","PSCH",56,"31-60","Pre job inspection and function test of Acid Transfer Pump",225129,"5010","18257","AU0548","AU0548","Pump Methanol transfer Diaphragm",2023,30,"STAUS",858,3,30,"B0811","BUSTR",0,NA,0,0,8,NA,"AUS00005",1,2023-05-29,"03/05/2023","12:00:00.000000AM",2023-05-03,"12:00:00.000000AM","11/05/2023","11:59:00.000000PM","11/05/2023","11:59:00.000000PM",NA,"","","","",NA,"",32,"","",NA,0,0,0,0,0,0,0,0,0,0,0,0,0,NA,0,"N",NA,NA,0,NA,"","","","",1,"N",NA,"N","N","N","N",1,1,1,1,1,1,1,1,NA,"N",1,"",NA,NA,"AUD",NA,0,0,"N",NA,NA,NA,NA,"","",2,NA,2,NA,999,"","",NA,"","",NA,NA,"JSMALL","11/07/2023  5:35:25PM",82,5,2023,"B0811",24,"BUSTR-18257"
"STLAD-336-1","LUANDA","INTV SLTN","PM3MT","PSCH",56,"31-60","MASTER CONTROL STATION MAINTENANCE: Quarterly Maintenance, Yearly Maintenance and testing, 4yr Maintenance, and 5yr Maintenance",704286,"604","7756","MCS-001","800005","MASTER CONTROL STATION",2023,30,"STLAD",336,1,10,"B0078","BUSTR",0,NA,0,0,40,NA,"EMEA0089",1,2023-05-29,"12/06/2023","12:00:00.000000AM",2023-06-12,"12:00:00.000000AM","14/06/2023","11:59:00.000000PM","14/06/2023","11:59:00.000000PM",NA,"","","","",NA,"N",8,"","",NA,0,0,0,0,0,0,0,0,0,0,0,0,0,NA,0,"N",NA,NA,0,NA,"","","","",1,"",NA,"Y","N","N","N",1,1,1,1,1,1,1,1,NA,"",1,"WORKORDER",NA,NA,"AOA",NA,0,0,"N",NA,NA,NA,NA,"MASTER_CTRL_STN_TEMPLATE","MASTER_CONTROL_STN",2,NA,2,NA,999,"STLAD","LUANDA",NA,"","PM3MT",NA,NA,"OIIBATCH","",42,6,2023,"B0078",40,"BUSTR-7756"
"STAUS-864-1","PERTH","C&I","NEWBD","OHWP",55,"31-60","Off-hire inspection  & Green Tag",224575,"5000","18067","AU0216","AU0216","Sealant Injection Tool",2023,30,"STAUS",864,1,10,"B0811","BUSTR",0,NA,0,0,1,NA,"APAC07",1,2023-05-30,"12/05/2023","12:00:00.000000AM",2023-05-12,"12:00:00.000000AM","12/05/2023","11:59:00.000000PM","12/05/2023","11:59:00.000000PM",NA,"29/05/2023"," 8:00:00.000000AM","30/05/2023"," 5:00:00.000000PM",NA,"",1,"","",NA,0,0,0,0,0,0,0,0,0,0,0,0,0,NA,0,"N",NA,NA,0,NA,"","","","",1,"N",NA,"Y","N","N","N",1,1,2,1,1,1,1,1,NA,"N",1,"",NA,NA,"AUD",NA,0,0,"N",NA,NA,NA,NA,"","",2,NA,2,NA,999,"","",NA,"","",NA,NA,"LWOOD2","30/05/2023 12:32:15AM",73,5,2023,"B0811",1,"BUSTR-18067"
"STAUS-854-14","PERTH","CLIENTOWN","ADHOC","PSCH",53,"31-60","Inspect CPI items from TFMC",221703,"3000",NA,NA,NA,NA,2023,30,"STAUS",854,14,140,"B0811","",0,NA,0,0,2,NA,"",1,2023-06-01,"08/06/2023","12:00:00.000000AM",2023-05-01,"12:00:00.000000AM","06/10/2023","11:59:00.000000PM","08/06/2023","11:59:00.000000PM",NA,"","","","",NA,"",1,"","",NA,0,0,0,0,0,0,0,0,0,0,0,0,0,NA,0,"N",NA,NA,0,NA,"","","","",1,"N",NA,"N","N","N","N",1,1,1,1,1,1,1,1,NA,"N",1,"",NA,NA,"AUD",NA,0,0,"N",NA,NA,NA,NA,"","",2,NA,2,NA,999,"","",NA,"","",NA,NA,"AWTAYLOR","18/07/2023  6:24:51PM",84,5,2023,"B0811",1,NA
"STAUS-886-1","PERTH","INTV SLTN","NEWBD","OPEN",52,"31-60","HRS Skid Assembly",219032,"7000",NA,NA,NA,NA,2023,30,"STAUS",886,1,10,"B0811","",0,NA,0,0,8,NA,"",1,2023-06-02,"02/06/2023","12:00:00.000000AM",2023-06-02,"12:00:00.000000AM","30/06/2023","11:59:00.000000PM","30/06/2023","11:59:00.000000PM",NA,"","","","",NA,"",1,"","",NA,0,0,0,0,0,0,0,0,0,0,0,0,0,NA,0,"N",NA,NA,0,NA,"","","","",1,"N",NA,"N","N","N","N",1,1,1,1,1,1,1,1,NA,"N",1,"",NA,NA,"AUD",NA,0,0,"N",NA,NA,NA,NA,"","",2,NA,2,NA,999,"","",NA,"","",NA,NA,"FBHATTI","07/06/2023  1:23:26AM",52,6,2023,"B0811",1,NA
"STABO-583-1","ABERDEEN","DRILL SUPP","PLAN","QC",49,"31-60","Hotstab / Manifold (Various Manufacturers)",184031,"4260","8900","BP00071","BP00071","Hotstab Tool, Single Port Male (10K PSI W.P.)",2023,30,"STABO",583,1,10,"B0551","BUSTR",0,NA,0,0,0.5,NA,"EMEA0500",1,2023-06-05,"25/05/2023","12:00:00.000000AM",2023-05-25,"12:00:00.000000AM","31/05/2023","11:59:00.000000PM","31/05/2023","11:59:00.000000PM",NA,"01/06/2023"," 8:00:00.000000AM","01/06/2023"," 5:00:00.000000PM",NA,"",16,"","",NA,0,0,0,0,0,0,0,0,0,0,0,0,0,NA,0,"N",NA,NA,0,NA,"","","","",1,"N",2020502,"Y","N","N","N",1,1,1,1,1,1,1,1,NA,"N",1,"WOMUK",NA,NA,"GBP",NA,0,0,"N",NA,NA,NA,NA,"","BP-ABO_HOTSTAB_PP",2,NA,2,NA,999,"","",NA,"","",NA,NA,"JKAUR3","05/06/2023  3:32:08AM",60,5,2023,"B0551",1,"BUSTR-8900"
"STABO-585-1","ABERDEEN","DRILL SUPP","PLAN","QC",49,"31-60","Hydraulic Power Unit, DMaC",184031,"4270","9084","BP00271","BP00271","Hydraulic Power Unit, DMaC",2023,30,"STABO",585,1,10,"B0551","BUSTR",0,NA,0,0,4,NA,"EMEA0081",1,2023-06-05,"26/05/2023","12:00:00.000000AM",2023-05-26,"12:00:00.000000AM","30/06/2023","11:59:00.000000PM","30/06/2023","11:59:00.000000PM",NA,"","","","",NA,"",16,"","",NA,0,0,0,0,0,0,0,0,0,0,0,0,0,NA,0,"N",NA,NA,0,NA,"","","","",1,"N",2020502,"Y","N","N","N",1,1,1,1,1,1,1,1,NA,"N",1,"WOMUK",NA,NA,"GBP",NA,0,0,"N",NA,NA,NA,NA,"","BP_ABO_DMAC_HPU_PP",2,NA,2,NA,999,"","",NA,"","",NA,NA,"JKAUR3","05/06/2023  3:31:49AM",59,5,2023,"B0551",1,"BUSTR-9084"
"STABO-587-1","ABERDEEN","DRILL SUPP","PLAN","QC",49,"31-60","CHEMICAL INJECTION TOOL",184031,"4260","20930","BP00514","BP00514","Chemical Injection Tool, Triple Bore",2023,30,"STABO",587,1,10,"B0551","BUSTR",0,NA,0,0,4,NA,"EMEA0081",1,2023-06-05,"01/06/2023","12:00:00.000000AM",2023-06-01,"12:00:00.000000AM","30/06/2023","11:59:00.000000PM","30/06/2023","11:59:00.000000PM",NA,"","","","",NA,"",16,"","",NA,0,0,0,0,0,0,0,0,0,0,0,0,0,NA,0,"N",NA,NA,0,NA,"","","","",1,"N",2020502,"Y","N","N","N",1,1,1,1,1,1,1,1,NA,"N",1,"WOMUK",NA,NA,"GBP",NA,0,0,"N",NA,NA,NA,NA,"","BP_ABO_CHEMICAL_INJ-PP",2,NA,2,NA,999,"","",NA,"","",NA,NA,"JKAUR3","05/06/2023  3:31:29AM",53,6,2023,"B0551",1,"BUSTR-20930"
"STABO-588-1","ABERDEEN","DRILL SUPP","PLAN","QC",49,"31-60","CHEMICAL INJECTION TOOL",184031,"4260","22724","BP00556","BP00556","Chem. Inj. Gun, 45°",2023,30,"STABO",588,1,10,"B0551","BUSTR",0,NA,0,0,3.5,NA,"EMEA0081",1,2023-06-05,"01/06/2023","12:00:00.000000AM",2023-06-01,"12:00:00.000000AM","30/06/2023","11:59:00.000000PM","30/06/2023","11:59:00.000000PM",NA,"","","","",NA,"",16,"","",NA,0,0,0,0,0,0,0,0,0,0,0,0,0,NA,0,"N",NA,NA,0,NA,"","","","",1,"N",2020502,"Y","N","N","N",1,1,1,1,1,1,1,1,NA,"N",1,"WOMUK",NA,NA,"GBP",NA,0,0,"N",NA,NA,NA,NA,"","BP_ABO_CHEM_INJ_45_PP",2,NA,2,NA,999,"","",NA,"","",NA,NA,"JKAUR3","05/06/2023  3:31:09AM",53,6,2023,"B0551",1,"BUSTR-22724"
"STABO-589-1","ABERDEEN","DRILL SUPP","PLAN","QC",49,"31-60","CHEMICAL INJECTION TOOL",184031,"4260","22725","BP00557","BP00557","Chemical Injection Tool , 90°",2023,30,"STABO",589,1,10,"B0551","BUSTR",0,NA,0,0,3.5,NA,"EMEA0081",1,2023-06-05,"01/06/2023","12:00:00.000000AM",2023-06-01,"12:00:00.000000AM","30/06/2023","11:59:00.000000PM","30/06/2023","11:59:00.000000PM",NA,"","","","",NA,"",16,"","",NA,0,0,0,0,0,0,0,0,0,0,0,0,0,NA,0,"N",NA,NA,0,NA,"","","","",1,"N",2020502,"Y","N","N","N",1,1,1,1,1,1,1,1,NA,"N",1,"WOMUK",NA,NA,"GBP",NA,0,0,"N",NA,NA,NA,NA,"","BP_ABO_CHEMICAL_INJ_PP",2,NA,2,NA,999,"","",NA,"","",NA,NA,"JKAUR3","05/06/2023  3:29:23AM",53,6,2023,"B0551",1,"BUSTR-22725"
"STABO-590-1","ABERDEEN","DRILL SUPP","PLAN","QC",49,"31-60","CHEMICAL INJECTION TOOL",184031,"4260","25599","BP00594","BP00594","Chemical Injection Tool , 90°",2023,30,"STABO",590,1,10,"B0551","BUSTR",0,NA,0,0,3.5,NA,"EMEA0500",1,2023-06-05,"01/06/2023","12:00:00.000000AM",2023-06-01,"12:00:00.000000AM","30/06/2023","11:59:00.000000PM","30/06/2023","11:59:00.000000PM",NA,"","","","",NA,"",16,"","",NA,0,0,0,0,0,0,0,0,0,0,0,0,0,NA,0,"N",NA,NA,0,NA,"","","","",1,"N",2020502,"Y","N","N","N",1,1,1,1,1,1,1,1,NA,"N",1,"WOMUK",NA,NA,"GBP",NA,0,0,"N",NA,NA,NA,NA,"","BP_ABO_CHEMICAL_INJ_PP",2,NA,2,NA,999,"","",NA,"","",NA,NA,"JKAUR3","05/06/2023  3:28:50AM",53,6,2023,"B0551",1,"BUSTR-25599"
"STABO-591-1","ABERDEEN","DRILL SUPP","PLAN","QC",49,"31-60","CHEMICAL INJECTION TOOL",184031,"4260","27205","BP00603","BP00603","Chemical Injection Tool, 90°",2023,30,"STABO",591,1,10,"B0551","BUSTR",0,NA,0,0,3.5,NA,"EMEA0500",1,2023-06-05,"01/06/2023","12:00:00.000000AM",2023-06-01,"12:00:00.000000AM","30/06/2023","11:59:00.000000PM","30/06/2023","11:59:00.000000PM",NA,"","","","",NA,"",16,"","",NA,0,0,0,0,0,0,0,0,0,0,0,0,0,NA,0,"N",NA,NA,0,NA,"","","","",1,"N",2020502,"Y","N","N","N",1,1,1,1,1,1,1,1,NA,"N",1,"WOMUK",NA,NA,"GBP",NA,0,0,"N",NA,NA,NA,NA,"","BP_ABO_CHEMICAL_INJ_PP",2,NA,2,NA,999,"","",NA,"","",NA,NA,"JKAUR3","05/06/2023  3:28:15AM",53,6,2023,"B0551",1,"BUSTR-27205"
"STLAD-340-2","LUANDA","DRILL SUPP","PREJB","WIP",49,"31-60","FLOT- BPX0098",197552,"300",NA,NA,NA,NA,2023,30,"STLAD",340,2,20,"B0078","",0,NA,0,0,1,NA,"",1,2023-06-05,"31/05/2023","12:00:00.000000AM",2023-05-31,"12:00:00.000000AM","03/06/2023","11:59:00.000000PM","03/06/2023","11:59:00.000000PM",NA,"","","","",NA,"",15,"","",NA,0,0,0,0,0,0,0,0,0,0,0,0,0,NA,0,"N",NA,NA,0,NA,"","","","",1,"N",NA,"Y","N","N","N",1,1,1,1,1,1,1,1,NA,"N",1,"WORKORDER",NA,NA,"AOA",NA,0,0,"N",NA,NA,NA,NA,"","",2,NA,2,NA,999,"","",NA,"","",NA,NA,"JKAUR3","08/06/2023 12:28:07AM",54,5,2023,"B0078",1,NA
"STABO-593-1","ABERDEEN","DRILL SUPP","PLAN","QC",46,"31-60","TDU",184031,"4260","9022","BP00206","BP00206","Tool Deployment Unit, TDU 01 OI Modified",2023,30,"STABO",593,1,10,"B0551","BUSTR",0,NA,0,0,37,NA,"EMEA0081",1,2023-06-08,"01/06/2023","12:00:00.000000AM",2023-06-01,"12:00:00.000000AM","30/06/2023","11:59:00.000000PM","30/06/2023","11:59:00.000000PM",NA,"","","","",NA,"",16,"","",NA,0,0,0,0,0,0,0,0,0,0,0,0,0,NA,0,"N",NA,NA,0,NA,"","","","",1,"N",2020502,"Y","N","N","N",1,1,1,1,1,1,1,1,NA,"N",1,"WOMUK",NA,NA,"GBP",NA,0,0,"N",NA,NA,NA,NA,"","BP_ABO_TDU_PP",2,NA,2,NA,999,"","",NA,"","",NA,NA,"JKAUR3","08/06/2023 12:23:16AM",53,6,2023,"B0551",1,"BUSTR-9022"
"STABO-599-1","ABERDEEN","DRILL SUPP","PLAN","QC",46,"31-60","TDU Trolly C/W HPU",184031,"4260","22078","BP00549","BP00549","Hydraulic Power Unit c/w Transportation Trolley, TDU 01",2023,30,"STABO",599,1,10,"B0551","BUSTR",0,NA,0,0,7,NA,"EMEA0081",1,2023-06-08,"01/06/2023","12:00:00.000000AM",2023-06-01,"12:00:00.000000AM","30/06/2023","11:59:00.000000PM","30/06/2023","11:59:00.000000PM",NA,"","","","",NA,"",16,"","",NA,0,0,0,0,0,0,0,0,0,0,0,0,0,NA,0,"N",NA,NA,0,NA,"","","","",1,"N",2020502,"Y","N","N","N",1,1,2,1,1,1,1,1,NA,"N",1,"WOMUK",NA,NA,"GBP",NA,0,0,"N",NA,NA,NA,NA,"","BP_ABO_TDU_TROLLY_C/W_HPU",2,NA,2,NA,999,"","",NA,"","",NA,NA,"GHARROLD","08/06/2023  5:32:26AM",53,6,2023,"B0551",1,"BUSTR-22078"
"STABO-601-1","ABERDEEN","DRILL SUPP","PLAN","QC",46,"31-60","TDU Mount Frames Male / Female",184031,"4260","23167","MBP00323","MBP00323","TDU Mount Frames Male / Female",2023,30,"STABO",601,1,10,"B0551","BUSTR",0,NA,0,0,1,NA,"EMEA0081",1,2023-06-08,"01/06/2023","12:00:00.000000AM",2023-06-01,"12:00:00.000000AM","30/06/2023","11:59:00.000000PM","30/06/2023","11:59:00.000000PM",NA,"","","","",NA,"",16,"","",NA,0,0,0,0,0,0,0,0,0,0,0,0,0,NA,0,"N",NA,NA,0,NA,"","","","",1,"N",2020502,"Y","N","N","N",1,1,1,1,1,1,1,1,NA,"N",1,"WOMUK",NA,NA,"GBP",NA,0,0,"N",NA,NA,NA,NA,"","BP_ABO_TDU_MOUNT_FRAMES",2,NA,2,NA,999,"","",NA,"","",NA,NA,"JKAUR3","08/06/2023 12:22:19AM",53,6,2023,"B0551",1,"BUSTR-23167"
"STABO-602-1","ABERDEEN","DRILL SUPP","PLAN","QC",46,"31-60","Torque Tool - 17H, High (100-2000 Nm)",184031,"4260","9048","BP00232","BP00232","Torque Tool - 17H, High (100-2000 Nm - OI Modified)",2023,30,"STABO",602,1,10,"B0551","BUSTR",0,NA,0,0,3,NA,"EMEA0081",1,2023-06-08,"01/06/2023","12:00:00.000000AM",2023-06-01,"12:00:00.000000AM","30/06/2023","11:59:00.000000PM","30/06/2023","11:59:00.000000PM",NA,"","","","",NA,"",16,"","",NA,0,0,0,0,0,0,0,0,0,0,0,0,0,NA,0,"N",NA,NA,0,NA,"","","","",1,"N",2020502,"Y","N","N","N",1,1,1,1,1,1,1,1,NA,"N",1,"WOMUK",NA,NA,"GBP",NA,0,0,"N",NA,NA,NA,NA,"","BP_ABO_17H_S7_TT-PP",2,NA,2,NA,999,"","",NA,"","",NA,NA,"JKAUR3","08/06/2023 12:21:58AM",53,6,2023,"B0551",1,"BUSTR-9048"
"STABO-603-1","ABERDEEN","DRILL SUPP","PLAN","QC",46,"31-60","17H TORQUE TOOL",184031,"4260","9063","BP00249","BP00249","Torque Tool - 17H, Medium (20-500 Nm)",2023,30,"STABO",603,1,10,"B0551","BUSTR",0,NA,0,0,2.5,NA,"EMEA0081",1,2023-06-08,"01/06/2023","12:00:00.000000AM",2023-06-01,"12:00:00.000000AM","30/06/2023","11:59:00.000000PM","30/06/2023","11:59:00.000000PM",NA,"","","","",NA,"",16,"","",NA,0,0,0,0,0,0,0,0,0,0,0,0,0,NA,0,"N",NA,NA,0,NA,"","","","",1,"N",2020502,"Y","N","N","N",1,1,1,1,1,1,1,1,NA,"N",1,"WOMUK",NA,NA,"GBP",NA,0,0,"N",NA,NA,NA,NA,"","BP_ABO_17H_TORQUE_TOOL_PP",2,NA,2,NA,999,"","",NA,"","",NA,NA,"JKAUR3","08/06/2023 12:21:35AM",53,6,2023,"B0551",1,"BUSTR-9063"
"STABO-586-1","ABERDEEN","DRILL SUPP","PLAN","QC",39,"31-60","EPS SKID PRE & POST JOB",184031,"4260","20933","BP00517","BP00517","PD8010 EPS Skid",2023,30,"STABO",586,1,10,"B0551","BUSTR",0,NA,0,0,7.72,NA,"EMEA0081",1,2023-06-15,"29/05/2023","12:00:00.000000AM",2023-05-29,"12:00:00.000000AM","30/06/2023","11:59:00.000000PM","30/06/2023","11:59:00.000000PM",NA,"","","","",NA,"",16,"","",NA,0,0,0,0,0,0,0,0,0,0,0,0,0,NA,0,"N",NA,NA,0,NA,"","","","",1,"N",2020502,"Y","N","N","N",1,1,1,1,1,1,1,1,NA,"N",1,"WOMUK",NA,NA,"GBP",NA,0,0,"N",NA,NA,NA,NA,"","BP_ABO_EPS",2,NA,2,NA,999,"","",NA,"","",NA,NA,"JKAUR3","15/06/2023  4:10:59AM",56,5,2023,"B0551",1,"BUSTR-20933"
"STABO-600-1","ABERDEEN","DRILL SUPP","PLAN","QC",39,"31-60","Laptop, Lenovo Thinkpad",184031,"4260","20920","BP00495","BP00495","Panasonic Laptop",2023,30,"STABO",600,1,10,"B0551","BUSTR",0,NA,0,0,1.5,NA,"EMEA0081",1,2023-06-15,"01/06/2023","12:00:00.000000AM",2023-06-01,"12:00:00.000000AM","30/06/2023","11:59:00.000000PM","30/06/2023","11:59:00.000000PM",NA,"","","","",NA,"",16,"","",NA,0,0,0,0,0,0,0,0,0,0,0,0,0,NA,0,"N",NA,NA,0,NA,"","","","",1,"N",2020502,"Y","N","N","N",1,1,1,1,1,1,1,1,NA,"N",1,"WOMUK",NA,NA,"GBP",NA,0,0,"N",NA,NA,NA,NA,"","BP_ABO_LAPTOP_LENOVO_PP",2,NA,2,NA,999,"","",NA,"","",NA,NA,"JKAUR3","15/06/2023  4:10:39AM",53,6,2023,"B0551",1,"BUSTR-20920"
"STABO-604-1","ABERDEEN","DRILL SUPP","PLAN","QC",39,"31-60","17H TORQUE TOOL",184031,"4260","9060","BP00246","BP00246","Torque Tool - Paddle, Low (OI Modified)",2023,30,"STABO",604,1,10,"B0551","BUSTR",0,NA,0,0,2,NA,"EMEA0081",1,2023-06-15,"01/06/2023","12:00:00.000000AM",2023-06-01,"12:00:00.000000AM","30/06/2023","11:59:00.000000PM","30/06/2023","11:59:00.000000PM",NA,"","","","",NA,"",16,"","",NA,0,0,0,0,0,0,0,0,0,0,0,0,0,NA,0,"N",NA,NA,0,NA,"","","","",1,"N",2020502,"Y","N","N","N",1,1,1,1,1,1,1,1,NA,"N",1,"WOMUK",NA,NA,"GBP",NA,0,0,"N",NA,NA,NA,NA,"","BP_ABO_17H_TORQUE_TOOL-PP",2,NA,2,NA,999,"","",NA,"","",NA,NA,"JKAUR3","15/06/2023  4:10:18AM",53,6,2023,"B0551",1,"BUSTR-9060"
"STABO-605-1","ABERDEEN","DRILL SUPP","PLAN","QC",39,"31-60","TDU Grabber (Standard / Heavy Duty)",184031,"4260","8881","BP00051","BP00051","Grabber (TDU), Standard",2023,30,"STABO",605,1,10,"B0551","BUSTR",0,NA,0,0,2.75,NA,"EMEA0081",1,2023-06-15,"01/06/2023","12:00:00.000000AM",2023-06-01,"12:00:00.000000AM","30/06/2023","11:59:00.000000PM","30/06/2023","11:59:00.000000PM",NA,"","","","",NA,"",16,"","",NA,0,0,0,0,0,0,0,0,0,0,0,0,0,NA,0,"N",NA,NA,0,NA,"","","","",1,"N",2020502,"Y","N","N","N",1,1,1,1,1,1,1,1,NA,"N",1,"WOMUK",NA,NA,"GBP",NA,0,0,"N",NA,NA,NA,NA,"","BP_ABO_TDU_GRABBER_PP",2,NA,2,NA,999,"","",NA,"","",NA,NA,"JKAUR3","15/06/2023  4:10:01AM",53,6,2023,"B0551",1,"BUSTR-8881"
"STAUS-756-22","PERTH","C&I","NEWBD","OHOT",35,"31-60","FAT#3 AND TEST SETUP",221770,"5000",NA,NA,NA,NA,2023,30,"STAUS",756,22,220,"B0811","",0,NA,0,0,120,NA,"",1,2023-06-19,"24/01/2023","12:00:00.000000AM",2023-01-24,"12:00:00.000000AM","10/03/2023","11:59:00.000000PM","10/03/2023","11:59:00.000000PM",NA,"17/06/2023"," 8:00:00.000000AM","18/06/2023"," 5:00:00.000000PM",NA,"",30,"","",NA,0,0,0,0,0,0,0,0,0,0,0,0,0,NA,0,"N",NA,NA,0,NA,"","","","",1,"N",NA,"Y","N","N","N",1,1,5,1,1,1,1,1,NA,"N",1,"",NA,NA,"AUD",NA,0,0,"N",NA,NA,NA,NA,"","",2,NA,2,NA,999,"","",NA,"","",NA,NA,"LSORIANO","19/07/2023  9:45:22PM",181,1,2023,"B0811",336,NA
"STAUS-841-3","PERTH","C&I","PREJB","OHOT",35,"31-60","REBUILDING OF 4"" VECTOR CAPS AND FAT",206017,"5091",NA,NA,NA,NA,2023,30,"STAUS",841,3,30,"B0811","",0,NA,0,0,40,NA,"",1,2023-06-19,"03/05/2023","12:00:00.000000AM",2023-04-17,"12:00:00.000000AM","15/05/2023","11:59:00.000000PM","12/05/2023","11:59:00.000000PM",NA,"16/06/2023"," 8:00:00.000000AM","19/06/2023"," 5:00:00.000000PM",NA,"",5,"","",NA,0,0,0,0,0,0,0,0,0,0,0,0,0,NA,0,"N",NA,NA,0,NA,"","","","",1,"N",NA,"Y","N","N","N",1,1,3,1,1,1,1,1,NA,"N",1,"",NA,NA,"AUD",NA,0,0,"N",NA,NA,NA,NA,"","",2,NA,2,NA,999,"","",NA,"","",NA,NA,"LSORIANO","27/06/2023  3:32:36AM",98,4,2023,"B0811",140,NA
"STAUS-854-15","PERTH","CLIENTOWN","ADHOC","PSCH",35,"31-60","CPI components assembly at DWS",221703,"4100",NA,NA,NA,NA,2023,30,"STAUS",854,15,150,"B0811","",0,NA,0,0,48,NA,"",1,2023-06-19,"05/07/2023","12:00:00.000000AM",2023-05-01,"12:00:00.000000AM","06/10/2023","11:59:00.000000PM","07/07/2023","11:59:00.000000PM",NA,"","","","",NA,"",1,"","",NA,0,0,0,0,0,0,0,0,0,0,0,0,0,NA,0,"N",NA,NA,0,NA,"","","","",1,"N",NA,"N","N","N","N",1,1,1,1,1,1,1,1,NA,"N",1,"",NA,NA,"AUD",NA,0,0,"N",NA,NA,NA,NA,"","",2,NA,2,NA,999,"","",NA,"","",NA,NA,"AWTAYLOR","18/07/2023  6:24:51PM",84,5,2023,"B0811",1,NA
"STAUS-903-6","PERTH","CLIENTOWN","PLAN","OPEN",35,"31-60","PSM-224334- SW2 Plug Modifications for Upending",224334,"8100",NA,NA,NA,NA,2023,30,"STAUS",903,6,60,"B0811","",0,NA,0,0,1,NA,"",1,2023-06-19,"03/07/2023","12:00:00.000000AM",2023-07-03,"12:00:00.000000AM","31/08/2023","11:59:00.000000PM","31/08/2023","11:59:00.000000PM",NA,"","","","",NA,"",25,"","",NA,0,0,0,0,0,0,0,0,0,0,0,0,0,NA,0,"N",NA,NA,0,NA,"","","","",1,"N",NA,"N","N","N","N",1,1,1,1,1,1,1,1,NA,"N",1,"",NA,NA,"AUD",NA,0,0,"N",NA,NA,NA,NA,"","",2,NA,2,NA,999,"","",NA,"","",NA,NA,"AWTAYLOR","23/07/2023  7:35:37PM",21,7,2023,"B0811",156,NA
"STAUS-904-4","PERTH","DECOMM","NEWBD","OPEN",35,"31-60","FAT of MQC Manifolds",221546,"5640",NA,NA,NA,NA,2023,30,"STAUS",904,4,40,"B0811","",0,NA,0,0,1,NA,"",1,2023-06-19,"20/06/2023","12:00:00.000000AM",2023-06-20,"12:00:00.000000AM","21/06/2023","11:59:00.000000PM","21/06/2023","11:59:00.000000PM",NA,"","","","",NA,"",29,"","",NA,0,0,0,0,0,0,0,0,0,0,0,0,0,NA,0,"N",NA,NA,0,NA,"","","","",1,"N",NA,"N","N","N","N",1,1,1,1,1,1,1,1,NA,"N",1,"",NA,NA,"AUD",NA,0,0,"N",NA,NA,NA,NA,"","",2,NA,2,NA,999,"","",NA,"","",NA,NA,"AALTAF1","19/07/2023 12:38:15AM",34,6,2023,"B0811",24,NA
"STABO-606-1","ABERDEEN","DRILL SUPP","PLAN","PSCH",34,"31-60","HCT, ACT, SPCOT Spares kit",184031,"4260","21312","BPSK00015","BPSK00015","Spares Kit, PD8010 EPS Skid",2023,30,"STABO",606,1,10,"B0551","BUSTR",0,NA,0,0,2,NA,"EMEA0081",1,2023-06-20,"20/06/2023","12:00:00.000000AM",2023-06-20,"12:00:00.000000AM","30/06/2023","11:59:00.000000PM","30/06/2023","11:59:00.000000PM",NA,"","","","",NA,"",16,"","",NA,0,0,0,0,0,0,0,0,0,0,0,0,0,NA,0,"N",NA,NA,0,NA,"","","","",1,"N",2020502,"Y","N","N","N",1,1,1,1,1,1,1,1,NA,"N",1,"WOMUK",NA,NA,"GBP",NA,0,0,"N",NA,NA,NA,NA,"","BP_ABO_HUB_CT_SPAREBX_PP",2,NA,2,NA,999,"STABO","ABERDEEN",NA,"","",NA,NA,"PMAHAJAN","20/06/2023  9:32:03AM",34,6,2023,"B0551",1,"BUSTR-21312"
"STAUS-724-25","PERTH","DRILL SUPP","PSTJB","OHWP",34,"31-60","LVOT Type A",220662,"7000","18402","SI0312","SI0312","Linear Valve Override Tool  LVOT - Type A Interface",2023,30,"STAUS",724,25,250,"B0811","BUSTR",0,NA,0,0,24,NA,"APAC05",1,2023-06-20,"24/11/2022","12:00:00.000000AM",2022-11-24,"12:00:00.000000AM","31/05/2023","11:59:00.000000PM","31/05/2023","11:59:00.000000PM",NA,"13/02/2023"," 8:00:00.000000AM","20/06/2023"," 5:00:00.000000PM",NA,"",1,"","",NA,0,0,0,0,0,0,0,0,0,0,0,0,0,NA,0,"N",NA,NA,0,NA,"","","","",1,"N",NA,"Y","N","N","N",1,4,9,1,1,1,1,1,NA,"N",1,"",NA,NA,"AUD",NA,0,0,"N",NA,NA,NA,NA,"","APAC_LVOT 980001291_PST",2,NA,2,NA,999,"","",NA,"","",NA,NA,"TVICAREY","18/07/2023  5:53:00PM",242,11,2022,"B0811",1,"BUSTR-18402"
"STAUS-724-26","PERTH","DRILL SUPP","PSTJB","OHWP",34,"31-60","LVOT Type A",220662,"7000","18028","AU0136","AU0136","LVOT",2023,30,"STAUS",724,26,260,"B0811","BUSTR",0,NA,0,0,1,NA,"APAC05",1,2023-06-20,"24/11/2022","12:00:00.000000AM",2022-11-24,"12:00:00.000000AM","23/05/2023","11:59:00.000000PM","23/06/2023","11:59:00.000000PM",NA,"04/05/2023"," 8:00:00.000000AM","20/06/2023"," 5:00:00.000000PM",NA,"",1,"","",NA,0,0,0,0,0,0,0,0,0,0,0,0,0,NA,0,"N",NA,NA,0,NA,"","","","",1,"N",NA,"Y","N","N","N",1,2,6,1,1,1,1,1,NA,"N",1,"",NA,NA,"AUD",NA,0,0,"N",NA,NA,NA,NA,"","",2,NA,2,NA,999,"","",NA,"J-MW-08-D","",NA,NA,"TVICAREY","18/07/2023  5:53:00PM",242,11,2022,"B0811",1,"BUSTR-18028"
"STAUS-765-3","PERTH","CLIENTOWN","PLAN","WIP",34,"31-60","Assembly & Testing of 10ea Tensioners",204452,"8826",NA,NA,NA,NA,2023,30,"STAUS",765,3,30,"B0811","",0,NA,0,0,80,NA,"",1,2023-06-20,"09/01/2023","12:00:00.000000AM",2023-01-09,"12:00:00.000000AM","22/01/2023","11:59:00.000000PM","22/01/2023","11:59:00.000000PM",NA,"14/06/2023"," 8:00:00.000000AM","10/07/2023"," 5:00:00.000000PM",NA,"",21,"","",NA,0,0,0,0,0,0,0,0,0,0,0,0,0,NA,0,"N",NA,NA,0,NA,"","","","",1,"N",NA,"Y","N","N","N",1,2,14,1,1,1,1,1,NA,"N",1,"",NA,NA,"AUD",NA,0,0,"N",NA,NA,NA,NA,"","",2,NA,2,NA,999,"","",NA,"","",NA,NA,"NFRANKLIN","10/07/2023  2:09:02AM",196,1,2023,"B0811",24,NA
"STAUS-841-4","PERTH","C&I","PREJB","OHWP",34,"31-60","REBUILDING AND FAT OF 6"" CVC FLOODING CAPS",206017,"5091",NA,NA,NA,NA,2023,30,"STAUS",841,4,40,"B0811","",0,NA,0,0,40,NA,"",1,2023-06-20,"16/05/2023","12:00:00.000000AM",2023-04-17,"12:00:00.000000AM","15/05/2023","11:59:00.000000PM","19/05/2023","11:59:00.000000PM",NA,"14/04/2023"," 8:00:00.000000AM","15/04/2023"," 5:00:00.000000PM",NA,"",5,"","",NA,0,0,0,0,0,0,0,0,0,0,0,0,0,NA,0,"N",NA,NA,0,NA,"","","","",1,"N",NA,"Y","N","N","N",1,1,2,1,1,1,1,1,NA,"N",1,"",NA,NA,"AUD",NA,0,0,"N",NA,NA,NA,NA,"","",2,NA,2,NA,999,"","",NA,"","",NA,NA,"LSORIANO","27/06/2023  3:32:36AM",98,4,2023,"B0811",140,NA
"STAUS-854-18","PERTH","CLIENTOWN","ADHOC","PSCH",34,"31-60","Inspection of CPI Items, 1"" and 2"" gate valves from TFMC",221703,"3000",NA,NA,NA,NA,2023,30,"STAUS",854,18,180,"B0811","",0,NA,0,0,1,NA,"",1,2023-06-20,"29/06/2023","12:00:00.000000AM",2023-05-01,"12:00:00.000000AM","06/10/2023","11:59:00.000000PM","29/06/2023","11:59:00.000000PM",NA,"","","","",NA,"",1,"","",NA,0,0,0,0,0,0,0,0,0,0,0,0,0,NA,0,"N",NA,NA,0,NA,"","","","",1,"N",NA,"N","N","N","N",1,1,1,1,1,1,1,1,NA,"N",1,"",NA,NA,"AUD",NA,0,0,"N",NA,NA,NA,NA,"","",2,NA,2,NA,999,"","",NA,"","",NA,NA,"AWTAYLOR","18/07/2023  6:24:52PM",84,5,2023,"B0811",1,NA
"STAUS-736-1","PERTH","DRILL SUPP","PSTJB","OHWP",33,"31-60","Camera on a stick",217015,"7000","18083","AU0245","AU0245","CAMERA ASSEMBLY",2023,30,"STAUS",736,1,10,"B0811","BUSTR",0,NA,0,0,3,NA,"APAC18",1,2023-06-21,"08/12/2022","12:00:00.000000AM",2022-12-08,"12:00:00.000000AM","31/07/2023","11:59:00.000000PM","01/07/2023","11:59:00.000000PM",NA,"04/05/2023"," 8:00:00.000000AM","04/05/2023"," 5:00:00.000000PM",NA,"",1,"","",NA,0,0,0,0,0,0,0,0,0,0,0,0,0,NA,0,"N",NA,NA,0,NA,"","","","",1,"N",NA,"Y","N","N","N",1,2,2,1,1,1,1,1,NA,"N",1,"",NA,NA,"AUD",NA,0,0,"N",NA,NA,NA,NA,"","ET_OII_AMOSCCAMERAROV_SOW",2,NA,2,NA,999,"","",NA,"","",NA,NA,"JMANGAN","29/06/2023  8:30:43PM",228,12,2022,"B0811",1,"BUSTR-18083"
"STAUS-879-1","PERTH","CLIENTOWN","PM","WIP",33,"31-60","FABRIC MAINTENANCE - SUBSEA ACCUMULATOR FRAMES",152875,"1060",NA,NA,NA,NA,2023,30,"STAUS",879,1,10,"B0811","",0,NA,0,0,160,NA,"",1,2023-06-21,"05/06/2023","12:00:00.000000AM",2023-06-05,"12:00:00.000000AM","30/06/2023","11:59:00.000000PM","30/06/2023","11:59:00.000000PM",NA,"21/06/2023"," 8:00:00.000000AM","14/07/2023"," 5:00:00.000000PM",NA,"",4,"","",NA,0,0,0,0,0,0,0,0,0,0,0,0,0,NA,0,"N",NA,NA,0,NA,"","","","",1,"N",NA,"Y","N","N","N",1,2,6,1,1,1,1,1,NA,"N",1,"",NA,NA,"AUD",NA,0,0,"N",NA,NA,NA,NA,"","",2,NA,2,NA,999,"","",NA,"","",NA,NA,"ASTANIMIROVIC","14/07/2023  1:55:56AM",49,6,2023,"B0811",160,NA
"STAUS-906-2","PERTH","CLIENTOWN","PREJB","TSCD",33,"31-60","TCRT reinstall handling neck.",221546,"4200",NA,NA,NA,NA,2023,30,"STAUS",906,2,20,"B0811","",0,NA,0,0,16,NA,"",1,2023-06-21,"19/06/2023","12:00:00.000000AM",2023-06-19,"12:00:00.000000AM","26/06/2023","11:59:00.000000PM","26/06/2023","11:59:00.000000PM",NA,"","","","",NA,"",27,"","",NA,0,0,0,0,0,0,0,0,0,0,0,0,0,NA,0,"N",NA,NA,0,NA,"","","","",1,"N",NA,"Y","N","N","N",1,1,1,1,1,1,1,1,NA,"N",1,"",NA,NA,"AUD",NA,0,0,"N",NA,NA,NA,NA,"","",2,NA,2,NA,999,"","",NA,"","",NA,NA,"JKAUR3","19/07/2023  5:18:50AM",35,6,2023,"B0811",48,NA
"STAUS-910-2","PERTH","DECOMM","NEWBD","WIP",32,"31-60","Inventory check against GA grawings",221546,"4645",NA,NA,NA,NA,2023,30,"STAUS",910,2,20,"B0811","",0,NA,0,0,6,NA,"",1,2023-06-22,"22/06/2023","12:00:00.000000AM",2023-06-22,"12:00:00.000000AM","23/06/2023","11:59:00.000000PM","23/06/2023","11:59:00.000000PM",NA,"","","","",NA,"",29,"","",NA,0,0,0,0,0,0,0,0,0,0,0,0,0,NA,0,"N",NA,NA,0,NA,"","","","",1,"N",NA,"Y","N","N","N",1,1,1,1,1,1,1,1,NA,"N",1,"",NA,NA,"AUD",NA,0,0,"N",NA,NA,NA,NA,"","",2,NA,2,NA,999,"","",NA,"","",NA,NA,"AWTAYLOR","03/07/2023  1:41:23AM",32,6,2023,"B0811",40,NA
"STABO-610-1","ABERDEEN","DRILL SUPP","PLAN","PSCH",31,"31-60","DR801400-1 DMAC WORK BASKET",184031,"4260","8836","BP00003","BP00003","Basket, Work (DMAC)",2023,30,"STABO",610,1,10,"B0551","BUSTR",0,NA,0,0,2.5,NA,"EMEA0501",1,2023-06-23,"23/06/2023","12:00:00.000000AM",2023-06-23,"12:00:00.000000AM","31/07/2023","11:59:00.000000PM","31/07/2023","11:59:00.000000PM",NA,"","","","",NA,"",16,"","",NA,0,0,0,0,0,0,0,0,0,0,0,0,0,NA,0,"N",NA,NA,0,NA,"","","","",1,"N",2020502,"Y","N","N","N",1,1,1,1,1,1,1,1,NA,"N",1,"WOMUK",NA,NA,"GBP",NA,0,0,"N",NA,NA,NA,NA,"","BP_ABO-WORK_BASKET_PP",2,NA,2,NA,999,"STABO","ABERDEEN",NA,"","",NA,NA,"PMAHAJAN","23/06/2023  4:27:59AM",31,6,2023,"B0551",1,"BUSTR-8836"
"STLAD-313-1","LUANDA","C&I","PREJB","OHOT",31,"31-60","TSR 072 - Overhaul TMS in stock",703088,"1",NA,NA,NA,NA,2023,30,"STLAD",313,1,10,"B0078","",0,NA,0,0,1,NA,"",1,2023-06-23,"10/04/2023","12:00:00.000000AM",2023-04-10,"12:00:00.000000AM","19/04/2023","11:59:00.000000PM","19/04/2023","11:59:00.000000PM",NA,"","","","",NA,"",16,"","",NA,0,0,0,0,0,0,0,0,0,0,0,0,0,NA,0,"N",NA,NA,0,NA,"","","","",1,"N",NA,"Y","N","N","N",1,2,2,1,1,1,1,1,NA,"N",1,"WORKORDER",NA,NA,"AOA",NA,0,0,"N",NA,NA,NA,NA,"","",2,NA,2,NA,999,"","",NA,"","",NA,NA,"DANTONIO","21/07/2023  9:13:21AM",105,4,2023,"B0078",1,NA
"STAUS-827-24","PERTH","C&I","PSTJB","OHOT",29,"21-30","100KG FLOTATION BLOCK POST-JOB",222656,"7000","22053","AU0603","AU0603","100 Kg Flotation Block",2023,30,"STAUS",827,24,240,"B0811","BUSTR",0,NA,0,0,1,NA,"APAC05",1,2023-06-25,"24/04/2023","12:00:00.000000AM",2023-04-24,"12:00:00.000000AM","23/06/2023","11:59:00.000000PM","01/06/2023","11:59:00.000000PM",NA,"","","","",NA,"",11,"","",NA,0,0,0,0,0,0,0,0,0,0,0,0,0,NA,0,"N",NA,NA,0,NA,"","","","",1,"N",NA,"N","N","N","N",1,1,1,1,1,1,1,1,NA,"N",1,"",NA,NA,"AUD",NA,0,0,"N",NA,NA,NA,NA,"","",2,NA,2,NA,999,"","",NA,"","",NA,NA,"TVICAREY","23/07/2023  6:57:26PM",91,4,2023,"B0811",1,"BUSTR-22053"
"STAUS-833-1","PERTH","C&I","NEWBD","OPEN",29,"21-30","Repair of the damaged electrical wire reeler",220885,"2000","18210","AU0495","AU0495","Camera Case System",2023,30,"STAUS",833,1,10,"B0811","BUSTR",0,NA,0,0,2,NA,"AGO00014",1,2023-06-25,"04/04/2023","12:00:00.000000AM",2023-04-04,"12:00:00.000000AM","07/04/2023","11:59:00.000000PM","07/04/2023","11:59:00.000000PM",NA,"","","","",NA,"",31,"","",NA,0,0,0,0,0,0,0,0,0,0,0,0,0,NA,0,"N",NA,NA,0,NA,"","","","",1,"N",NA,"N","N","N","N",1,1,1,1,1,1,1,1,NA,"N",1,"",NA,NA,"AUD",NA,0,0,"N",NA,NA,NA,NA,"","",2,NA,2,NA,999,"","",NA,"","",NA,NA,"JSMALL","25/06/2023  9:45:18PM",111,4,2023,"B0811",2,"BUSTR-18210"
"STAUS-910-3","PERTH","DECOMM","NEWBD","WIP",29,"21-30","Assembly of New Build TCRT",221546,"4645",NA,NA,NA,NA,2023,30,"STAUS",910,3,30,"B0811","",0,NA,0,0,32,NA,"",1,2023-06-25,"22/06/2023","12:00:00.000000AM",2023-06-21,"12:00:00.000000AM","23/11/2023","11:59:00.000000PM","23/11/2023","11:59:00.000000PM",NA,"","","","",NA,"",29,"","",NA,0,0,0,0,0,0,0,0,0,0,0,0,0,NA,0,"N",NA,NA,0,NA,"","","","",1,"N",NA,"Y","N","N","N",1,1,2,1,1,1,1,1,NA,"N",1,"",NA,NA,"AUD",NA,0,0,"N",NA,NA,NA,NA,"","",2,NA,2,NA,999,"","",NA,"","",NA,NA,"AWTAYLOR","03/07/2023  1:41:23AM",33,6,2023,"B0811",40,NA
"STAUS-914-1","PERTH","DRILL SUPP","PREJB","OPEN",29,"21-30","HP JETTING PUMP DYNASET 520 - PRE-JOB",222656,"2000","18548","AU0080","AU0080","High Pressure Jetting Pump Dynaset 520 957037653",2023,30,"STAUS",914,1,10,"B0811","BUSTR",0,NA,0,0,1,NA,"APAC07",1,2023-06-25,"27/06/2023","12:00:00.000000AM",2023-06-27,"12:00:00.000000AM","28/07/2023","11:59:00.000000PM","28/07/2023","11:59:00.000000PM",NA,"","","","",NA,"",11,"","",NA,0,0,0,0,0,0,0,0,0,0,0,0,0,NA,0,"N",NA,NA,0,NA,"","","","",1,"N",NA,"Y","N","N","N",1,1,1,1,1,1,1,1,NA,"N",1,"",NA,NA,"AUD",NA,0,0,"N",NA,NA,NA,NA,"","",2,NA,2,NA,999,"","",NA,"","",NA,NA,"AWTAYLOR","02/07/2023  6:38:43PM",27,6,2023,"B0811",1,"BUSTR-18548"
"STAUS-914-2","PERTH","DRILL SUPP","PREJB","OPEN",29,"21-30","18.75 FX HDRAULIC WELLHEAD CLT - PRE-JOB",222656,"2000","18417","SI0617","SI0617","CLEANER FX-2 VX ROTARY HUB ASSEMBLY",2023,30,"STAUS",914,2,20,"B0811","BUSTR",0,NA,0,0,1,NA,"APAC07",1,2023-06-25,"27/06/2023","12:00:00.000000AM",2023-06-27,"12:00:00.000000AM","28/07/2023","11:59:00.000000PM","28/07/2023","11:59:00.000000PM",NA,"","","","",NA,"",11,"","",NA,0,0,0,0,0,0,0,0,0,0,0,0,0,NA,0,"N",NA,NA,0,NA,"","","","",1,"N",NA,"N","N","N","N",1,1,1,1,1,1,1,1,NA,"N",1,"",NA,NA,"AUD",NA,0,0,"N",NA,NA,NA,NA,"","",2,NA,2,NA,999,"","",NA,"","",NA,NA,"AWTAYLOR","02/07/2023  6:38:43PM",27,6,2023,"B0811",1,"BUSTR-18417"
"STAUS-914-3","PERTH","DRILL SUPP","PREJB","OPEN",29,"21-30","HIGH-LOW INTERVENTION SKID - PRE-JOB",222656,"2000","12854","HILOS-006","HILOS-006","USE BUROV ASSET HILOS0006 FOR ASSET TRACKING",2023,30,"STAUS",914,3,30,"B0811","BUSTR",0,NA,0,0,1,NA,"APAC07",1,2023-06-25,"27/06/2023","12:00:00.000000AM",2023-06-27,"12:00:00.000000AM","28/07/2023","11:59:00.000000PM","28/07/2023","11:59:00.000000PM",NA,"","","","",NA,"",11,"","",NA,0,0,0,0,0,0,0,0,0,0,0,0,0,NA,0,"N",NA,NA,0,NA,"","","","",1,"N",NA,"N","N","N","N",1,1,1,1,1,1,1,1,NA,"N",1,"",NA,NA,"AUD",NA,0,0,"N",NA,NA,NA,NA,"","",2,NA,2,NA,999,"","",NA,"","",NA,NA,"AWTAYLOR","02/07/2023  6:38:43PM",27,6,2023,"B0811",1,"BUSTR-12854"
"STAUS-914-4","PERTH","DRILL SUPP","PREJB","OPEN",29,"21-30","MULTI PURPOSE CLEANING TOOL - PRE-JOB",222656,"2000","18253","AU0544","AU0544","MULTI PURPOSE CLEANING TOOL 10 IN",2023,30,"STAUS",914,4,40,"B0811","BUSTR",0,NA,0,0,1,NA,"APAC07",1,2023-06-25,"27/06/2023","12:00:00.000000AM",2023-06-27,"12:00:00.000000AM","28/07/2023","11:59:00.000000PM","28/07/2023","11:59:00.000000PM",NA,"","","","",NA,"",11,"","",NA,0,0,0,0,0,0,0,0,0,0,0,0,0,NA,0,"N",NA,NA,0,NA,"","","","",1,"N",NA,"Y","N","N","N",1,1,1,1,1,1,1,1,NA,"N",1,"",NA,NA,"AUD",NA,0,0,"N",NA,NA,NA,NA,"","",2,NA,2,NA,999,"","",NA,"","",NA,NA,"AWTAYLOR","02/07/2023  6:38:43PM",27,6,2023,"B0811",1,"BUSTR-18253"
"STAUS-914-6","PERTH","DRILL SUPP","PREJB","OPEN",29,"21-30","TORQUE TOOL ELECTRIC CLASS 1-4 - PRE-JOB",222656,"2000","18233","AU0522","AU0522","TORQUE TOOL ELECTRIC CL 1-4 FL",2023,30,"STAUS",914,6,60,"B0811","BUSTR",0,NA,0,0,1,NA,"APAC38",1,2023-06-25,"27/06/2023","12:00:00.000000AM",2023-06-27,"12:00:00.000000AM","28/07/2023","11:59:00.000000PM","28/07/2023","11:59:00.000000PM",NA,"","","","",NA,"",11,"","",NA,0,0,0,0,0,0,0,0,0,0,0,0,0,NA,0,"N",NA,NA,0,NA,"","","","",1,"N",NA,"N","N","N","N",1,1,1,1,1,1,1,1,NA,"N",1,"",NA,NA,"AUD",NA,0,0,"N",NA,NA,NA,NA,"","",2,NA,2,NA,999,"","",NA,"","",NA,NA,"AWTAYLOR","02/07/2023  6:38:43PM",27,6,2023,"B0811",1,"BUSTR-18233"
"STAUS-914-7","PERTH","DRILL SUPP","PREJB","OPEN",29,"21-30","TT TEST JIG CLASS 1-4 - PRE-JOB",222656,"2000","18008","AU0090","AU0090","TORQUE TOOL TEST JIG",2023,30,"STAUS",914,7,70,"B0811","BUSTR",0,NA,0,0,1,NA,"AUS00002",1,2023-06-25,"27/06/2023","12:00:00.000000AM",2023-06-27,"12:00:00.000000AM","28/07/2023","11:59:00.000000PM","28/07/2023","11:59:00.000000PM",NA,"","","","",NA,"",11,"","",NA,0,0,0,0,0,0,0,0,0,0,0,0,0,NA,0,"N",NA,NA,0,NA,"","","","",1,"N",NA,"N","N","N","N",1,1,1,1,1,1,1,1,NA,"N",1,"",NA,NA,"AUD",NA,0,0,"N",NA,NA,NA,NA,"","",2,NA,2,NA,999,"","",NA,"","",NA,NA,"AWTAYLOR","02/07/2023  6:38:43PM",27,6,2023,"B0811",1,"BUSTR-18008"
"STAUS-914-8","PERTH","DRILL SUPP","PREJB","OPEN",29,"21-30","FLYING LEAD ORIENTATION TOOL - PRE-JOB",222656,"2000","18141","AU0367","AU0367","FLYING LEAD ORIENTATION TOOL",2023,30,"STAUS",914,8,80,"B0811","BUSTR",0,NA,0,0,1,NA,"APAC07",1,2023-06-25,"27/06/2023","12:00:00.000000AM",2023-06-27,"12:00:00.000000AM","28/07/2023","11:59:00.000000PM","28/07/2023","11:59:00.000000PM",NA,"","","","",NA,"",11,"","",NA,0,0,0,0,0,0,0,0,0,0,0,0,0,NA,0,"N",NA,NA,0,NA,"","","","",1,"N",NA,"N","N","N","N",1,1,1,1,1,1,1,1,NA,"N",1,"",NA,NA,"AUD",NA,0,0,"N",NA,NA,NA,NA,"","",2,NA,2,NA,999,"","",NA,"","",NA,NA,"AWTAYLOR","02/07/2023  6:38:43PM",27,6,2023,"B0811",1,"BUSTR-18141"
"STAUS-914-9","PERTH","DRILL SUPP","PREJB","OPEN",29,"21-30","IW12 - PRE-JOB",222656,"2000","18048","AU0163","AU0163","Impact Wrench IW12",2023,30,"STAUS",914,9,90,"B0811","BUSTR",0,NA,0,0,1,NA,"APAC07",1,2023-06-25,"27/06/2023","12:00:00.000000AM",2023-06-27,"12:00:00.000000AM","28/07/2023","11:59:00.000000PM","28/07/2023","11:59:00.000000PM",NA,"","","","",NA,"",11,"","",NA,0,0,0,0,0,0,0,0,0,0,0,0,0,NA,0,"N",NA,NA,0,NA,"","","","",1,"N",NA,"N","N","N","N",1,1,1,1,1,1,1,1,NA,"N",1,"",NA,NA,"AUD",NA,0,0,"N",NA,NA,NA,NA,"","",2,NA,2,NA,999,"","",NA,"","",NA,NA,"AWTAYLOR","02/07/2023  6:38:43PM",27,6,2023,"B0811",1,"BUSTR-18048"
"STAUS-915-1","PERTH","C&I","PLAN","OPEN",29,"21-30","PSM AMOSC HFL Frame Modification",152875,"2018.1060",NA,NA,NA,NA,2023,30,"STAUS",915,1,10,"B0811","",0,NA,0,0,80,NA,"",1,2023-06-25,"10/07/2023","12:00:00.000000AM",2023-07-10,"12:00:00.000000AM","21/07/2023","11:59:00.000000PM","21/07/2023","11:59:00.000000PM",NA,"","","","",NA,"",25,"","",NA,0,0,0,0,0,0,0,0,0,0,0,0,0,NA,0,"N",NA,NA,0,NA,"","","","",1,"N",NA,"N","N","N","N",1,1,1,1,1,1,1,1,NA,"N",1,"",NA,NA,"AUD",NA,0,0,"N",NA,NA,NA,NA,"","",2,NA,2,NA,999,"","",NA,"","",NA,NA,"ASHARMA21","07/07/2023  1:12:03AM",14,7,2023,"B0811",80,NA
"STABO-607-1","ABERDEEN","DRILL SUPP","PLAN","OHWP",28,"21-30","Frame, Launch & Recovery Complete strip down and rebuild.",184031,"4260","8923","BP00096","BP00096","Frame, Launch & Recovery",2023,30,"STABO",607,1,10,"B0551","BUSTR",0,NA,0,0,15,NA,"EMEA0501",1,2023-06-26,"23/06/2023","12:00:00.000000AM",2023-06-23,"12:00:00.000000AM","31/07/2023","11:59:00.000000PM","31/07/2023","11:59:00.000000PM",NA,"","","","",NA,"",16,"","",NA,0,0,0,0,0,0,0,0,0,0,0,0,0,NA,0,"N",NA,NA,0,NA,"","","","",1,"N",2020502,"Y","N","N","N",1,1,1,1,1,1,1,1,NA,"N",1,"WOMUK",NA,NA,"GBP",NA,0,0,"N",NA,NA,NA,NA,"","BP_ABO_FRAME_L&R_2YEARLY",2,NA,2,NA,999,"","",NA,"","",NA,NA,"WGEDDES","26/06/2023  2:46:32AM",31,6,2023,"B0551",1,"BUSTR-8923"
"STABO-611-1","ABERDEEN","DRILL SUPP","PLAN","PSCH",28,"21-30","Frame, Launch & Recovery Complete strip down and rebuild.",184031,"4260","8922","BP00095","BP00095","Frame, Launch & Recovery",2023,30,"STABO",611,1,10,"B0551","BUSTR",0,NA,0,0,15,NA,"EMEA0081",1,2023-06-26,"26/06/2023","12:00:00.000000AM",2023-06-26,"12:00:00.000000AM","31/07/2023","11:59:00.000000PM","31/07/2023","11:59:00.000000PM",NA,"","","","",NA,"",16,"","",NA,0,0,0,0,0,0,0,0,0,0,0,0,0,NA,0,"N",NA,NA,0,NA,"","","","",1,"N",2020502,"Y","N","N","N",1,1,1,1,1,1,1,1,NA,"N",1,"WOMUK",NA,NA,"GBP",NA,0,0,"N",NA,NA,NA,NA,"","BP_ABO_FRAME_L&R_2YEARLY",2,NA,2,NA,999,"","",NA,"","",NA,NA,"PMAHAJAN","26/06/2023  9:33:02AM",28,6,2023,"B0551",1,"BUSTR-8922"
"STABO-612-1","ABERDEEN","DRILL SUPP","PLAN","PSCH",28,"21-30","Choke Shipping Basket Pre/ Post",184031,"4260","21943","BP00546","BP00546","Frame, Pedestal - Choke (MARS)",2023,30,"STABO",612,1,10,"B0551","BUSTR",0,NA,0,0,4,NA,"EMEA0081",1,2023-06-26,"26/06/2023","12:00:00.000000AM",2023-06-26,"12:00:00.000000AM","31/07/2023","11:59:00.000000PM","31/07/2023","11:59:00.000000PM",NA,"","","","",NA,"",2,"","",NA,0,0,0,0,0,0,0,0,0,0,0,0,0,NA,0,"N",NA,NA,0,NA,"","","","",1,"N",2020502,"Y","N","N","N",1,1,1,1,1,1,1,1,NA,"N",1,"WOMUK",NA,NA,"GBP",NA,0,0,"N",NA,NA,NA,NA,"","BP_ABO_CHOKE_BASKET",2,NA,2,NA,999,"STABO","ABERDEEN",NA,"","",NA,NA,"PMAHAJAN","26/06/2023  9:32:31AM",28,6,2023,"B0551",1,"BUSTR-21943"
"STAUS-827-25","PERTH","C&I","PSTJB","OPEN",28,"21-30","FLOT POST-JOB",222656,"7000","18502","SI0014","SI0014","Flying Lead Orientation Tool FLOT",2023,30,"STAUS",827,25,250,"B0811","BUSTR",0,NA,0,0,1,NA,"APAC20",1,2023-06-26,"24/04/2023","12:00:00.000000AM",2023-04-24,"12:00:00.000000AM","23/06/2023","11:59:00.000000PM","01/06/2023","11:59:00.000000PM",NA,"","","","",NA,"",11,"","",NA,0,0,0,0,0,0,0,0,0,0,0,0,0,NA,0,"N",NA,NA,0,NA,"","","","",1,"N",NA,"N","N","N","N",1,1,1,1,1,1,1,1,NA,"N",1,"",NA,NA,"AUD",NA,0,0,"N",NA,NA,NA,NA,"","",2,NA,2,NA,999,"","",NA,"","",NA,NA,"TVICAREY","23/07/2023  6:57:26PM",91,4,2023,"B0811",1,"BUSTR-18502"
"STAUS-843-4","PERTH","DRILL SUPP","PSTJB","PSCH",28,"21-30","FLYING LEAD ORIENTATION TOOL POST JOB",221988,"7000","18141","AU0367","AU0367","FLYING LEAD ORIENTATION TOOL",2023,30,"STAUS",843,4,40,"B0811","BUSTR",0,NA,0,0,1,NA,"APAC07",1,2023-06-26,"19/04/2023","12:00:00.000000AM",2023-04-19,"12:00:00.000000AM","30/06/2023","11:59:00.000000PM","30/06/2023","11:59:00.000000PM",NA,"","","","",NA,"",11,"","",NA,0,0,0,0,0,0,0,0,0,0,0,0,0,NA,0,"N",NA,NA,0,NA,"","","","",1,"N",NA,"N","N","N","N",1,1,1,1,1,1,1,1,NA,"N",1,"",NA,NA,"AUD",NA,0,0,"N",NA,NA,NA,NA,"","",2,NA,2,NA,999,"","",NA,"","",NA,NA,"TVICAREY","18/07/2023  5:44:46PM",96,4,2023,"B0811",1,"BUSTR-18141"
"STAUS-914-12","PERTH","DRILL SUPP","PREJB","OHWP",28,"21-30","MANIPULATOR TORQUE TOOL 17D CL - PRE-JOB",222656,"2000","18007","AU0088","AU0088","ROV MANIPULATOR ASSEMBLY",2023,30,"STAUS",914,12,120,"B0811","BUSTR",0,NA,0,0,1,NA,"APAC07",1,2023-06-26,"27/06/2023","12:00:00.000000AM",2023-06-27,"12:00:00.000000AM","28/07/2023","11:59:00.000000PM","28/07/2023","11:59:00.000000PM",NA,"","","","",NA,"",11,"","",NA,0,0,0,0,0,0,0,0,0,0,0,0,0,NA,0,"N",NA,NA,0,NA,"","","","",1,"N",NA,"Y","N","N","N",1,1,1,1,1,1,1,1,NA,"N",1,"",NA,NA,"AUD",NA,0,0,"N",NA,NA,NA,NA,"","",2,NA,2,NA,999,"","",NA,"","",NA,NA,"AWTAYLOR","02/07/2023  6:38:43PM",27,6,2023,"B0811",1,"BUSTR-18007"
"STAUS-914-14","PERTH","DRILL SUPP","PREJB","OPEN",28,"21-30","FRONT CLIP FLUID SKID 40 GALLON BLADDER - PRE-JOB",222656,"2000","18218","AU0507","AU0507","40 Gallon Bladder",2023,30,"STAUS",914,14,140,"B0811","BUSTR",0,NA,0,0,1,NA,"AUS00002",1,2023-06-26,"27/06/2023","12:00:00.000000AM",2023-06-27,"12:00:00.000000AM","28/07/2023","11:59:00.000000PM","28/07/2023","11:59:00.000000PM",NA,"","","","",NA,"",11,"","",NA,0,0,0,0,0,0,0,0,0,0,0,0,0,NA,0,"N",NA,NA,0,NA,"","","","",1,"N",NA,"N","N","N","N",1,1,1,1,1,1,1,1,NA,"N",1,"",NA,NA,"AUD",NA,0,0,"N",NA,NA,NA,NA,"","",2,NA,2,NA,999,"","",NA,"","",NA,NA,"AWTAYLOR","02/07/2023  6:38:43PM",27,6,2023,"B0811",1,"BUSTR-18218"
"STAUS-914-16","PERTH","DRILL SUPP","PREJB","OHOT",28,"21-30","17D CLASS 1-4 TEST JIG AWS",222656,"2000","18675","AUX0013","6763-21","17D-Class 1-4 Torque Analyzer AWS",2023,30,"STAUS",914,16,160,"B0811","BUSTR",0,NA,0,0,1,NA,"APAC38",1,2023-06-26,"27/06/2023","12:00:00.000000AM",2023-06-27,"12:00:00.000000AM","28/07/2023","11:59:00.000000PM","28/07/2023","11:59:00.000000PM",NA,"","","","",NA,"",11,"","",NA,0,0,0,0,0,0,0,0,0,0,0,0,0,NA,0,"N",NA,NA,0,NA,"","","","",1,"N",NA,"Y","N","N","N",1,1,1,1,1,1,1,1,NA,"N",1,"",NA,NA,"AUD",NA,0,0,"N",NA,NA,NA,NA,"","",2,NA,2,NA,999,"","",NA,"","",NA,NA,"AWTAYLOR","02/07/2023  6:38:43PM",27,6,2023,"B0811",1,"BUSTR-18675"
"STAUS-860-2","PERTH","C&I","NEWBD","PSCH",27,"21-30","Cycle Test of the Batteries",224357,"5000","27544","AU0697","AU0697","SEABATTERY POWER MODULE",2023,30,"STAUS",860,2,20,"B0811","BUSTR",0,NA,0,0,1,NA,"APAC07",1,2023-06-27,"01/05/2023","12:00:00.000000AM",2023-05-01,"12:00:00.000000AM","16/05/2023","11:59:00.000000PM","16/05/2023","11:59:00.000000PM",NA,"","","","",NA,"",1,"","",NA,0,0,0,0,0,0,0,0,0,0,0,0,0,NA,0,"N",NA,NA,0,NA,"","","","",1,"N",NA,"N","N","N","N",1,1,1,1,1,1,1,1,NA,"N",1,"",NA,NA,"AUD",NA,0,0,"N",NA,NA,NA,NA,"","",2,NA,2,NA,999,"","",NA,"","",NA,NA,"AWTAYLOR","17/07/2023 11:52:59PM",84,5,2023,"B0811",1,"BUSTR-27544"
"STABO-608-1","ABERDEEN","DRILL SUPP","PLAN","QC",26,"21-30","Check sheet is for assets that post-job inspection were completed recently and require no further maintenance.",184031,"4260","22800","MBP00218","MBP00218","Norm Kit",2023,30,"STABO",608,1,10,"B0551","BUSTR",0,NA,0,0,1,NA,"EMEA0500",1,2023-06-28,"23/06/2023","12:00:00.000000AM",2023-06-23,"12:00:00.000000AM","31/07/2023","11:59:00.000000PM","31/07/2023","11:59:00.000000PM",NA,"23/06/2023","12:00:00.000000PM","23/06/2023"," 3:30:00.000000PM",NA,"",16,"","",NA,0,0,0,0,0,0,0,0,0,0,0,0,0,NA,0,"N",NA,NA,0,NA,"","","","",1,"N",2020502,"Y","N","N","N",1,1,1,1,1,1,1,1,NA,"N",1,"WOMUK",NA,NA,"GBP",NA,0,0,"N",NA,NA,NA,NA,"","APAC_MAIN-TRANS_PRE",2,NA,2,NA,999,"","",NA,"","",NA,NA,"JKAUR3","28/06/2023  2:20:08AM",31,6,2023,"B0551",1,"BUSTR-22800"
"STABO-609-1","ABERDEEN","DRILL SUPP","PLAN","QC",26,"21-30","HCT, ACT, SPCOT Spares kit",184031,"4260","20862","BPSK00007","BPSK00007","Spares Kit, DMAC - Fly-to-Place (FTP) Tool",2023,30,"STABO",609,1,10,"B0551","BUSTR",0,NA,0,0,2,NA,"EMEA0501",1,2023-06-28,"23/06/2023","12:00:00.000000AM",2023-06-23,"12:00:00.000000AM","31/07/2023","11:59:00.000000PM","31/07/2023","11:59:00.000000PM",NA,"","","","",NA,"",16,"","",NA,0,0,0,0,0,0,0,0,0,0,0,0,0,NA,0,"N",NA,NA,0,NA,"","","","",1,"N",2020502,"Y","N","N","N",1,1,1,1,1,1,1,1,NA,"N",1,"WOMUK",NA,NA,"GBP",NA,0,0,"N",NA,NA,NA,NA,"","BP_ABO_HUB_CT_SPAREBX_PP",2,NA,2,NA,999,"","",NA,"","",NA,NA,"JKAUR3","28/06/2023  2:19:52AM",31,6,2023,"B0551",1,"BUSTR-20862"
"STAUS-839-13","PERTH","C&I","PLAN","PSCH",25,"21-30","Installation of New NON-IWIS Card",225043,"5000",NA,NA,NA,NA,2023,30,"STAUS",839,13,50,"B0811","",0,NA,0,0,1,NA,"",1,2023-06-29,"17/07/2023","12:00:00.000000AM",2023-04-11,"12:00:00.000000AM","11/05/2023","11:59:00.000000PM","17/07/2023","11:59:00.000000PM",NA,"","","","",NA,"",1,"","",NA,0,0,0,0,0,0,0,0,0,0,0,0,0,NA,0,"N",NA,NA,0,NA,"","","","",1,"N",NA,"N","N","N","N",1,1,1,1,1,1,1,1,NA,"N",1,"",NA,NA,"AUD",NA,0,0,"N",NA,NA,NA,NA,"","",2,NA,2,NA,999,"","",NA,"","",NA,NA,"JKAUR3","12/07/2023  4:48:09AM",104,4,2023,"B0811",23,NA
"STAUS-839-14","PERTH","C&I","PLAN","PSCH",25,"21-30","Re Assembly of DIU Canister and Testing",225043,"5000",NA,NA,NA,NA,2023,30,"STAUS",839,14,60,"B0811","",0,NA,0,0,8,NA,"",1,2023-06-29,"18/07/2023","12:00:00.000000AM",2023-04-11,"12:00:00.000000AM","11/05/2023","11:59:00.000000PM","20/07/2023","11:59:00.000000PM",NA,"","","","",NA,"",1,"","",NA,0,0,0,0,0,0,0,0,0,0,0,0,0,NA,0,"N",NA,NA,0,NA,"","","","",1,"N",NA,"N","N","N","N",1,1,1,1,1,1,1,1,NA,"N",1,"",NA,NA,"AUD",NA,0,0,"N",NA,NA,NA,NA,"","",2,NA,2,NA,999,"","",NA,"","",NA,NA,"JKAUR3","12/07/2023  4:48:09AM",104,4,2023,"B0811",23,NA
"STAUS-860-1","PERTH","C&I","NEWBD","PSCH",25,"21-30","Testing & Green Tag of Charger & SeaBattery",224357,"5000","27544","AU0697","AU0697","SEABATTERY POWER MODULE",2023,30,"STAUS",860,1,10,"B0811","BUSTR",0,NA,0,0,1,NA,"APAC07",1,2023-06-29,"01/05/2023","12:00:00.000000AM",2023-05-01,"12:00:00.000000AM","16/05/2023","11:59:00.000000PM","16/05/2023","11:59:00.000000PM",NA,"","","","",NA,"",1,"","",NA,0,0,0,0,0,0,0,0,0,0,0,0,0,NA,0,"N",NA,NA,0,NA,"","","","",1,"N",NA,"Y","N","N","N",1,1,1,1,1,1,1,1,NA,"N",1,"",NA,NA,"AUD",NA,0,0,"N",NA,NA,NA,NA,"","",2,NA,2,NA,999,"","",NA,"","",NA,NA,"AWTAYLOR","17/07/2023 11:52:59PM",84,5,2023,"B0811",1,"BUSTR-27544"
"STAUS-906-1","PERTH","CLIENTOWN","PREJB","OHWP",25,"21-30","TCRT reassembly",221546,"4200",NA,NA,NA,NA,2023,30,"STAUS",906,1,10,"B0811","",0,NA,0,0,48,NA,"",1,2023-06-29,"19/06/2023","12:00:00.000000AM",2023-06-19,"12:00:00.000000AM","26/08/2023","11:59:00.000000PM","26/08/2023","11:59:00.000000PM",NA,"26/06/2023"," 8:00:00.000000AM","17/07/2023"," 5:00:00.000000PM",NA,"",27,"","",NA,0,0,0,0,0,0,0,0,0,0,0,0,0,NA,0,"N",NA,NA,0,NA,"","","","",1,"N",NA,"Y","N","N","N",1,1,7,1,1,1,1,1,NA,"N",1,"",NA,NA,"AUD",NA,0,0,"N",NA,NA,NA,NA,"","",2,NA,2,NA,999,"","",NA,"","",NA,NA,"JKAUR3","19/07/2023  5:18:50AM",35,6,2023,"B0811",48,NA
"STAUS-852-2","PERTH","C&I","PLAN","OHWP",22,"21-30","RCU POST-JOB",224727,"5000","18657","SI0229","SI0229","Remote Control Unit RCU",2023,30,"STAUS",852,2,20,"B0811","BUSTR",0,NA,0,0,2,NA,"AUS00005",1,2023-07-02,"26/01/2023","12:00:00.000000AM",2023-01-26,"12:00:00.000000AM","28/10/2023","11:59:00.000000PM","28/10/2023","11:59:00.000000PM",NA,"27/06/2023"," 8:00:00.000000AM","27/06/2023"," 5:00:00.000000PM",NA,"",32,"","",NA,0,0,0,0,0,0,0,0,0,0,0,0,0,NA,0,"N",NA,NA,0,NA,"","","","",1,"N",NA,"Y","N","N","N",1,1,1,1,1,1,1,1,NA,"N",1,"",NA,NA,"AUD",NA,0,0,"N",NA,NA,NA,NA,"","",2,NA,2,NA,999,"","",NA,"","",NA,NA,"TVICAREY","02/07/2023  9:28:29PM",179,1,2023,"B0811",8,"BUSTR-18657"
"STAUS-899-3","PERTH","C&I","NEWBD","TSCD",22,"21-30","Assembly and FAT of acid shrouds",225166,"5000",NA,NA,NA,NA,2023,30,"STAUS",899,3,20,"B0811","",1,NA,0,0,8,NA,"",1,2023-07-02,"27/06/2023","12:00:00.000000AM",2023-06-16,"12:00:00.000000AM","19/06/2023","11:59:00.000000PM","29/06/2023","11:59:00.000000PM",NA,"03/07/2023"," 8:00:00.000000AM","19/07/2023"," 5:00:00.000000PM",NA,"",32,"","",NA,0,0,0,0,0,0,0,0,0,0,0,0,0,NA,0,"N",NA,NA,0,NA,"","","","",1,"N",NA,"Y","N","N","N",1,1,2,1,1,1,1,1,NA,"N",1,"",NA,NA,"AUD",NA,0,0,"N",NA,NA,NA,NA,"","",2,NA,2,NA,999,"","",NA,"","",NA,NA,"ASTANIMIROVIC","20/07/2023  6:18:04PM",38,6,2023,"B0811",12,NA
"STAUS-914-5","PERTH","DRILL SUPP","PREJB","TSCD",22,"21-30","CAMERA ON A STICK - PRE-JOB",222656,"2000","18054","AU0179","AU0179","CAMERA ASSEMBLY",2023,30,"STAUS",914,5,50,"B0811","BUSTR",0,NA,0,0,1,NA,"APAC07",1,2023-07-02,"27/06/2023","12:00:00.000000AM",2023-06-27,"12:00:00.000000AM","28/07/2023","11:59:00.000000PM","28/07/2023","11:59:00.000000PM",NA,"03/07/2023"," 8:00:00.000000AM","03/07/2023"," 5:00:00.000000PM",NA,"",11,"","",NA,0,0,0,0,0,0,0,0,0,0,0,0,0,NA,0,"N",NA,NA,0,NA,"","","","",1,"N",NA,"Y","N","N","N",1,1,1,1,1,1,1,1,NA,"N",1,"",NA,NA,"AUD",NA,0,0,"N",NA,NA,NA,NA,"","",2,NA,2,NA,999,"","",NA,"","",NA,NA,"RSTEPHENSON","03/07/2023  1:31:36AM",27,6,2023,"B0811",1,"BUSTR-18054"
"STAUS-827-26","PERTH","C&I","PSTJB","OHWP",21,"21-30","BUOYANCY BLOCK 100 KG POST-JOB",222656,"7000","18056","AU0190","AU0190","BUOYANCY MODULE",2023,30,"STAUS",827,26,260,"B0811","BUSTR",0,NA,0,0,1,NA,"ROVMG109",1,2023-07-03,"24/04/2023","12:00:00.000000AM",2023-04-24,"12:00:00.000000AM","23/06/2023","11:59:00.000000PM","01/06/2023","11:59:00.000000PM",NA,"","","","",NA,"",11,"","",NA,0,0,0,0,0,0,0,0,0,0,0,0,0,NA,0,"N",NA,NA,0,NA,"","","","",1,"N",NA,"N","N","N","N",1,1,1,1,1,1,1,1,NA,"N",1,"",NA,NA,"AUD",NA,0,0,"N",NA,NA,NA,NA,"","",2,NA,2,NA,999,"","",NA,"","",NA,NA,"TVICAREY","23/07/2023  6:57:26PM",91,4,2023,"B0811",1,"BUSTR-18056"
"STAUS-854-19","PERTH","CLIENTOWN","ADHOC","PSCH",21,"21-30","Moving coated plates returned from Surface technology",221703,"4100",NA,NA,NA,NA,2023,30,"STAUS",854,19,190,"B0811","",0,NA,0,0,1,NA,"",1,2023-07-03,"04/07/2023","12:00:00.000000AM",2023-05-01,"12:00:00.000000AM","06/10/2023","11:59:00.000000PM","04/07/2023","11:59:00.000000PM",NA,"","","","",NA,"",1,"","",NA,0,0,0,0,0,0,0,0,0,0,0,0,0,NA,0,"N",NA,NA,0,NA,"","","","",1,"N",NA,"N","N","N","N",1,1,1,1,1,1,1,1,NA,"N",1,"",NA,NA,"AUD",NA,0,0,"N",NA,NA,NA,NA,"","",2,NA,2,NA,999,"","",NA,"","",NA,NA,"AWTAYLOR","18/07/2023  6:24:52PM",84,5,2023,"B0811",1,NA
"STLAD-286-1","LUANDA","INTV SLTN","PSTJB","OPEN",21,"21-30","System came from Offshore with issues on LW, it need LW issue resolved and also full system readiness",703088,"1",NA,NA,NA,NA,2023,30,"STLAD",286,1,10,"B0078","",0,NA,0,0,1,NA,"",1,2023-07-03,"06/03/2023","12:00:00.000000AM",2023-03-06,"12:00:00.000000AM","27/03/2023","11:59:00.000000PM","27/03/2023","11:59:00.000000PM",NA,"","","","",NA,"",16,"","",NA,0,0,0,0,0,0,0,0,0,0,0,0,0,NA,0,"N",NA,NA,0,NA,"","","","",1,"N",NA,"Y","N","N","N",1,1,1,1,1,1,1,1,NA,"N",1,"WORKORDER",NA,NA,"AOA",NA,0,0,"N",NA,NA,NA,NA,"","",2,NA,2,NA,999,"","",NA,"","",NA,NA,"DANTONIO","21/07/2023  9:13:21AM",140,3,2023,"B0078",1,NA
"STLAD-287-1","LUANDA","INTV SLTN","PSTJB","OPEN",21,"21-30","TSR 182 Re-assessment/readiness of Spectrum 21",703088,"1",NA,NA,NA,NA,2023,30,"STLAD",287,1,10,"B0078","",0,NA,0,0,1,NA,"",1,2023-07-03,"06/03/2023","12:00:00.000000AM",2023-03-06,"12:00:00.000000AM","31/03/2023","11:59:00.000000PM","31/03/2023","11:59:00.000000PM",NA,"20/02/2023"," 8:00:00.000000AM","22/03/2023"," 5:00:00.000000PM",NA,"",16,"","",NA,0,0,0,0,0,0,0,0,0,0,0,0,0,NA,0,"N",NA,NA,0,NA,"","","","",1,"N",NA,"Y","N","N","N",1,1,23,1,1,1,1,1,NA,"N",1,"WORKORDER",NA,NA,"AOA",NA,0,0,"N",NA,NA,NA,NA,"","",2,NA,2,NA,999,"","",NA,"","",NA,NA,"DANTONIO","21/07/2023  9:13:21AM",140,3,2023,"B0078",1,NA
"STAUS-854-20","PERTH","CLIENTOWN","ADHOC","OPEN",20,"11-20","Remove bolts from panels going to DWS",221703,"4100",NA,NA,NA,NA,2023,30,"STAUS",854,20,200,"B0811","",0,NA,0,0,1,NA,"",1,2023-07-04,"04/07/2023","12:00:00.000000AM",2023-05-01,"12:00:00.000000AM","06/10/2023","11:59:00.000000PM","05/07/2023","11:59:00.000000PM",NA,"","","","",NA,"",1,"","",NA,0,0,0,0,0,0,0,0,0,0,0,0,0,NA,0,"N",NA,NA,0,NA,"","","","",1,"N",NA,"N","N","N","N",1,1,1,1,1,1,1,1,NA,"N",1,"",NA,NA,"AUD",NA,0,0,"N",NA,NA,NA,NA,"","",2,NA,2,NA,999,"","",NA,"","",NA,NA,"AWTAYLOR","18/07/2023  6:24:52PM",84,5,2023,"B0811",1,NA
"STAUS-903-2","PERTH","CLIENTOWN","PLAN","PSCH",20,"11-20","PSM-224334- Mob for Rental of Centrifugal Pump SW2 Evacuation",224334,"8100",NA,NA,NA,NA,2023,30,"STAUS",903,2,20,"B0811","",0,NA,0,0,16,NA,"",1,2023-07-04,"03/07/2023","12:00:00.000000AM",2023-07-03,"12:00:00.000000AM","31/08/2023","11:59:00.000000PM","31/08/2023","11:59:00.000000PM",NA,"","","","",NA,"",25,"","",NA,0,0,0,0,0,0,0,0,0,0,0,0,0,NA,0,"N",NA,NA,0,NA,"","","","",1,"N",NA,"N","N","N","N",1,1,1,1,1,1,1,1,NA,"N",1,"",NA,NA,"AUD",NA,0,0,"N",NA,NA,NA,NA,"","",2,NA,2,NA,999,"","",NA,"","",NA,NA,"AWTAYLOR","23/07/2023  7:35:37PM",21,7,2023,"B0811",156,NA
"STAUS-903-3","PERTH","CLIENTOWN","PLAN","PSCH",20,"11-20","PSM-224334- Shell Plug Lifting Inspection and Register",224334,"8100",NA,NA,NA,NA,2023,30,"STAUS",903,3,30,"B0811","",0,NA,0,0,4,NA,"",1,2023-07-04,"03/07/2023","12:00:00.000000AM",2023-07-03,"12:00:00.000000AM","31/08/2023","11:59:00.000000PM","07/07/2023","11:59:00.000000PM",NA,"","","","",NA,"",25,"","",NA,0,0,0,0,0,0,0,0,0,0,0,0,0,NA,0,"N",NA,NA,0,NA,"","","","",1,"N",NA,"N","N","N","N",1,1,1,1,1,1,1,1,NA,"N",1,"",NA,NA,"AUD",NA,0,0,"N",NA,NA,NA,NA,"","",2,NA,2,NA,999,"","",NA,"","",NA,NA,"AWTAYLOR","23/07/2023  7:35:37PM",21,7,2023,"B0811",156,NA
"STAUS-919-1","PERTH","INTV SLTN","PSTJB","PSCH",20,"11-20","Strake Installation Tooling Demob",221130,"7000","18213","AU0500","AU0500","STRAKE INSTALLATION TOOL",2023,30,"STAUS",919,1,10,"B0811","BUSTR",0,NA,0,0,1,NA,"APAC07",1,2023-07-04,"05/07/2023","12:00:00.000000AM",2023-07-05,"12:00:00.000000AM","31/07/2023","11:59:00.000000PM","31/07/2023","11:59:00.000000PM",NA,"","","","",NA,"",10,"","",NA,0,0,0,0,0,0,0,0,0,0,0,0,0,NA,0,"N",NA,NA,0,NA,"","","","",1,"N",NA,"Y","N","N","N",1,1,1,1,1,1,1,1,NA,"N",1,"",NA,NA,"AUD",NA,0,0,"N",NA,NA,NA,NA,"","",2,NA,2,NA,999,"","",NA,"","",NA,NA,"TJDESPAIN","09/07/2023  9:38:05PM",19,7,2023,"B0811",1,"BUSTR-18213"
"STAUS-919-7","PERTH","INTV SLTN","PSTJB","PSCH",20,"11-20","221130 INPEX STRAKE Installation Demob",221130,"7000","18043","AU0156","AU0156","5 STATION VERSION 1.0",2023,30,"STAUS",919,7,70,"B0811","BUSTR",0,NA,0,0,1,NA,"APAC05",1,2023-07-04,"05/07/2023","12:00:00.000000AM",2023-07-05,"12:00:00.000000AM","31/07/2023","11:59:00.000000PM","31/07/2023","11:59:00.000000PM",NA,"","","","",NA,"",10,"","",NA,0,0,0,0,0,0,0,0,0,0,0,0,0,NA,0,"N",NA,NA,0,NA,"","","","",1,"N",NA,"Y","N","N","N",1,1,1,1,1,1,1,1,NA,"N",1,"",NA,NA,"AUD",NA,0,0,"N",NA,NA,NA,NA,"","",2,NA,2,NA,999,"","",NA,"","",NA,NA,"TJDESPAIN","09/07/2023  9:38:05PM",19,7,2023,"B0811",1,"BUSTR-18043"
"STAUS-919-8","PERTH","INTV SLTN","PSTJB","PSCH",20,"11-20","221130 INPEX STRAKE Installation Demob",221130,"7000","18212","AU0499","AU0499","STRAKE INSTALLATION TOOL",2023,30,"STAUS",919,8,80,"B0811","BUSTR",0,NA,0,0,1,NA,"APAC07",1,2023-07-04,"05/07/2023","12:00:00.000000AM",2023-07-05,"12:00:00.000000AM","31/07/2023","11:59:00.000000PM","31/07/2023","11:59:00.000000PM",NA,"","","","",NA,"",10,"","",NA,0,0,0,0,0,0,0,0,0,0,0,0,0,NA,0,"N",NA,NA,0,NA,"","","","",1,"N",NA,"Y","N","N","N",1,1,1,1,1,1,1,1,NA,"N",1,"",NA,NA,"AUD",NA,0,0,"N",NA,NA,NA,NA,"","",2,NA,2,NA,999,"","",NA,"","",NA,NA,"TJDESPAIN","09/07/2023  9:38:05PM",19,7,2023,"B0811",1,"BUSTR-18212"
"STAUS-919-9","PERTH","INTV SLTN","PSTJB","PSCH",20,"11-20","221130 INPEX STRAKE Installation Demob",221130,"7000","18168","AU0430","AU0430","IHPU SKID",2023,30,"STAUS",919,9,90,"B0811","BUSTR",0,NA,0,0,1,NA,"SGP00011",1,2023-07-04,"05/07/2023","12:00:00.000000AM",2023-07-05,"12:00:00.000000AM","31/07/2023","11:59:00.000000PM","31/07/2023","11:59:00.000000PM",NA,"","","","",NA,"",10,"","",NA,0,0,0,0,0,0,0,0,0,0,0,0,0,NA,0,"N",NA,NA,0,NA,"","","","",1,"N",NA,"Y","N","N","N",1,1,1,1,1,1,1,1,NA,"N",1,"",NA,NA,"AUD",NA,0,0,"N",NA,NA,NA,NA,"","",2,NA,2,NA,999,"","",NA,"","",NA,NA,"TJDESPAIN","09/07/2023  9:38:05PM",19,7,2023,"B0811",1,"BUSTR-18168"
"STAUS-919-10","PERTH","INTV SLTN","PSTJB","PSCH",20,"11-20","Post-Job inspection for Topside Control Unit (Laptop)",221130,"7000","18245","AU0535","AU0535","TOOLING LAPTOP KIT",2023,30,"STAUS",919,10,100,"B0811","BUSTR",0,NA,0,0,5,NA,"AGO00014",1,2023-07-04,"05/07/2023","12:00:00.000000AM",2023-07-05,"12:00:00.000000AM","31/07/2023","11:59:00.000000PM","31/07/2023","11:59:00.000000PM",NA,"","","","",NA,"",10,"","",NA,0,0,0,0,0,0,0,0,0,0,0,0,0,NA,0,"N",NA,NA,0,NA,"","","","",1,"N",NA,"Y","N","N","N",1,2,1,1,1,1,1,1,NA,"N",1,"",NA,NA,"AUD",NA,0,0,"N",NA,NA,NA,NA,"","APAC_LAPTOP_PST",2,NA,2,NA,999,"","",NA,"","",NA,NA,"TJDESPAIN","09/07/2023  9:38:05PM",19,7,2023,"B0811",1,"BUSTR-18245"
"STAUS-919-11","PERTH","INTV SLTN","PSTJB","PSCH",20,"11-20","Post-Job inspection for Topside Control Unit (Laptop)",221130,"7000","24949","AU0653","AU0653","Topside Controller",2023,30,"STAUS",919,11,110,"B0811","BUSTR",0,NA,0,0,5,NA,"APAC10",1,2023-07-04,"05/07/2023","12:00:00.000000AM",2023-07-05,"12:00:00.000000AM","31/07/2023","11:59:00.000000PM","31/07/2023","11:59:00.000000PM",NA,"","","","",NA,"",10,"","",NA,0,0,0,0,0,0,0,0,0,0,0,0,0,NA,0,"N",NA,NA,0,NA,"","","","",1,"N",NA,"Y","N","N","N",1,2,1,1,1,1,1,1,NA,"N",1,"",NA,NA,"AUD",NA,0,0,"N",NA,NA,NA,NA,"","APAC_LAPTOP_PST",2,NA,2,NA,999,"","",NA,"J-ET-24-A","",NA,NA,"TJDESPAIN","09/07/2023  9:38:05PM",19,7,2023,"B0811",1,"BUSTR-24949"
"STAUS-919-12","PERTH","INTV SLTN","PSTJB","PSCH",20,"11-20","STRAKE DEPLOYMENT FRAMES",221130,"7000",NA,NA,NA,NA,2023,30,"STAUS",919,12,120,"B0811","BUSTR",0,NA,0,0,1,NA,"",1,2023-07-04,"05/07/2023","12:00:00.000000AM",2023-07-05,"12:00:00.000000AM","31/07/2023","11:59:00.000000PM","31/07/2023","11:59:00.000000PM",NA,"","","","",NA,"",10,"","",NA,0,0,0,0,0,0,0,0,0,0,0,0,0,NA,0,"N",NA,NA,0,NA,"","","","",1,"N",NA,"Y","N","N","N",1,1,1,1,1,1,1,1,NA,"N",1,"",NA,NA,"AUD",NA,0,0,"N",NA,NA,NA,NA,"","",2,NA,2,NA,999,"","",NA,"","",NA,NA,"TJDESPAIN","09/07/2023  9:38:05PM",19,7,2023,"B0811",1,NA
"STAUS-919-13","PERTH","INTV SLTN","PSTJB","PSCH",20,"11-20","5 STATION SPARES KIT",221130,"7000",NA,NA,NA,NA,2023,30,"STAUS",919,13,130,"B0811","BUSTR",0,NA,0,0,1,NA,"",1,2023-07-04,"05/07/2023","12:00:00.000000AM",2023-07-05,"12:00:00.000000AM","31/07/2023","11:59:00.000000PM","31/07/2023","11:59:00.000000PM",NA,"","","","",NA,"",10,"","",NA,0,0,0,0,0,0,0,0,0,0,0,0,0,NA,0,"N",NA,NA,0,NA,"","","","",1,"N",NA,"Y","N","N","N",1,1,1,1,1,1,1,1,NA,"N",1,"",NA,NA,"AUD",NA,0,0,"N",NA,NA,NA,NA,"","",2,NA,2,NA,999,"","",NA,"","",NA,NA,"TJDESPAIN","09/07/2023  9:38:05PM",19,7,2023,"B0811",1,NA
"STAUS-919-14","PERTH","INTV SLTN","PSTJB","PSCH",20,"11-20","SPARES INVENTORY",221130,"7000",NA,NA,NA,NA,2023,30,"STAUS",919,14,140,"B0811","BUSTR",0,NA,0,0,1,NA,"",1,2023-07-04,"05/07/2023","12:00:00.000000AM",2023-07-05,"12:00:00.000000AM","31/07/2023","11:59:00.000000PM","31/07/2023","11:59:00.000000PM",NA,"","","","",NA,"",10,"","",NA,0,0,0,0,0,0,0,0,0,0,0,0,0,NA,0,"N",NA,NA,0,NA,"","","","",1,"N",NA,"Y","N","N","N",1,1,1,1,1,1,1,1,NA,"N",1,"",NA,NA,"AUD",NA,0,0,"N",NA,NA,NA,NA,"","",2,NA,2,NA,999,"","",NA,"","",NA,NA,"TJDESPAIN","09/07/2023  9:38:05PM",19,7,2023,"B0811",1,NA
"STAUS-868-1","PERTH","C&I","NEWBD","OHWP",19,"11-20","Pre-Job for IDO7",226016,"4000","18693","SI0353","SI0353","ID07 Stanley Impact Wrench",2023,30,"STAUS",868,1,10,"B0811","BUSTR",0,NA,0,0,2,NA,"APAC07",1,2023-07-05,"06/06/2023","12:00:00.000000AM",2023-05-17,"12:00:00.000000AM","03/10/2023","11:59:00.000000PM","14/06/2023","11:59:00.000000PM",NA,"04/07/2023"," 8:00:00.000000AM","05/07/2023"," 5:00:00.000000PM",NA,"",1,"","",NA,0,0,0,0,0,0,0,0,0,0,0,0,0,NA,0,"N",NA,NA,0,NA,"","","","",1,"N",NA,"Y","N","N","N",1,1,2,1,1,1,1,1,NA,"N",1,"",NA,NA,"AUD",NA,0,0,"N",NA,NA,NA,NA,"","",2,NA,2,NA,999,"","",NA,"","",NA,NA,"JKAUR3","12/07/2023  4:45:58AM",68,5,2023,"B0811",1,"BUSTR-18693"
"STAUS-871-2","PERTH","DRILL SUPP","PSTJB","OHWP",19,"11-20","REMOTE CONTROL UNIT 24V DC - POST-JOB",221556,"7000","18651","AU0040","AU0040","4 STATION RCU C/W BSP PORTS",2023,30,"STAUS",871,2,20,"B0811","BUSTR",0,NA,0,0,1,NA,"AUS00011",1,2023-07-05,"22/05/2023","12:00:00.000000AM",2023-05-22,"12:00:00.000000AM","30/06/2023","11:59:00.000000PM","30/06/2023","11:59:00.000000PM",NA,"29/06/2023"," 8:00:00.000000AM","06/07/2023"," 5:00:00.000000PM",NA,"",11,"","",NA,0,0,0,0,0,0,0,0,0,0,0,0,0,NA,0,"N",NA,NA,0,NA,"","","","",1,"N",NA,"Y","N","N","N",1,1,5,1,1,1,1,1,NA,"N",1,"",NA,NA,"AUD",NA,0,0,"N",NA,NA,NA,NA,"","",2,NA,2,NA,999,"","",NA,"","",NA,NA,"JMANGAN","06/07/2023  2:32:42AM",63,5,2023,"B0811",1,"BUSTR-18651"
"STLAD-230-1","LUANDA","C&I","PSTJB","TSCD",19,"11-20","Function test all 8 cylinders and return to SCM, attention of Nsuca/Gaspar",178391,"1",NA,NA,NA,NA,2023,30,"STLAD",230,1,10,"B0078","BUSTR",0,NA,0,0,1,NA,"",1,2023-07-05,"14/12/2022","12:00:00.000000AM",2022-12-14,"12:00:00.000000AM","14/12/2022","11:59:00.000000PM","14/12/2022","11:59:00.000000PM",NA,"","","","",NA,"",16,"","",NA,0,0,0,0,0,0,0,0,0,0,0,0,0,NA,0,"N",NA,NA,0,NA,"","","","",1,"N",NA,"Y","N","N","N",1,1,1,1,1,1,1,1,NA,"N",1,"WORKORDER",NA,NA,"AOA",NA,0,0,"N",NA,NA,NA,NA,"","",2,NA,2,NA,999,"","",NA,"","",NA,NA,"DANTONIO","21/07/2023  9:13:21AM",222,12,2022,"B0078",1,NA
"STAUS-756-23","PERTH","C&I","NEWBD","WIP",18,"11-20","Closeout tasks and side activities",221770,"4000",NA,NA,NA,NA,2023,30,"STAUS",756,23,230,"B0811","",0,NA,0,0,34,NA,"",1,2023-07-06,"05/07/2023","12:00:00.000000AM",2023-01-24,"12:00:00.000000AM","10/03/2023","11:59:00.000000PM","04/08/2023","11:59:00.000000PM",NA,"03/07/2023"," 8:00:00.000000AM","20/07/2023"," 5:00:00.000000PM",NA,"",30,"","",NA,0,0,0,0,0,0,0,0,0,0,0,0,0,NA,0,"N",NA,NA,0,NA,"","","","",1,"N",NA,"Y","N","N","N",1,2,14,1,1,1,1,1,NA,"N",1,"",NA,NA,"AUD",NA,0,0,"N",NA,NA,NA,NA,"","",2,NA,2,NA,999,"","",NA,"","",NA,NA,"JLENNOX","20/07/2023  1:55:49AM",181,1,2023,"B0811",336,NA
"STAUS-921-6","PERTH","C&I","PREJB","OPEN",18,"11-20","ADS FAT with Updated Software",226653,"5010","23808","AU0617","AU0617","Acid Dosing Skid",2023,30,"STAUS",921,6,30,"B0811","BUSTR",0,NA,0,0,1,NA,"",1,2023-07-06,"05/07/2023","12:00:00.000000AM",2023-07-17,"12:00:00.000000AM","20/07/2023","11:59:00.000000PM","20/07/2023","11:59:00.000000PM",NA,"","","","",NA,"",22,"","",NA,0,0,0,0,0,0,0,0,0,0,0,0,0,NA,0,"N",NA,NA,0,NA,"","","","",1,"N",NA,"N","N","N","N",1,1,1,1,1,1,1,1,NA,"N",1,"",NA,NA,"AUD",NA,0,0,"N",NA,NA,NA,NA,"","",2,NA,2,NA,999,"","",NA,"","",NA,NA,"AWTAYLOR","20/07/2023  8:19:17PM",7,7,2023,"B0811",32,"BUSTR-23808"
"STBAK-98-1","BAKU","DRILL SUPP","PM","PSCH",18,"11-20","10"" MPCT SD015",199224,"0110","21730","SD015","SD015","10 "" Multi Purpose Cleaning Tool",2023,30,"STBAK",98,1,10,"B0564","BUSTR",0,NA,0,0,5,NA,"EMEA0091",1,2023-07-06,"15/06/2023","12:00:00.000000AM",2023-06-15,"12:00:00.000000AM","22/06/2023","11:59:00.000000PM","22/06/2023","11:59:00.000000PM",NA,"","","","",NA,"",8,"","",NA,0,0,0,0,0,0,0,0,0,0,0,0,0,NA,0,"N",NA,NA,0,NA,"","","","",1,"N",NA,"N","N","N","N",1,1,1,1,1,1,1,1,NA,"N",1,"WORKORDER",NA,NA,"AZN",NA,0,0,"N",NA,NA,NA,NA,"","",2,NA,2,NA,999,"","",NA,"","",NA,NA,"SMURSHUDOV","06/07/2023  3:36:13AM",39,6,2023,"B0564",5,"BUSTR-21730"
"STAUS-919-15","PERTH","INTV SLTN","PSTJB","PSCH",15,"11-20","221130 INPEX STRAKE Installation Demob",221130,"7000","18175","AU0440","AU0440","Portable tool kit",2023,30,"STAUS",919,15,150,"B0811","BUSTR",0,NA,0,0,1,NA,"APAC05",1,2023-07-09,"05/07/2023","12:00:00.000000AM",2023-07-05,"12:00:00.000000AM","31/07/2023","11:59:00.000000PM","31/07/2023","11:59:00.000000PM",NA,"","","","",NA,"",10,"","",NA,0,0,0,0,0,0,0,0,0,0,0,0,0,NA,0,"N",NA,NA,0,NA,"","","","",1,"N",NA,"Y","N","N","N",1,1,1,1,1,1,1,1,NA,"N",1,"",NA,NA,"AUD",NA,0,0,"N",NA,NA,NA,NA,"","",2,NA,2,NA,999,"STAUS","PERTH",NA,"J-MW-09-A","",NA,NA,"TJDESPAIN","09/07/2023  9:40:11PM",19,7,2023,"B0811",1,"BUSTR-18175"
"STAUS-923-1","PERTH","C&I","PSTJB","OPEN",15,"11-20","ADCP - POST-JOB",225907,"7000","18088","AU0261","AU0261","Acoustic Doppler Current Profiler",2023,30,"STAUS",923,1,10,"B0811","BUSTR",0,NA,0,0,1,NA,"MOZ00000",1,2023-07-09,"09/07/2023","12:00:00.000000AM",2023-07-09,"12:00:00.000000AM","11/08/2023","11:59:00.000000PM","11/08/2023","11:59:00.000000PM",NA,"","","","",NA,"",11,"","",NA,0,0,0,0,0,0,0,0,0,0,0,0,0,NA,0,"N",NA,NA,0,NA,"","","","",1,"N",NA,"N","N","N","N",1,1,1,1,1,1,1,1,NA,"N",1,"",NA,NA,"AUD",NA,0,0,"N",NA,NA,NA,NA,"","",2,NA,2,NA,999,"","",NA,"","",NA,NA,"TVICAREY","09/07/2023 11:50:52PM",15,7,2023,"B0811",1,"BUSTR-18088"
"STAUS-827-14","PERTH","C&I","PSTJB","OHWP",14,"11-20","REMOTE CONTROL UNIT 24V DC POST-JOB",222656,"7000","18236","AU0526","AU0526","4 STATION RCU C/W BSP PORTS",2023,30,"STAUS",827,14,140,"B0811","BUSTR",0,NA,0,0,1,NA,"APAC20",1,2023-07-10,"24/04/2023","12:00:00.000000AM",2023-04-24,"12:00:00.000000AM","23/08/2023","11:59:00.000000PM","01/07/2023","11:59:00.000000PM",NA,"06/07/2023"," 8:00:00.000000AM","10/07/2023"," 5:00:00.000000PM",NA,"",11,"","",NA,0,0,0,0,0,0,0,0,0,0,0,0,0,NA,0,"N",NA,NA,0,NA,"","","","",1,"N",NA,"Y","N","N","N",1,1,2,1,1,1,1,1,NA,"N",1,"",NA,NA,"AUD",NA,0,0,"N",NA,NA,NA,NA,"","",2,NA,2,NA,999,"","",NA,"","",NA,NA,"TVICAREY","23/07/2023  6:57:26PM",91,4,2023,"B0811",1,"BUSTR-18236"
"STAUS-902-1","PERTH","DECOMM","NEWBD","WIP",14,"11-20","Acid Wands Assembly and Fit Test",221546,"3660",NA,NA,NA,NA,2023,30,"STAUS",902,1,10,"B0811","",0,NA,0,0,6,NA,"",1,2023-07-10,"19/06/2023","12:00:00.000000AM",2023-06-19,"12:00:00.000000AM","22/07/2023","11:59:00.000000PM","22/07/2023","11:59:00.000000PM",NA,"","","","",NA,"",17,"","",NA,0,0,0,0,0,0,0,0,0,0,0,0,0,NA,0,"N",NA,NA,0,NA,"","","","",1,"N",NA,"Y","N","N","N",1,1,1,1,1,1,1,1,NA,"N",1,"",NA,NA,"AUD",NA,0,0,"N",NA,NA,NA,NA,"","",2,NA,2,NA,999,"","",NA,"","",NA,NA,"SRICE1","10/07/2023  7:56:11PM",35,6,2023,"B0811",7,NA
"STAUS-902-2","PERTH","DECOMM","NEWBD","WIP",14,"11-20","Acid Wands Parts Inventory",221546,"3660",NA,NA,NA,NA,2023,30,"STAUS",902,2,20,"B0811","",0,NA,0,0,1,NA,"",1,2023-07-10,"19/06/2023","12:00:00.000000AM",2023-06-19,"12:00:00.000000AM","22/09/2023","11:59:00.000000PM","22/09/2023","11:59:00.000000PM",NA,"","","","",NA,"",17,"","",NA,0,0,0,0,0,0,0,0,0,0,0,0,0,NA,0,"N",NA,NA,0,NA,"","","","",1,"N",NA,"Y","N","N","N",1,1,1,1,1,1,1,1,NA,"N",1,"",NA,NA,"AUD",NA,0,0,"N",NA,NA,NA,NA,"","",2,NA,2,NA,999,"","",NA,"","",NA,NA,"SRICE1","10/07/2023  6:48:03PM",35,6,2023,"B0811",7,NA
"STAUS-904-3","PERTH","DECOMM","NEWBD","PSCH",14,"11-20","Fitment check of MQC Manifolds against Parking Stand 957196051REVB",221546,"4640",NA,NA,NA,NA,2023,30,"STAUS",904,3,30,"B0811","",0,NA,0,0,8,NA,"",1,2023-07-10,"20/06/2023","12:00:00.000000AM",2023-06-20,"12:00:00.000000AM","21/06/2023","11:59:00.000000PM","21/06/2023","11:59:00.000000PM",NA,"","","","",NA,"",29,"","",NA,0,0,0,0,0,0,0,0,0,0,0,0,0,NA,0,"N",NA,NA,0,NA,"","","","",1,"N",NA,"Y","N","N","N",1,1,1,1,1,1,1,1,NA,"N",1,"",NA,NA,"AUD",NA,0,0,"N",NA,NA,NA,NA,"","",2,NA,2,NA,999,"","",NA,"","",NA,NA,"AALTAF1","19/07/2023 12:38:15AM",34,6,2023,"B0811",24,NA
"STAUS-922-2","PERTH","DECOMM","NEWBD","WIP",14,"11-20","Assembly of Modified Tree Connector Tool (TCT)",221546,"4650",NA,NA,NA,NA,2023,30,"STAUS",922,2,20,"B0811","",0,NA,0,0,32,NA,"",1,2023-07-10,"08/07/2023","12:00:00.000000AM",2023-07-08,"12:00:00.000000AM","15/07/2023","11:59:00.000000PM","15/07/2023","11:59:00.000000PM",NA,"10/07/2023"," 8:00:00.000000AM","13/07/2023"," 5:00:00.000000PM",NA,"",29,"","",NA,0,0,0,0,0,0,0,0,0,0,0,0,0,NA,0,"N",NA,NA,0,NA,"","","","",1,"N",NA,"Y","N","N","N",1,1,8,1,1,1,1,1,NA,"N",1,"",NA,NA,"AUD",NA,0,0,"N",NA,NA,NA,NA,"","",2,NA,2,NA,999,"","",NA,"","",NA,NA,"AWTAYLOR","23/07/2023  6:43:11PM",16,7,2023,"B0811",40,NA
"STAUS-873-1","PERTH","CLIENTOWN","PLAN","WIP",13,"11-20","FBS Indexing Tool Level 3 PSM",204452,"8306",NA,NA,NA,NA,2023,30,"STAUS",873,1,10,"B0811","",0,NA,0,0,120,NA,"",1,2023-07-11,"12/05/2023","12:00:00.000000AM",2023-05-12,"12:00:00.000000AM","12/06/2023","11:59:00.000000PM","02/06/2023","11:59:00.000000PM",NA,"11/07/2023"," 8:00:00.000000AM","21/07/2023"," 5:00:00.000000PM",NA,"",21,"","",NA,0,0,0,0,0,0,0,0,0,0,0,0,0,NA,0,"N",NA,NA,0,NA,"","","","",1,"N",NA,"Y","N","N","N",1,2,11,1,1,1,1,1,NA,"N",1,"",NA,NA,"AUD",NA,0,0,"N",NA,NA,NA,NA,"","",2,NA,2,NA,999,"","",NA,"","",NA,NA,"LFRANCIS","21/07/2023  2:15:35AM",73,5,2023,"B0811",120,NA
"STAUS-903-1","PERTH","CLIENTOWN","PLAN","TSCD",13,"11-20","PSM-224334-Mob for Rental of ROV Pump Skid",224334,"8100",NA,NA,NA,NA,2023,30,"STAUS",903,1,10,"B0811","",0,NA,0,0,16,NA,"",1,2023-07-11,"03/07/2023","12:00:00.000000AM",2023-07-03,"12:00:00.000000AM","31/08/2023","11:59:00.000000PM","31/08/2023","11:59:00.000000PM",NA,"","","","",NA,"",25,"","",NA,0,0,0,0,0,0,0,0,0,0,0,0,0,NA,0,"N",NA,NA,0,NA,"","","","",1,"N",NA,"Y","N","N","N",1,1,1,1,1,1,1,1,NA,"N",1,"",NA,NA,"AUD",NA,0,0,"N",NA,NA,NA,NA,"","",2,NA,2,NA,999,"","",NA,"","",NA,NA,"AWTAYLOR","23/07/2023  7:35:37PM",21,7,2023,"B0811",156,NA
"STAUS-917-2","PERTH","INTV SLTN","PREJB","OHOT",13,"11-20","Inspection and inventory or items in Crate #2/5",226280,"8200",NA,NA,NA,NA,2023,30,"STAUS",917,2,20,"B0811","BUSTR",0,NA,0,0,0.5,NA,"",1,2023-07-11,"03/07/2023","12:00:00.000000AM",2023-07-03,"12:00:00.000000AM","31/08/2023","11:59:00.000000PM","31/08/2023","11:59:00.000000PM",NA,"","","","",NA,"",10,"","",NA,0,0,0,0,0,0,0,0,0,0,0,0,0,NA,0,"N",NA,NA,0,NA,"","","","",1,"N",NA,"Y","N","N","N",1,1,1,1,1,1,1,1,NA,"N",1,"",NA,NA,"AUD",NA,0,0,"N",NA,NA,NA,NA,"","",2,NA,2,NA,999,"","",NA,"","",NA,NA,"JPRATT","11/07/2023 10:34:19PM",21,7,2023,"B0811",1,NA
"STABO-596-1","ABERDEEN","DRILL SUPP","PLAN","QC",12,"11-20","COT - Latch Mechanism, Choke (Willis)",184031,"4260","9081","BP00268","BP00268","Change Out Tool (COT) - Latch Mechanism, Choke (Willis)",2023,30,"STABO",596,1,10,"B0551","BUSTR",0,NA,0,0,4,NA,"EMEA0081",1,2023-07-12,"01/06/2023","12:00:00.000000AM",2023-06-01,"12:00:00.000000AM","30/06/2023","11:59:00.000000PM","30/06/2023","11:59:00.000000PM",NA,"","","","",NA,"",16,"","",NA,0,0,0,0,0,0,0,0,0,0,0,0,0,NA,0,"N",NA,NA,0,NA,"","","","",1,"N",2020502,"Y","N","N","N",1,1,1,1,1,1,1,1,NA,"N",1,"WOMUK",NA,NA,"GBP",NA,0,0,"N",NA,NA,NA,NA,"","BP_ABO_COT_LTCH_WILLIS_PP",2,NA,2,NA,999,"","",NA,"","",NA,NA,"JKAUR3","12/07/2023  4:22:59AM",53,6,2023,"B0551",1,"BUSTR-9081"
"STABO-597-1","ABERDEEN","DRILL SUPP","PLAN","QC",12,"11-20","17H TORQUE TOOL",184031,"4260","8994","BP00175","BP00175","Torque Tool, Change Out Tool (COT) - 17H High (KFL Pod)",2023,30,"STABO",597,1,10,"B0551","BUSTR",0,NA,0,0,2.5,NA,"EMEA0081",1,2023-07-12,"01/06/2023","12:00:00.000000AM",2023-06-01,"12:00:00.000000AM","30/06/2023","11:59:00.000000PM","30/06/2023","11:59:00.000000PM",NA,"","","","",NA,"",16,"","",NA,0,0,0,0,0,0,0,0,0,0,0,0,0,NA,0,"N",NA,NA,0,NA,"","","","",1,"N",2020502,"Y","N","N","N",1,1,1,1,1,1,1,1,NA,"N",1,"WOMUK",NA,NA,"GBP",NA,0,0,"N",NA,NA,NA,NA,"","BP_ABO_17H_T/T_COT",2,NA,2,NA,999,"","",NA,"","",NA,NA,"JKAUR3","12/07/2023  4:22:40AM",53,6,2023,"B0551",1,"BUSTR-8994"
"STABO-598-1","ABERDEEN","DRILL SUPP","PLAN","QC",12,"11-20","17H TORQUE TOOL",184031,"4260","9058","BP00244","BP00244","Torque Tool - 17H, High (100-2000 Nm)",2023,30,"STABO",598,1,10,"B0551","BUSTR",0,NA,0,0,2.5,NA,"EMEA0081",1,2023-07-12,"01/06/2023","12:00:00.000000AM",2023-06-01,"12:00:00.000000AM","30/06/2023","11:59:00.000000PM","30/06/2023","11:59:00.000000PM",NA,"","","","",NA,"",16,"","",NA,0,0,0,0,0,0,0,0,0,0,0,0,0,NA,0,"N",NA,NA,0,NA,"","","","",1,"N",2020502,"Y","N","N","N",1,1,1,1,1,1,1,1,NA,"N",1,"WOMUK",NA,NA,"GBP",NA,0,0,"N",NA,NA,NA,NA,"","BP_ABO_17H_T/T_COT",2,NA,2,NA,999,"","",NA,"","",NA,NA,"JKAUR3","12/07/2023  4:22:22AM",53,6,2023,"B0551",1,"BUSTR-9058"
"STABO-613-1","ABERDEEN","DRILL SUPP","PLAN","QC",12,"11-20","Torque Analyser, Retlock (6000 Nm)",184031,"4260","9044","BP00228","BP00228","Torque Analyser, Retlock (6000 Nm)",2023,30,"STABO",613,1,10,"B0551","BUSTR",0,NA,0,0,4,NA,"EMEA0500",1,2023-07-12,"05/07/2023","12:00:00.000000AM",2023-07-05,"12:00:00.000000AM","05/07/2023","11:59:00.000000PM","05/07/2023","11:59:00.000000PM",NA,"","","","",NA,"",16,"","",NA,0,0,0,0,0,0,0,0,0,0,0,0,0,NA,0,"N",NA,NA,0,NA,"","","","",1,"N",2020502,"Y","N","N","N",1,1,1,1,1,1,1,1,NA,"N",1,"WOMUK",NA,NA,"GBP",NA,0,0,"N",NA,NA,NA,NA,"","BP-ABO-RETLOCK-ANALYSER",2,NA,2,NA,999,"","",NA,"","",NA,NA,"JKAUR3","12/07/2023  4:22:08AM",19,7,2023,"B0551",1,"BUSTR-9044"
"STABO-614-1","ABERDEEN","DRILL SUPP","PLAN","QC",12,"11-20","Torque Analyser, Retlock (6000 Nm)",184031,"4260","9045","BP00229","BP00229","Torque Analyser, Retlock (6000 Nm)",2023,30,"STABO",614,1,10,"B0551","BUSTR",0,NA,0,0,4,NA,"EMEA0500",1,2023-07-12,"05/07/2023","12:00:00.000000AM",2023-07-05,"12:00:00.000000AM","31/07/2023","11:59:00.000000PM","31/07/2023","11:59:00.000000PM",NA,"","","","",NA,"",16,"","",NA,0,0,0,0,0,0,0,0,0,0,0,0,0,NA,0,"N",NA,NA,0,NA,"","","","",1,"N",2020502,"Y","N","N","N",1,1,1,1,1,1,1,1,NA,"N",1,"WOMUK",NA,NA,"GBP",NA,0,0,"N",NA,NA,NA,NA,"","BP-ABO-RETLOCK-ANALYSER",2,NA,2,NA,999,"","",NA,"","",NA,NA,"JKAUR3","12/07/2023  4:21:50AM",19,7,2023,"B0551",1,"BUSTR-9045"
"STAUS-848-12","PERTH","INTV SLTN","PREJB","OHWP",11,"11-20","Linear Valve Override Tool (LVOT) Type A",221546,"4655","18028","AU0136","AU0136","LVOT",2023,30,"STAUS",848,12,120,"B0811","BUSTR",0,NA,0,0,1,NA,"APAC07",1,2023-07-13,"26/04/2023","12:00:00.000000AM",2023-04-26,"12:00:00.000000AM","20/06/2023","11:59:00.000000PM","20/06/2023","11:59:00.000000PM",NA,"05/07/2023"," 7:00:00.000000AM","06/07/2023"," 3:30:00.000000PM",NA,"",29,"","",NA,0,0,0,0,0,0,0,0,0,0,0,0,0,NA,0,"N",NA,NA,0,NA,"","","","",1,"N",NA,"Y","N","N","N",1,1,1,1,1,1,1,1,NA,"N",1,"",NA,NA,"AUD",NA,0,0,"N",NA,NA,NA,NA,"","",2,NA,2,NA,999,"","",NA,"","",NA,NA,"JKAUR3","19/07/2023  5:20:43AM",89,4,2023,"B0811",1,"BUSTR-18028"
"STAUS-848-16","PERTH","INTV SLTN","PREJB","OHOT",11,"11-20","SPDT -1",221546,"4655",NA,NA,NA,NA,2023,30,"STAUS",848,16,160,"B0811","BUSTR",0,NA,0,0,1,NA,"",1,2023-07-13,"26/04/2023","12:00:00.000000AM",2023-04-26,"12:00:00.000000AM","20/06/2023","11:59:00.000000PM","20/06/2023","11:59:00.000000PM",NA,"","","","",NA,"",29,"","",NA,0,0,0,0,0,0,0,0,0,0,0,0,0,NA,0,"N",NA,NA,0,NA,"","","","",1,"N",NA,"N","N","N","N",1,1,1,1,1,1,1,1,NA,"N",1,"",NA,NA,"AUD",NA,0,0,"N",NA,NA,NA,NA,"","",2,NA,2,NA,999,"","",NA,"","",NA,NA,"JKAUR3","19/07/2023  5:20:43AM",89,4,2023,"B0811",1,NA
"STAUS-848-17","PERTH","INTV SLTN","PREJB","OHOT",11,"11-20","SPDT-2",221546,"4655",NA,NA,NA,NA,2023,30,"STAUS",848,17,170,"B0811","BUSTR",0,NA,0,0,1,NA,"",1,2023-07-13,"26/04/2023","12:00:00.000000AM",2023-04-26,"12:00:00.000000AM","20/06/2023","11:59:00.000000PM","20/06/2023","11:59:00.000000PM",NA,"","","","",NA,"",29,"","",NA,0,0,0,0,0,0,0,0,0,0,0,0,0,NA,0,"N",NA,NA,0,NA,"","","","",1,"N",NA,"N","N","N","N",1,1,1,1,1,1,1,1,NA,"N",1,"",NA,NA,"AUD",NA,0,0,"N",NA,NA,NA,NA,"","",2,NA,2,NA,999,"","",NA,"","",NA,NA,"JKAUR3","19/07/2023  5:20:43AM",89,4,2023,"B0811",1,NA
"STAUS-926-3","PERTH","INTV SLTN","PSTJB","PSCH",11,"11-20","Post-Job inspection for Manip Torque Tool without clutch.",221035,"7000","23679","AU0642","AU0642","CL 1-4 Clutch Manip",2023,30,"STAUS",926,3,30,"B0811","BUSTR",0,NA,0,0,8,NA,"AUS00002",1,2023-07-13,"12/07/2023","12:00:00.000000AM",2023-07-12,"12:00:00.000000AM","21/07/2023","11:59:00.000000PM","21/07/2023","11:59:00.000000PM",NA,"","","","",NA,"",10,"","",NA,0,0,0,0,0,0,0,0,0,0,0,0,0,NA,0,"N",NA,NA,0,NA,"","","","",1,"N",NA,"Y","N","N","N",1,3,3,1,1,1,1,1,NA,"N",1,"",NA,NA,"AUD",NA,0,0,"N",NA,NA,NA,NA,"","APAC_17D CLUTCH MANIP TT",2,NA,2,NA,999,"","",NA,"","",NA,NA,"JKAUR3","19/07/2023  5:16:24AM",12,7,2023,"B0811",1,"BUSTR-23679"
"STAUS-926-4","PERTH","INTV SLTN","PSTJB","PSCH",11,"11-20","Pre and Post job of 17D Clutch manip TT.",221035,"7000","18264","AU0555","AU0555","Clutch Manip Torque Tool",2023,30,"STAUS",926,4,40,"B0811","BUSTR",0,NA,0,0,5,NA,"AUS00002",1,2023-07-13,"12/07/2023","12:00:00.000000AM",2023-07-12,"12:00:00.000000AM","21/07/2023","11:59:00.000000PM","21/07/2023","11:59:00.000000PM",NA,"","","","",NA,"",10,"","",NA,0,0,0,0,0,0,0,0,0,0,0,0,0,NA,0,"N",NA,NA,0,NA,"","","","",1,"N",NA,"Y","N","N","N",1,2,2,1,1,1,1,1,NA,"N",1,"",NA,NA,"AUD",NA,0,0,"N",NA,NA,NA,NA,"","APAC_17D CLUTCH MANIP TT",2,NA,2,NA,999,"","",NA,"","",NA,NA,"JKAUR3","19/07/2023  5:16:24AM",12,7,2023,"B0811",1,"BUSTR-18264"
"STAUS-927-1","PERTH","CLIENTOWN","PREJB","OPEN",11,"11-20","Seadraulics Class 5 Test Jig",205870,"9500",NA,NA,NA,NA,2023,30,"STAUS",927,1,10,"B0811","",0,NA,0,0,1,NA,"",1,2023-07-13,"13/07/2023","12:00:00.000000AM",2023-07-13,"12:00:00.000000AM","14/07/2023","11:59:00.000000PM","14/07/2023","11:59:00.000000PM",NA,"","","","",NA,"",25,"","",NA,0,0,0,0,0,0,0,0,0,0,0,0,0,NA,0,"N",NA,NA,0,NA,"","","","",1,"N",NA,"N","N","N","N",1,1,1,1,1,1,1,1,NA,"N",1,"",NA,NA,"AUD",NA,0,0,"N",NA,NA,NA,NA,"","",2,NA,2,NA,999,"","",NA,"","",NA,NA,"ASHARMA21","13/07/2023  1:04:32AM",11,7,2023,"B0811",4,NA
"STAUS-927-2","PERTH","CLIENTOWN","PREJB","OPEN",11,"11-20","Super Class 4 Torque Tool DeMob - AUX0003",205870,"9500","23872","AUX0003","AUX0003","Super Class 1-4 Torque Tool",2023,30,"STAUS",927,2,20,"B0811","BUSTR",0,NA,0,0,2,NA,"APAC42",1,2023-07-13,"13/07/2023","12:00:00.000000AM",2023-07-13,"12:00:00.000000AM","14/07/2023","11:59:00.000000PM","14/07/2023","11:59:00.000000PM",NA,"","","","",NA,"",25,"","",NA,0,0,0,0,0,0,0,0,0,0,0,0,0,NA,0,"N",NA,NA,0,NA,"","","","",1,"N",NA,"N","N","N","N",1,1,1,1,1,1,1,1,NA,"N",1,"",NA,NA,"AUD",NA,0,0,"N",NA,NA,NA,NA,"","",2,NA,2,NA,999,"","",NA,"","",NA,NA,"ASHARMA21","13/07/2023  1:04:32AM",11,7,2023,"B0811",4,"BUSTR-23872"
"STAUS-927-3","PERTH","CLIENTOWN","PREJB","OPEN",11,"11-20","RCU DeMob - REMOTE CONTROL UNIT 24V DC - SI0229",205870,"9500",NA,NA,NA,NA,2023,30,"STAUS",927,3,30,"B0811","",0,NA,0,0,2,NA,"",1,2023-07-13,"13/07/2023","12:00:00.000000AM",2023-07-13,"12:00:00.000000AM","14/07/2023","11:59:00.000000PM","14/07/2023","11:59:00.000000PM",NA,"","","","",NA,"",25,"","",NA,0,0,0,0,0,0,0,0,0,0,0,0,0,NA,0,"N",NA,NA,0,NA,"","","","",1,"N",NA,"N","N","N","N",1,1,1,1,1,1,1,1,NA,"N",1,"",NA,NA,"AUD",NA,0,0,"N",NA,NA,NA,NA,"","",2,NA,2,NA,999,"","",NA,"","",NA,NA,"ASHARMA21","13/07/2023  1:04:32AM",11,7,2023,"B0811",4,NA
"STABO-615-1","ABERDEEN","DRILL SUPP","PLAN","QC",10,"0-10","Tool, Cleaning and Inspection - 15K Willis Choke",184031,"4260","9237","BP00424","BP00424","Tool, Cleaning and Inspection - 15K Willis Choke",2023,30,"STABO",615,1,10,"B0551","BUSTR",0,NA,0,0,3.5,NA,"EMEA0081",1,2023-07-14,"13/07/2023","12:00:00.000000AM",2023-07-13,"12:00:00.000000AM","31/07/2023","11:59:00.000000PM","31/07/2023","11:59:00.000000PM",NA,"","","","",NA,"",16,"","",NA,0,0,0,0,0,0,0,0,0,0,0,0,0,NA,0,"N",NA,NA,0,NA,"","","","",1,"N",2020502,"Y","N","N","N",1,1,1,1,1,1,1,1,NA,"N",1,"WOMUK",NA,NA,"GBP",NA,0,0,"N",NA,NA,NA,NA,"","BP_ABO_INSPECTION_CAMERA",2,NA,2,NA,999,"","",NA,"","",NA,NA,"JKAUR3","14/07/2023  1:49:10AM",11,7,2023,"B0551",1,"BUSTR-9237"
"STAUS-900-1","PERTH","C&I","NEWBD","WIP",10,"0-10","Modification of UV Lamps to meet Australian Standards",224104,"4000",NA,NA,NA,NA,2023,30,"STAUS",900,1,10,"B0811","",0,NA,0,0,16,NA,"APAC10",1,2023-07-14,"19/06/2023","12:00:00.000000AM",2023-06-19,"12:00:00.000000AM","23/06/2023","11:59:00.000000PM","23/06/2023","11:59:00.000000PM",NA,"19/06/2023"," 8:00:00.000000AM","13/07/2023"," 5:00:00.000000PM",NA,"",32,"","",NA,0,0,0,0,0,0,0,0,0,0,0,0,0,NA,0,"N",NA,NA,0,NA,"","","","",1,"N",NA,"Y","N","N","N",1,1,19,1,1,1,1,1,NA,"N",1,"",NA,NA,"AUD",NA,0,0,"N",NA,NA,NA,NA,"","",2,NA,2,NA,999,"","",NA,"","",NA,NA,"SACHARYA","20/07/2023  9:11:44PM",35,6,2023,"B0811",16,NA
"STAUS-929-2","PERTH","CLIENTOWN","PREJB","TSCD",10,"0-10","TCRT parts cleaning, preparation for SIFCO repair, storage and preservation",221546,"5250",NA,NA,NA,NA,2023,30,"STAUS",929,2,20,"B0811","",0,NA,0,0,1,NA,"",1,2023-07-14,"17/07/2023","12:00:00.000000AM",2023-07-17,"12:00:00.000000AM","19/07/2023","11:59:00.000000PM","19/07/2023","11:59:00.000000PM",NA,"","","","",NA,"",27,"","",NA,0,0,0,0,0,0,0,0,0,0,0,0,0,NA,0,"N",NA,NA,0,NA,"","","","",1,"N",NA,"Y","N","N","N",1,1,2,1,1,1,1,1,NA,"N",1,"",NA,NA,"AUD",NA,0,0,"N",NA,NA,NA,NA,"","",2,NA,2,NA,999,"","",NA,"","",NA,NA,"AWTAYLOR","16/07/2023  8:16:00PM",7,7,2023,"B0811",1,NA
"STAUS-930-2","PERTH","DECOMM","NEWBD","PSCH",10,"0-10","Tubing Shear Tool FAT",221546,"3660",NA,NA,NA,NA,2023,30,"STAUS",930,2,20,"B0811","",0,NA,0,0,2,NA,"",1,2023-07-14,"16/07/2023","12:00:00.000000AM",2023-07-16,"12:00:00.000000AM","31/07/2023","11:59:00.000000PM","31/07/2023","11:59:00.000000PM",NA,"","","","",NA,"",17,"","",NA,0,0,0,0,0,0,0,0,0,0,0,0,0,NA,0,"N",NA,NA,0,NA,"","","","",1,"N",NA,"Y","N","N","N",1,1,1,1,1,1,1,1,NA,"N",1,"",NA,NA,"AUD",NA,0,0,"N",NA,NA,NA,NA,"","",2,NA,2,NA,999,"","",NA,"","",NA,NA,"AWTAYLOR","20/07/2023  8:05:11PM",8,7,2023,"B0811",8,NA
"STLAD-358-1","LUANDA","INTV SLTN","PREJB","TSCD",10,"0-10","TSR 62 - EF011-030-01R needs to be tested",703088,"1",NA,NA,NA,NA,2023,30,"STLAD",358,1,10,"B0078","",0,NA,0,0,1,NA,"",1,2023-07-14,"18/07/2023","12:00:00.000000AM",2023-07-18,"12:00:00.000000AM","20/07/2023","11:59:00.000000PM","20/07/2023","11:59:00.000000PM",NA,"","","","",NA,"",16,"","",NA,0,0,0,0,0,0,0,0,0,0,0,0,0,NA,0,"N",NA,NA,0,NA,"","","","",1,"N",NA,"Y","N","N","N",1,1,1,1,1,1,1,1,NA,"N",1,"WORKORDER",NA,NA,"AOA",NA,0,0,"N",NA,NA,NA,NA,"","",2,NA,2,NA,999,"","",NA,"","",NA,NA,"DANTONIO","21/07/2023  9:13:21AM",6,7,2023,"B0078",1,NA
"STAUS-860-4","PERTH","C&I","NEWBD","PSCH",8,"0-10","Packaging",224357,"6000","27544","AU0697","AU0697","SEABATTERY POWER MODULE",2023,30,"STAUS",860,4,40,"B0811","BUSTR",0,NA,0,0,1,NA,"APAC07",1,2023-07-16,"01/05/2023","12:00:00.000000AM",2023-05-01,"12:00:00.000000AM","16/05/2023","11:59:00.000000PM","16/05/2023","11:59:00.000000PM",NA,"","","","",NA,"",1,"","",NA,0,0,0,0,0,0,0,0,0,0,0,0,0,NA,0,"N",NA,NA,0,NA,"","","","",1,"N",NA,"N","N","N","N",1,1,1,1,1,1,1,1,NA,"N",1,"",NA,NA,"AUD",NA,0,0,"N",NA,NA,NA,NA,"","",2,NA,2,NA,999,"","",NA,"","",NA,NA,"AWTAYLOR","17/07/2023 11:52:59PM",84,5,2023,"B0811",1,"BUSTR-27544"
"STAUS-912-1","PERTH","C&I","NEWBD","WIP",8,"0-10","Assembly of Robotorch Top Junction Box and Intermediate Junction Box",220885,"4000",NA,NA,NA,NA,2023,30,"STAUS",912,1,10,"B0811","",0,NA,0,0,80,NA,"",1,2023-07-16,"03/07/2023","12:00:00.000000AM",2023-06-27,"12:00:00.000000AM","28/07/2023","11:59:00.000000PM","28/07/2023","11:59:00.000000PM",NA,"10/07/2023"," 8:00:00.000000AM","24/07/2023"," 5:00:00.000000PM",NA,"",1,"","",NA,0,0,0,0,0,0,0,0,0,0,0,0,0,NA,0,"N",NA,NA,0,NA,"","","","",1,"N",NA,"Y","N","N","N",1,1,8,1,1,1,1,1,NA,"N",1,"",NA,NA,"AUD",NA,0,0,"N",NA,NA,NA,NA,"","",2,NA,2,NA,999,"","",NA,"","",NA,NA,"JMANGAN","24/07/2023  2:28:24AM",27,6,2023,"B0811",1,NA
"STAUS-912-3","PERTH","C&I","NEWBD","PSCH",8,"0-10","Robotorch Assembly",220885,"4000",NA,NA,NA,NA,2023,30,"STAUS",912,3,30,"B0811","",0,NA,0,0,40,NA,"",1,2023-07-16,"24/07/2023","12:00:00.000000AM",2023-07-03,"12:00:00.000000AM","28/07/2023","11:59:00.000000PM","28/07/2023","11:59:00.000000PM",NA,"","","","",NA,"",1,"","",NA,0,0,0,0,0,0,0,0,0,0,0,0,0,NA,0,"N",NA,NA,0,NA,"","","","",1,"N",NA,"N","N","N","N",1,1,1,1,1,1,1,1,NA,"N",1,"",NA,NA,"AUD",NA,0,0,"N",NA,NA,NA,NA,"","",2,NA,2,NA,999,"","",NA,"","",NA,NA,"AWTAYLOR","20/07/2023 12:24:32AM",21,7,2023,"B0811",1,NA
"STAUS-926-2","PERTH","INTV SLTN","PSTJB","TSCD",8,"0-10","Post-Job inspection for Mactech 4-16"" DWS.",221035,"7000","18437","SI0640","SI0640","Diamond Wire Saw 4-16",2023,30,"STAUS",926,2,20,"B0811","BUSTR",0,NA,0,0,24,NA,"APAC40",1,2023-07-16,"12/07/2023","12:00:00.000000AM",2023-07-12,"12:00:00.000000AM","21/07/2023","11:59:00.000000PM","21/07/2023","11:59:00.000000PM",NA,"","","","",NA,"",10,"","",NA,0,0,0,0,0,0,0,0,0,0,0,0,0,NA,0,"N",NA,NA,0,NA,"","","","",1,"N",NA,"Y","N","N","N",1,1,2,1,1,1,1,1,NA,"N",1,"",NA,NA,"AUD",NA,0,0,"N",NA,NA,NA,NA,"","APAC_MTECH DWS 4-16IN_PST",2,NA,2,NA,999,"","",NA,"","",NA,NA,"JKAUR3","19/07/2023  5:16:24AM",12,7,2023,"B0811",1,"BUSTR-18437"
"STAUS-929-1","PERTH","CLIENTOWN","PREJB","WIP",8,"0-10","TCRT Strip and Inspect",221546,"5250",NA,NA,NA,NA,2023,30,"STAUS",929,1,10,"B0811","",0,NA,0,0,1,NA,"",1,2023-07-16,"17/07/2023","12:00:00.000000AM",2023-07-17,"12:00:00.000000AM","19/07/2023","11:59:00.000000PM","19/07/2023","11:59:00.000000PM",NA,"","","","",NA,"",27,"","",NA,0,0,0,0,0,0,0,0,0,0,0,0,0,NA,0,"N",NA,NA,0,NA,"","","","",1,"N",NA,"Y","N","N","N",1,1,2,1,1,1,1,1,NA,"N",1,"",NA,NA,"AUD",NA,0,0,"N",NA,NA,NA,NA,"","",2,NA,2,NA,999,"","",NA,"","",NA,NA,"AWTAYLOR","16/07/2023  8:16:00PM",7,7,2023,"B0811",1,NA
"STAUS-860-3","PERTH","C&I","NEWBD","TSCD",7,"0-10","Torqueing the Bolts",224357,"5000","27544","AU0697","AU0697","SEABATTERY POWER MODULE",2023,30,"STAUS",860,3,30,"B0811","BUSTR",0,NA,0,0,1,NA,"APAC07",1,2023-07-17,"01/05/2023","12:00:00.000000AM",2023-05-01,"12:00:00.000000AM","16/05/2023","11:59:00.000000PM","16/05/2023","11:59:00.000000PM",NA,"","","","",NA,"",1,"","",NA,0,0,0,0,0,0,0,0,0,0,0,0,0,NA,0,"N",NA,NA,0,NA,"","","","",1,"N",NA,"Y","N","N","N",1,1,1,1,1,1,1,1,NA,"N",1,"",NA,NA,"AUD",NA,0,0,"N",NA,NA,NA,NA,"","",2,NA,2,NA,999,"","",NA,"","",NA,NA,"AWTAYLOR","17/07/2023 11:53:29PM",84,5,2023,"B0811",1,"BUSTR-27544"
"STAUS-907-4","PERTH","CLIENTOWN","PSTJB","PSCH",7,"0-10","Backup ADS remove rigging",225166,"5000",NA,NA,NA,NA,2023,30,"STAUS",907,4,40,"B0811","",0,NA,0,0,4,NA,"",1,2023-07-17,"22/06/2023","12:00:00.000000AM",2023-06-22,"12:00:00.000000AM","12/07/2023","11:59:00.000000PM","12/07/2023","11:59:00.000000PM",NA,"","","","",NA,"",32,"","",NA,0,0,0,0,0,0,0,0,0,0,0,0,0,NA,0,"N",NA,NA,0,NA,"","","","",1,"N",NA,"N","N","N","N",1,1,1,1,1,1,1,1,NA,"N",1,"",NA,NA,"AUD",NA,0,0,"N",NA,NA,NA,NA,"","",2,NA,2,NA,999,"","",NA,"","",NA,NA,"JKAUR3","19/07/2023  5:18:16AM",32,6,2023,"B0811",40,NA
"STAUS-907-5","PERTH","CLIENTOWN","PSTJB","PSCH",7,"0-10","Stencil laptop box",225166,"4000",NA,NA,NA,NA,2023,30,"STAUS",907,5,50,"B0811","",0,NA,0,0,2,NA,"",1,2023-07-17,"22/06/2023","12:00:00.000000AM",2023-06-22,"12:00:00.000000AM","12/07/2023","11:59:00.000000PM","12/07/2023","11:59:00.000000PM",NA,"","","","",NA,"",32,"","",NA,0,0,0,0,0,0,0,0,0,0,0,0,0,NA,0,"N",NA,NA,0,NA,"","","","",1,"N",NA,"N","N","N","N",1,1,1,1,1,1,1,1,NA,"N",1,"",NA,NA,"AUD",NA,0,0,"N",NA,NA,NA,NA,"","",2,NA,2,NA,999,"","",NA,"","",NA,NA,"JKAUR3","19/07/2023  5:18:16AM",32,6,2023,"B0811",40,NA
"STAUS-916-1","PERTH","C&I","NEWBD","WIP",7,"0-10","957196054 REVB Assembly and Test",225129,"4000",NA,NA,NA,NA,2023,30,"STAUS",916,1,10,"B0811","",0,NA,0,0,24,NA,"",1,2023-07-17,"10/07/2023","12:00:00.000000AM",2023-07-10,"12:00:00.000000AM","13/07/2023","11:59:00.000000PM","13/07/2023","11:59:00.000000PM",NA,"06/07/2023"," 8:00:00.000000AM","12/07/2023"," 5:00:00.000000PM",NA,"",32,"","",NA,0,0,0,0,0,0,0,0,0,0,0,0,0,NA,0,"N",NA,NA,0,NA,"","","","",1,"N",NA,"Y","N","N","N",1,1,3,1,1,1,1,1,NA,"N",1,"",NA,NA,"AUD",NA,0,0,"N",NA,NA,NA,NA,"","",2,NA,2,NA,999,"","",NA,"","",NA,NA,"AWTAYLOR","17/07/2023  5:53:54PM",14,7,2023,"B0811",24,NA
"STAUS-925-1","PERTH","C&I","NEWBD","OHWP",7,"0-10","Assembly and testing of 4"" CRM Plugs",208539,"4000",NA,NA,NA,NA,2023,30,"STAUS",925,1,10,"B0811","",0,NA,0,0,24,NA,"",1,2023-07-17,"14/07/2023","12:00:00.000000AM",2023-07-14,"12:00:00.000000AM","21/07/2023","11:59:00.000000PM","31/07/2023","11:59:00.000000PM",NA,"","","","",NA,"",32,"","",NA,0,0,0,0,0,0,0,0,0,0,0,0,0,NA,0,"N",NA,NA,0,NA,"","","","",1,"N",NA,"N","N","N","N",1,1,1,1,1,1,1,1,NA,"N",1,"",NA,NA,"AUD",NA,0,0,"N",NA,NA,NA,NA,"","",2,NA,2,NA,999,"","",NA,"","",NA,NA,"SACHARYA","23/07/2023  8:44:00PM",10,7,2023,"B0811",48,NA
"STAUS-925-2","PERTH","C&I","NEWBD","OHWP",7,"0-10","Assembly of Modular Handle for 4"" plugs Setting Tool",208539,"4000",NA,NA,NA,NA,2023,30,"STAUS",925,2,20,"B0811","",0,NA,0,0,8,NA,"",1,2023-07-17,"14/07/2023","12:00:00.000000AM",2023-07-14,"12:00:00.000000AM","21/07/2023","11:59:00.000000PM","31/07/2023","11:59:00.000000PM",NA,"","","","",NA,"",32,"","",NA,0,0,0,0,0,0,0,0,0,0,0,0,0,NA,0,"N",NA,NA,0,NA,"","","","",1,"N",NA,"N","N","N","N",1,1,1,1,1,1,1,1,NA,"N",1,"",NA,NA,"AUD",NA,0,0,"N",NA,NA,NA,NA,"","",2,NA,2,NA,999,"","",NA,"","",NA,NA,"SACHARYA","23/07/2023  8:44:00PM",10,7,2023,"B0811",48,NA
"STAUS-925-3","PERTH","C&I","NEWBD","WIP",7,"0-10","Assembly of Plug Setting Tool",208539,"4000",NA,NA,NA,NA,2023,30,"STAUS",925,3,30,"B0811","",0,NA,0,0,8,NA,"",1,2023-07-17,"14/07/2023","12:00:00.000000AM",2023-07-14,"12:00:00.000000AM","21/07/2023","11:59:00.000000PM","31/07/2023","11:59:00.000000PM",NA,"","","","",NA,"",32,"","",NA,0,0,0,0,0,0,0,0,0,0,0,0,0,NA,0,"N",NA,NA,0,NA,"","","","",1,"N",NA,"N","N","N","N",1,1,1,1,1,1,1,1,NA,"N",1,"",NA,NA,"AUD",NA,0,0,"N",NA,NA,NA,NA,"","",2,NA,2,NA,999,"","",NA,"","",NA,NA,"SACHARYA","23/07/2023  8:44:00PM",10,7,2023,"B0811",48,NA
"STAUS-925-4","PERTH","C&I","NEWBD","OHWP",7,"0-10","Assembly of Test Jig",208539,"4000",NA,NA,NA,NA,2023,30,"STAUS",925,4,40,"B0811","",0,NA,0,0,4,NA,"",1,2023-07-17,"14/07/2023","12:00:00.000000AM",2023-07-14,"12:00:00.000000AM","21/07/2023","11:59:00.000000PM","31/07/2023","11:59:00.000000PM",NA,"","","","",NA,"",32,"","",NA,0,0,0,0,0,0,0,0,0,0,0,0,0,NA,0,"N",NA,NA,0,NA,"","","","",1,"N",NA,"N","N","N","N",1,1,1,1,1,1,1,1,NA,"N",1,"",NA,NA,"AUD",NA,0,0,"N",NA,NA,NA,NA,"","",2,NA,2,NA,999,"","",NA,"","",NA,NA,"SACHARYA","23/07/2023  8:44:00PM",10,7,2023,"B0811",48,NA
"STAUS-925-5","PERTH","C&I","NEWBD","OHWP",7,"0-10","Modification and Assembly of 4"" CRP Cleaning Tool",208539,"4000",NA,NA,NA,NA,2023,30,"STAUS",925,5,50,"B0811","",0,NA,0,0,4,NA,"",1,2023-07-17,"14/07/2023","12:00:00.000000AM",2023-07-14,"12:00:00.000000AM","21/07/2023","11:59:00.000000PM","31/07/2023","11:59:00.000000PM",NA,"","","","",NA,"",32,"","",NA,0,0,0,0,0,0,0,0,0,0,0,0,0,NA,0,"N",NA,NA,0,NA,"","","","",1,"N",NA,"N","N","N","N",1,1,1,1,1,1,1,1,NA,"N",1,"",NA,NA,"AUD",NA,0,0,"N",NA,NA,NA,NA,"","",2,NA,2,NA,999,"","",NA,"","",NA,NA,"SACHARYA","23/07/2023  8:44:00PM",10,7,2023,"B0811",48,NA
"STLAD-359-1","LUANDA","INTV SLTN","PSTJB","OHWP",7,"0-10","Water bag inspection and inventory",703088,"1",NA,NA,NA,NA,2023,30,"STLAD",359,1,10,"B0078","",0,NA,0,0,1,NA,"",1,2023-07-17,"14/07/2023","12:00:00.000000AM",2023-07-14,"12:00:00.000000AM","14/07/2023","11:59:00.000000PM","14/07/2023","11:59:00.000000PM",NA,"","","","",NA,"",16,"","",NA,0,0,0,0,0,0,0,0,0,0,0,0,0,NA,0,"N",NA,NA,0,NA,"","","","",1,"N",NA,"Y","N","N","N",1,1,1,1,1,1,1,1,NA,"N",1,"WORKORDER",NA,NA,"AOA",NA,0,0,"N",NA,NA,NA,NA,"","",2,NA,2,NA,999,"","",NA,"","",NA,NA,"DANTONIO","21/07/2023  9:13:21AM",10,7,2023,"B0078",1,NA
"STAUS-724-18","PERTH","DRILL SUPP","PSTJB","PSCH",6,"0-10","17D CLUTCH MANIP TORQUE TOOL",220662,"7000","18173","AU0438","AU0438","17D CLUTCH MANIP TOOL",2023,30,"STAUS",724,18,180,"B0811","BUSTR",0,NA,0,0,12,NA,"APAC20",1,2023-07-18,"24/11/2022","12:00:00.000000AM",2022-11-24,"12:00:00.000000AM","23/12/2022","11:59:00.000000PM","23/12/2022","11:59:00.000000PM",NA,"09/01/2023"," 8:00:00.000000AM","09/01/2023"," 5:00:00.000000PM",NA,"",1,"","",NA,0,0,0,0,0,0,0,0,0,0,0,0,0,NA,0,"N",NA,NA,0,NA,"","","","",1,"N",NA,"Y","N","N","N",1,1,1,1,1,1,1,1,NA,"N",1,"",NA,NA,"AUD",NA,0,0,"N",NA,NA,NA,NA,"","APAC_17D CLUTCH_PST",2,NA,2,NA,999,"","",NA,"","",NA,NA,"TVICAREY","18/07/2023  5:53:00PM",242,11,2022,"B0811",1,"BUSTR-18173"
"STAUS-907-2","PERTH","CLIENTOWN","PSTJB","WIP",6,"0-10","ADS Upgrade for dual port output",225166,"4000",NA,NA,NA,NA,2023,30,"STAUS",907,2,20,"B0811","",0,NA,0,0,28,NA,"",1,2023-07-18,"22/06/2023","12:00:00.000000AM",2023-06-22,"12:00:00.000000AM","26/06/2023","11:59:00.000000PM","12/07/2023","11:59:00.000000PM",NA,"","","","",NA,"",32,"","",NA,0,0,0,0,0,0,0,0,0,0,0,0,0,NA,0,"N",NA,NA,0,NA,"","","","",1,"N",NA,"Y","N","N","N",1,1,2,1,1,1,1,1,NA,"N",1,"",NA,NA,"AUD",NA,0,0,"N",NA,NA,NA,NA,"","",2,NA,2,NA,999,"","",NA,"","",NA,NA,"JKAUR3","19/07/2023  5:18:16AM",32,6,2023,"B0811",40,NA
"STAUS-924-1","PERTH","CLIENTOWN","PLAN","PSCH",6,"0-10","Initial Inspection and reception of equipment",225599,"8000",NA,NA,NA,NA,2023,30,"STAUS",924,1,10,"B0811","",0,NA,0,0,16,NA,"",1,2023-07-18,"24/07/2023","12:00:00.000000AM",2023-07-24,"12:00:00.000000AM","28/07/2023","11:59:00.000000PM","31/07/2023","11:59:00.000000PM",NA,"","","","",NA,"",21,"","",NA,0,0,0,0,0,0,0,0,0,0,0,0,0,NA,0,"N",NA,NA,0,NA,"","","","",1,"N",NA,"N","N","N","N",1,2,1,1,1,1,1,1,NA,"N",1,"",NA,NA,"AUD",NA,0,0,"N",NA,NA,NA,NA,"","",2,NA,2,NA,999,"","",NA,"","",NA,NA,"MGHULAMI","18/07/2023 10:33:33PM",0,7,2023,"B0811",1,NA
"STAUS-932-1","PERTH","CLIENTOWN","PLAN","OPEN",6,"0-10","Chevron GSB Spares Reception",225599,"8000",NA,NA,NA,NA,2023,30,"STAUS",932,1,10,"B0811","",0,NA,0,0,1,NA,"",1,2023-07-18,"24/07/2023","12:00:00.000000AM",2023-07-24,"12:00:00.000000AM","31/07/2023","11:59:00.000000PM","31/07/2023","11:59:00.000000PM",NA,"","","","",NA,"",21,"","",NA,0,0,0,0,0,0,0,0,0,0,0,0,0,NA,0,"N",NA,NA,0,NA,"","","","",1,"N",NA,"N","N","N","N",1,2,1,1,1,1,1,1,NA,"N",1,"",NA,NA,"AUD",NA,0,0,"N",NA,NA,NA,NA,"","",2,NA,2,NA,999,"","",NA,"","",NA,NA,"MGHULAMI","18/07/2023  1:30:20AM",0,7,2023,"B0811",1,NA
"STAUS-933-1","PERTH","CLIENTOWN","PREJB","WIP",6,"0-10","Preparation for Corallina XT lift",221546,"5150",NA,NA,NA,NA,2023,30,"STAUS",933,1,10,"B0811","",0,NA,0,0,12,NA,"",1,2023-07-18,"18/07/2023","12:00:00.000000AM",2023-07-18,"12:00:00.000000AM","19/07/2023","11:59:00.000000PM","19/07/2023","11:59:00.000000PM",NA,"19/07/2023"," 8:00:00.000000AM","20/07/2023"," 5:00:00.000000PM",NA,"",27,"","",NA,0,0,0,0,0,0,0,0,0,0,0,0,0,NA,0,"N",NA,NA,0,NA,"","","","",1,"N",NA,"Y","N","N","N",1,1,4,1,1,1,1,1,NA,"N",1,"",NA,NA,"AUD",NA,0,0,"N",NA,NA,NA,NA,"","",2,NA,2,NA,999,"","",NA,"","",NA,NA,"RSEDDON","20/07/2023 12:17:57AM",6,7,2023,"B0811",1,NA
"STAUS-933-2","PERTH","CLIENTOWN","PREJB","PSCH",6,"0-10","Corallina XT lift",221546,"5150",NA,NA,NA,NA,2023,30,"STAUS",933,2,20,"B0811","",0,NA,0,0,1,NA,"",1,2023-07-18,"18/07/2023","12:00:00.000000AM",2023-07-18,"12:00:00.000000AM","19/07/2023","11:59:00.000000PM","19/07/2023","11:59:00.000000PM",NA,"","","","",NA,"",27,"","",NA,0,0,0,0,0,0,0,0,0,0,0,0,0,NA,0,"N",NA,NA,0,NA,"","","","",1,"N",NA,"N","N","N","N",1,1,1,1,1,1,1,1,NA,"N",1,"",NA,NA,"AUD",NA,0,0,"N",NA,NA,NA,NA,"","",2,NA,2,NA,999,"","",NA,"","",NA,NA,"LMATYKOWSKA","18/07/2023 11:12:04PM",6,7,2023,"B0811",1,NA
"STABO-592-1","ABERDEEN","DRILL SUPP","PLAN","QC",5,"0-10","SIT Equipment, Change Out Tool (COT)",184031,"4260","8839","BP00006","BP00006","Change Out Tool (COT)",2023,30,"STABO",592,1,10,"B0551","BUSTR",0,NA,0,0,7.5,NA,"EMEA0081",1,2023-07-19,"01/06/2023","12:00:00.000000AM",2023-06-01,"12:00:00.000000AM","30/06/2023","11:59:00.000000PM","30/06/2023","11:59:00.000000PM",NA,"","","","",NA,"",16,"","",NA,0,0,0,0,0,0,0,0,0,0,0,0,0,NA,0,"N",NA,NA,0,NA,"","","","",1,"N",2020502,"Y","N","N","N",1,1,1,1,1,1,1,1,NA,"N",1,"WOMUK",NA,NA,"GBP",NA,0,0,"N",NA,NA,NA,NA,"","BP_ABO_COT_SIT_PP",2,NA,2,NA,999,"","",NA,"","",NA,NA,"JKAUR3","19/07/2023  4:55:33AM",53,6,2023,"B0551",1,"BUSTR-8839"
"STABO-594-1","ABERDEEN","DRILL SUPP","PLAN","QC",5,"0-10","NSS Demob CTR WO -BP00097",184031,"4260","8924","BP00097","BP00097","SIT Equipment, Change Out Tool (COT) - Lifting Beam",2023,30,"STABO",594,1,10,"B0551","BUSTR",0,NA,0,0,1,NA,"EMEA0081",1,2023-07-19,"01/06/2023","12:00:00.000000AM",2023-06-01,"12:00:00.000000AM","30/06/2023","11:59:00.000000PM","30/06/2023","11:59:00.000000PM",NA,"","","","",NA,"",16,"","",NA,0,0,0,0,0,0,0,0,0,0,0,0,0,NA,0,"N",NA,NA,0,NA,"","","","",1,"N",2020502,"N","N","N","N",1,1,1,1,1,1,1,1,NA,"N",1,"WOMUK",NA,NA,"GBP",NA,0,0,"N",NA,NA,NA,NA,"","",2,NA,2,NA,999,"","",NA,"","",NA,NA,"JKAUR3","19/07/2023  4:55:14AM",53,6,2023,"B0551",1,"BUSTR-8924"
"STABO-595-1","ABERDEEN","DRILL SUPP","PLAN","QC",5,"0-10","COT Transport Frame",184031,"4260","9074","BP00260","BP00260","Transportation Frame, Change Out Tool (COT)",2023,30,"STABO",595,1,10,"B0551","BUSTR",0,NA,0,0,4,NA,"EMEA0081",1,2023-07-19,"01/06/2023","12:00:00.000000AM",2023-06-01,"12:00:00.000000AM","30/06/2023","11:59:00.000000PM","30/06/2023","11:59:00.000000PM",NA,"","","","",NA,"",16,"","",NA,0,0,0,0,0,0,0,0,0,0,0,0,0,NA,0,"N",NA,NA,0,NA,"","","","",1,"N",2020502,"Y","N","N","N",1,1,1,1,1,1,1,1,NA,"N",1,"WOMUK",NA,NA,"GBP",NA,0,0,"N",NA,NA,NA,NA,"","BP_ABO_COT_TRANS_FRAME_PP",2,NA,2,NA,999,"","",NA,"","",NA,NA,"JKAUR3","19/07/2023  4:54:57AM",53,6,2023,"B0551",1,"BUSTR-9074"
"STABO-616-1","ABERDEEN","DRILL SUPP","PLAN","QC",5,"0-10","HYD COUPLER CLEANING TOOL 1/4"" & 1/2"" PRE & POST JOB",184031,"4260","8853","BP00020","BP00020","Cleaning Tool, Choke - Willis",2023,30,"STABO",616,1,10,"B0551","BUSTR",0,NA,0,0,4,NA,"EMEA0081",1,2023-07-19,"13/07/2023","12:00:00.000000AM",2023-07-13,"12:00:00.000000AM","31/07/2023","11:59:00.000000PM","31/07/2023","11:59:00.000000PM",NA,"","","","",NA,"",16,"","",NA,0,0,0,0,0,0,0,0,0,0,0,0,0,NA,0,"N",NA,NA,0,NA,"","","","",1,"N",2020502,"Y","N","N","N",1,1,1,1,1,1,1,1,NA,"N",1,"WOMUK",NA,NA,"GBP",NA,0,0,"N",NA,NA,NA,NA,"","BP_ABO_HYD_COUP_CT_PP",2,NA,2,NA,999,"","",NA,"","",NA,NA,"JKAUR3","19/07/2023  4:54:38AM",11,7,2023,"B0551",1,"BUSTR-8853"
"STABO-617-1","ABERDEEN","DRILL SUPP","PLAN","QC",5,"0-10","Production Choke Cleaning Tool",184031,"4260","20916","BP00518","BP00518","Cleaning Tool, Production Choke",2023,30,"STABO",617,1,10,"B0551","BUSTR",0,NA,0,0,4,NA,"EMEA0081",1,2023-07-19,"13/07/2023","12:00:00.000000AM",2023-07-13,"12:00:00.000000AM","31/07/2023","11:59:00.000000PM","31/07/2023","11:59:00.000000PM",NA,"","","","",NA,"",16,"","",NA,0,0,0,0,0,0,0,0,0,0,0,0,0,NA,0,"N",NA,NA,0,NA,"","","","",1,"N",2020502,"Y","N","N","N",1,1,1,1,1,1,1,1,NA,"N",1,"WOMUK",NA,NA,"GBP",NA,0,0,"N",NA,NA,NA,NA,"","BP_ABO_PROD_CHOKE_CL",2,NA,2,NA,999,"","",NA,"","",NA,NA,"JKAUR3","19/07/2023  4:54:19AM",11,7,2023,"B0551",1,"BUSTR-20916"
"STAUS-756-24","PERTH","C&I","NEWBD","PSCH",5,"0-10","FAT #4 - Test and set up",221770,"5000",NA,NA,NA,NA,2023,30,"STAUS",756,24,240,"B0811","",0,NA,0,0,80,NA,"",1,2023-07-19,"20/07/2023","12:00:00.000000AM",2023-01-24,"12:00:00.000000AM","10/03/2023","11:59:00.000000PM","04/08/2023","11:59:00.000000PM",NA,"","","","",NA,"",30,"","",NA,0,0,0,0,0,0,0,0,0,0,0,0,0,NA,0,"N",NA,NA,0,NA,"","","","",1,"N",NA,"N","N","N","N",1,1,1,1,1,1,1,1,NA,"N",1,"",NA,NA,"AUD",NA,0,0,"N",NA,NA,NA,NA,"","",2,NA,2,NA,999,"","",NA,"","",NA,NA,"LSORIANO","19/07/2023  9:45:22PM",181,1,2023,"B0811",336,NA
"STAUS-764-1","PERTH","CLIENTOWN","PLAN","OPRV",5,"0-10","204452 EPRS MISC Level 1 PSM",204452,"8105",NA,NA,NA,NA,2023,30,"STAUS",764,1,10,"B0811","",0,NA,0,0,88,NA,"",1,2023-07-19,"13/07/2023","12:00:00.000000AM",2023-01-03,"12:00:00.000000AM","12/01/2023","11:59:00.000000PM","27/07/2023","11:59:00.000000PM",NA,"10/07/2023"," 8:00:00.000000AM","12/07/2023"," 5:00:00.000000PM",NA,"",21,"","",NA,0,0,0,0,0,0,0,0,0,0,0,0,0,NA,0,"N",NA,NA,0,NA,"","","","",1,"N",NA,"Y","N","N","N",1,3,6,1,1,1,1,1,NA,"N",1,"",NA,NA,"AUD",NA,0,0,"N",NA,NA,NA,NA,"","",2,NA,2,NA,999,"","",NA,"","",NA,NA,"JKAUR3","19/07/2023  5:21:17AM",202,1,2023,"B0811",88,NA
"STAUS-904-1","PERTH","DECOMM","NEWBD","TCOM",5,"0-10","Assemble Production MQC Manifold Assembly 957192021REVB",221546,"4640",NA,NA,NA,NA,2023,30,"STAUS",904,1,10,"B0811","",0,NA,0,0,8,NA,"",1,2023-07-19,"20/06/2023","12:00:00.000000AM",2023-06-20,"12:00:00.000000AM","21/06/2023","11:59:00.000000PM","21/06/2023","11:59:00.000000PM",NA,"03/07/2023"," 8:00:00.000000AM","19/07/2023"," 5:00:00.000000PM",NA,"",29,"","",NA,0,0,0,0,0,0,0,0,0,0,0,0,0,NA,0,"N",NA,NA,0,NA,"","","","",1,"N",NA,"Y","N","N","N",1,1,13,1,1,1,1,1,NA,"N",1,"",NA,NA,"AUD",NA,0,0,"N",NA,NA,NA,NA,"","",2,NA,2,NA,999,"","",NA,"","",NA,NA,"ASTANIMIROVIC","19/07/2023  6:37:45PM",34,6,2023,"B0811",24,NA
"STAUS-904-2","PERTH","DECOMM","NEWBD","TCOM",5,"0-10","Assemble Chemical Injection MQC Manifold Assembly 957192064REVB",221546,"4640",NA,NA,NA,NA,2023,30,"STAUS",904,2,20,"B0811","",0,NA,0,0,8,NA,"",1,2023-07-19,"20/06/2023","12:00:00.000000AM",2023-06-20,"12:00:00.000000AM","21/06/2023","11:59:00.000000PM","21/06/2023","11:59:00.000000PM",NA,"03/07/2023"," 8:00:00.000000AM","19/07/2023"," 5:00:00.000000PM",NA,"",29,"","",NA,0,0,0,0,0,0,0,0,0,0,0,0,0,NA,0,"N",NA,NA,0,NA,"","","","",1,"N",NA,"Y","N","N","N",1,1,8,1,1,1,1,1,NA,"N",1,"",NA,NA,"AUD",NA,0,0,"N",NA,NA,NA,NA,"","",2,NA,2,NA,999,"","",NA,"","",NA,NA,"ASTANIMIROVIC","19/07/2023  6:38:30PM",34,6,2023,"B0811",24,NA
"STAUS-904-5","PERTH","DECOMM","NEWBD","TCOM",5,"0-10","Assembly of Strain Relief for 60M Jumper",221546,"4650",NA,NA,NA,NA,2023,30,"STAUS",904,5,50,"B0811","",0,NA,0,0,8,NA,"",1,2023-07-19,"20/06/2023","12:00:00.000000AM",2023-06-20,"12:00:00.000000AM","21/06/2023","11:59:00.000000PM","21/06/2023","11:59:00.000000PM",NA,"26/06/2023"," 8:00:00.000000AM","10/07/2023"," 5:00:00.000000PM",NA,"",29,"","",NA,0,0,0,0,0,0,0,0,0,0,0,0,0,NA,0,"N",NA,NA,0,NA,"","","","",1,"N",NA,"Y","N","N","N",1,1,10,1,1,1,1,1,NA,"N",1,"",NA,NA,"AUD",NA,0,0,"N",NA,NA,NA,NA,"","",2,NA,2,NA,999,"","",NA,"","",NA,NA,"ASTANIMIROVIC","19/07/2023  6:40:06PM",34,6,2023,"B0811",24,NA
"STAUS-904-7","PERTH","DECOMM","NEWBD","TCOM",5,"0-10","Assembly of Qty 5 Parking Plates",221546,"4655",NA,NA,NA,NA,2023,30,"STAUS",904,7,70,"B0811","",0,NA,0,0,8,NA,"",1,2023-07-19,"20/06/2023","12:00:00.000000AM",2023-06-20,"12:00:00.000000AM","21/06/2023","11:59:00.000000PM","21/06/2023","11:59:00.000000PM",NA,"13/07/2023"," 8:00:00.000000AM","19/07/2023"," 5:00:00.000000PM",NA,"",29,"","",NA,0,0,0,0,0,0,0,0,0,0,0,0,0,NA,0,"N",NA,NA,0,NA,"","","","",1,"N",NA,"Y","N","N","N",1,1,5,1,1,1,1,1,NA,"N",1,"",NA,NA,"AUD",NA,0,0,"N",NA,NA,NA,NA,"","",2,NA,2,NA,999,"","",NA,"","",NA,NA,"ASTANIMIROVIC","19/07/2023  6:41:15PM",34,6,2023,"B0811",24,NA
"STAUS-904-8","PERTH","DECOMM","NEWBD","OPEN",5,"0-10","Swap hose connection on 60M Jumper Assembly",221546,"4650",NA,NA,NA,NA,2023,30,"STAUS",904,8,80,"B0811","",0,NA,0,0,4,NA,"",1,2023-07-19,"20/06/2023","12:00:00.000000AM",2023-06-20,"12:00:00.000000AM","21/06/2023","11:59:00.000000PM","21/06/2023","11:59:00.000000PM",NA,"","","","",NA,"",29,"","",NA,0,0,0,0,0,0,0,0,0,0,0,0,0,NA,0,"N",NA,NA,0,NA,"","","","",1,"N",NA,"Y","N","N","N",1,1,1,1,1,1,1,1,NA,"N",1,"",NA,NA,"AUD",NA,0,0,"N",NA,NA,NA,NA,"","",2,NA,2,NA,999,"","",NA,"","",NA,NA,"AALTAF1","19/07/2023  1:10:45AM",34,6,2023,"B0811",24,NA
"STAUS-906-3","PERTH","CLIENTOWN","PREJB","OPRV",5,"0-10","TCRT tubing swap and hydraulic hoses installation.",221546,"4200",NA,NA,NA,NA,2023,30,"STAUS",906,3,30,"B0811","",0,NA,0,0,1,NA,"",1,2023-07-19,"19/06/2023","12:00:00.000000AM",2023-06-19,"12:00:00.000000AM","26/08/2023","11:59:00.000000PM","26/08/2023","11:59:00.000000PM",NA,"17/07/2023"," 8:00:00.000000AM","17/07/2023"," 5:00:00.000000PM",NA,"",27,"","",NA,0,0,0,0,0,0,0,0,0,0,0,0,0,NA,0,"N",NA,NA,0,NA,"","","","",1,"N",NA,"Y","N","N","N",1,1,3,1,1,1,1,1,NA,"N",1,"",NA,NA,"AUD",NA,0,0,"N",NA,NA,NA,NA,"","",2,NA,2,NA,999,"","",NA,"","",NA,NA,"JKAUR3","19/07/2023  5:18:50AM",35,6,2023,"B0811",48,NA
"STAUS-908-1","PERTH","DECOMM","NEWBD","WIP",5,"0-10","TC Shrouds Assembly and Fit Test",221546,"3660",NA,NA,NA,NA,2023,30,"STAUS",908,1,10,"B0811","",0,NA,0,0,8,NA,"",1,2023-07-19,"21/06/2023","12:00:00.000000AM",2023-06-21,"12:00:00.000000AM","23/06/2023","11:59:00.000000PM","23/06/2023","11:59:00.000000PM",NA,"19/07/2023"," 8:00:00.000000AM","20/07/2023"," 5:00:00.000000PM",NA,"",17,"","",NA,0,0,0,0,0,0,0,0,0,0,0,0,0,NA,0,"N",NA,NA,0,NA,"","","","",1,"N",NA,"Y","N","N","N",1,1,3,1,1,1,1,1,NA,"N",1,"",NA,NA,"AUD",NA,0,0,"N",NA,NA,NA,NA,"","",2,NA,2,NA,999,"","",NA,"","",NA,NA,"ASTANIMIROVIC","20/07/2023  6:16:26PM",33,6,2023,"B0811",9,NA
"STAUS-908-2","PERTH","DECOMM","NEWBD","TCOM",5,"0-10","TC Shrouds Parts Inventory",221546,"3660",NA,NA,NA,NA,2023,30,"STAUS",908,2,20,"B0811","",0,NA,0,0,1,NA,"",1,2023-07-19,"21/06/2023","12:00:00.000000AM",2023-06-21,"12:00:00.000000AM","23/06/2023","11:59:00.000000PM","23/06/2023","11:59:00.000000PM",NA,"19/07/2023"," 8:00:00.000000AM","20/07/2023"," 5:00:00.000000PM",NA,"",17,"","",NA,0,0,0,0,0,0,0,0,0,0,0,0,0,NA,0,"N",NA,NA,0,NA,"","","","",1,"N",NA,"Y","N","N","N",1,1,3,1,1,1,1,1,NA,"N",1,"",NA,NA,"AUD",NA,0,0,"N",NA,NA,NA,NA,"","",2,NA,2,NA,999,"","",NA,"","",NA,NA,"ASTANIMIROVIC","20/07/2023  6:17:31PM",33,6,2023,"B0811",9,NA
"STAUS-926-1","PERTH","INTV SLTN","PSTJB","OPRV",5,"0-10","DOF DWS HIRE DEMOB",221035,"7000","18227","AU0516","AU0516","Cutters Diamond wire saw 3616 ROV flotation",2023,30,"STAUS",926,1,10,"B0811","BUSTR",0,NA,0,0,40,NA,"APAC40",1,2023-07-19,"12/07/2023","12:00:00.000000AM",2023-07-12,"12:00:00.000000AM","21/07/2023","11:59:00.000000PM","21/07/2023","11:59:00.000000PM",NA,"17/07/2023"," 8:00:00.000000AM","19/07/2023"," 5:00:00.000000PM",NA,"",10,"","",NA,0,0,0,0,0,0,0,0,0,0,0,0,0,NA,0,"N",NA,NA,0,NA,"","","","",1,"N",NA,"Y","N","N","N",1,1,5,1,1,1,1,1,NA,"N",1,"",NA,NA,"AUD",NA,0,0,"N",NA,NA,NA,NA,"","APAC_WS-3616_PST",2,NA,2,NA,999,"","",NA,"","",NA,NA,"JKAUR3","19/07/2023  5:16:24AM",12,7,2023,"B0811",1,"BUSTR-18227"
"STAUS-931-2","PERTH","C&I","NEWBD","PSCH",5,"0-10","Pressure Testing the 2-way valve",225129,"5030",NA,NA,NA,NA,2023,30,"STAUS",931,2,20,"B0811","",0,NA,0,0,1,NA,"",1,2023-07-19,"24/07/2023","12:00:00.000000AM",2023-07-24,"12:00:00.000000AM","28/07/2023","11:59:00.000000PM","28/07/2023","11:59:00.000000PM",NA,"","","","",NA,"",31,"","",NA,0,0,0,0,0,0,0,0,0,0,0,0,0,NA,0,"N",NA,NA,0,NA,"","","","",1,"N",NA,"N","N","N","N",1,1,1,1,1,1,1,1,NA,"N",1,"",NA,NA,"AUD",NA,0,0,"N",NA,NA,NA,NA,"","",2,NA,2,NA,999,"","",NA,"","",NA,NA,"AWTAYLOR","23/07/2023  6:29:56PM",0,7,2023,"B0811",1,NA
"STAUS-935-1","PERTH","SSR-TOOLS","PSTJB","PSCH",5,"0-10","221035 - DOF - CHOP SAW 32"" POST-JOB",221035,"7000","18446","AU0427","AU0427","32 Chop Saw or Circular Cut Saw w  Blade 22",2023,30,"STAUS",935,1,1,"B0811","BUSTR",0,NA,0,0,8,NA,"AUS00002",1,2023-07-19,"20/07/2023","12:00:00.000000AM",2023-07-31,"12:00:00.000000AM","31/07/2023","11:59:00.000000PM","31/07/2023","11:59:00.000000PM",NA,"","","","",NA,"",11,"","",NA,0,0,0,0,0,0,0,0,0,0,0,0,0,NA,0,"N",NA,NA,0,NA,"","","","",1,"N",NA,"N","N","N","N",1,1,1,1,1,1,1,1,NA,"N",1,"",NA,NA,"AUD",NA,0,0,"N",NA,NA,NA,NA,"","",2,NA,2,NA,999,"STAUS","PERTH",NA,"","",NA,NA,"TVICAREY","19/07/2023  8:04:38PM",-7,7,2023,"B0811",1,"BUSTR-18446"
"STLAD-350-1","LUANDA","DRILL SUPP","PSTJB","WIP",5,"0-10","Empty Water bag MS7062 and take to fabrication shop to repair the door hinge",178391,"1",NA,NA,NA,NA,2023,30,"STLAD",350,1,10,"B0078","",0,NA,0,0,1,NA,"",1,2023-07-19,"29/06/2023","12:00:00.000000AM",2023-06-29,"12:00:00.000000AM","29/06/2023","11:59:00.000000PM","29/06/2023","11:59:00.000000PM",NA,"07/07/2023"," 8:00:00.000000AM","07/07/2023"," 5:00:00.000000PM",NA,"",16,"","",NA,0,0,0,0,0,0,0,0,0,0,0,0,0,NA,0,"N",NA,NA,0,NA,"","","","",1,"N",NA,"Y","N","N","N",1,1,1,1,1,1,1,1,NA,"N",1,"WORKORDER",NA,NA,"AOA",NA,0,0,"N",NA,NA,NA,NA,"","",2,NA,2,NA,999,"","",NA,"","",NA,NA,"DANTONIO","21/07/2023  9:13:21AM",25,6,2023,"B0078",1,NA
"STLAD-362-1","LUANDA","INTV SLTN","PSTJB","OPEN",5,"0-10","TSR 45 - 
Repair 6x sonar heads 0034351X and return to SCM once completed.",703088,"1",NA,NA,NA,NA,2023,30,"STLAD",362,1,10,"B0078","",0,NA,0,0,1,NA,"",1,2023-07-19,"19/07/2023","",NA,"","","","21/07/2023","",NA,"","","","",NA,"",NA,"","",NA,0,0,0,0,0,0,0,0,0,0,0,0,0,NA,0,"N",NA,NA,0,NA,"","","","",1,"N",NA,"N","N","N","N",1,1,1,1,1,1,1,1,NA,"N",1,"WORKORDER",NA,NA,"AOA",NA,0,0,"N",NA,NA,NA,NA,"","",2,NA,2,NA,999,"","",NA,"","",NA,NA,"DANTONIO","19/07/2023  4:50:14AM",NA,NA,NA,"B0078",1,NA
"STLAD-363-1","LUANDA","INTV SLTN","PREJB","TSCD",5,"0-10","TSR 45 - Repair 6x sonar heads 0034351X and return to SCM once completed.",178391,"1",NA,NA,NA,NA,2023,30,"STLAD",363,1,10,"B0078","",0,NA,0,0,1,NA,"",1,2023-07-19,"19/07/2023","12:00:00.000000AM",2023-07-19,"12:00:00.000000AM","21/07/2023","11:59:00.000000PM","21/07/2023","11:59:00.000000PM",NA,"","","","",NA,"",16,"","",NA,0,0,0,0,0,0,0,0,0,0,0,0,0,NA,0,"N",NA,NA,0,NA,"","","","",1,"N",NA,"Y","N","N","N",1,1,1,1,1,1,1,1,NA,"N",1,"WORKORDER",NA,NA,"AOA",NA,0,0,"N",NA,NA,NA,NA,"","",2,NA,2,NA,999,"","",NA,"","",NA,NA,"DANTONIO","21/07/2023  9:13:21AM",5,7,2023,"B0078",1,NA
"STAUS-854-16","PERTH","CLIENTOWN","ADHOC","WIP",4,"0-10","Workshop technicians to conduct inventory of all CPI, COTS and other parts and items to be sent to DWS",221703,"4100",NA,NA,NA,NA,2023,30,"STAUS",854,16,160,"B0811","",0,NA,0,0,8,NA,"",1,2023-07-20,"21/06/2023","12:00:00.000000AM",2023-05-01,"12:00:00.000000AM","06/10/2023","11:59:00.000000PM","21/06/2023","11:59:00.000000PM",NA,"","","","",NA,"",1,"","",NA,0,0,0,0,0,0,0,0,0,0,0,0,0,NA,0,"N",NA,NA,0,NA,"","","","",1,"N",NA,"Y","N","N","N",1,1,2,1,1,1,1,1,NA,"N",1,"",NA,NA,"AUD",NA,0,0,"N",NA,NA,NA,NA,"","",2,NA,2,NA,999,"","",NA,"","",NA,NA,"AWTAYLOR","18/07/2023  6:24:51PM",84,5,2023,"B0811",1,NA
"STAUS-854-17","PERTH","CLIENTOWN","ADHOC","OHOT",4,"0-10","KC4-3 Disassembly",221703,"4100",NA,NA,NA,NA,2023,30,"STAUS",854,17,170,"B0811","",0,NA,0,0,4,NA,"",1,2023-07-20,"22/06/2023","12:00:00.000000AM",2023-05-01,"12:00:00.000000AM","06/10/2023","11:59:00.000000PM","22/06/2023","11:59:00.000000PM",NA,"19/07/2023"," 8:00:00.000000AM","19/07/2023"," 5:00:00.000000PM",NA,"",1,"","",NA,0,0,0,0,0,0,0,0,0,0,0,0,0,NA,0,"N",NA,NA,0,NA,"","","","",1,"N",NA,"Y","N","N","N",1,1,1,1,1,1,1,1,NA,"N",1,"",NA,NA,"AUD",NA,0,0,"N",NA,NA,NA,NA,"","",2,NA,2,NA,999,"","",NA,"","",NA,NA,"JPRATT","20/07/2023 12:44:41AM",84,5,2023,"B0811",1,NA
"STAUS-897-1","PERTH","CLIENTOWN","PREJB","WIP",4,"0-10","Corallina XT Preparation",221546,"5150",NA,NA,NA,NA,2023,30,"STAUS",897,1,10,"B0811","",0,NA,0,0,1,NA,"",1,2023-07-20,"13/06/2023","12:00:00.000000AM",2023-06-13,"12:00:00.000000AM","15/06/2023","11:59:00.000000PM","15/06/2023","11:59:00.000000PM",NA,"","","","",NA,"",27,"","",NA,0,0,0,0,0,0,0,0,0,0,0,0,0,NA,0,"N",NA,NA,0,NA,"","","","",1,"N",NA,"Y","N","N","N",1,1,2,1,1,1,1,1,NA,"N",1,"",NA,NA,"AUD",NA,0,0,"N",NA,NA,NA,NA,"","",2,NA,2,NA,999,"","",NA,"","",NA,NA,"RSEDDON","20/07/2023 12:16:45AM",41,6,2023,"B0811",1,NA
"STAUS-900-2","PERTH","C&I","NEWBD","PSCH",4,"0-10","Green tagging electrical cables",224104,"5000",NA,NA,NA,NA,2023,30,"STAUS",900,2,20,"B0811","",0,NA,0,0,4,NA,"",1,2023-07-20,"19/06/2023","12:00:00.000000AM",2023-06-19,"12:00:00.000000AM","23/06/2023","11:59:00.000000PM","23/06/2023","11:59:00.000000PM",NA,"","","","",NA,"",32,"","",NA,0,0,0,0,0,0,0,0,0,0,0,0,0,NA,0,"N",NA,NA,0,NA,"","","","",1,"N",NA,"N","N","N","N",1,1,1,1,1,1,1,1,NA,"N",1,"",NA,NA,"AUD",NA,0,0,"N",NA,NA,NA,NA,"","",2,NA,2,NA,999,"","",NA,"","",NA,NA,"SACHARYA","20/07/2023  9:18:44PM",35,6,2023,"B0811",16,NA
"STAUS-912-2","PERTH","C&I","NEWBD","OHWP",4,"0-10","Robotorch Chassis Assembly",220885,"4000",NA,NA,NA,NA,2023,30,"STAUS",912,2,20,"B0811","",0,NA,0,0,1,NA,"",1,2023-07-20,"03/07/2023","12:00:00.000000AM",2023-07-03,"12:00:00.000000AM","28/07/2023","11:59:00.000000PM","28/07/2023","11:59:00.000000PM",NA,"","","","",NA,"",1,"","",NA,0,0,0,0,0,0,0,0,0,0,0,0,0,NA,0,"N",NA,NA,0,NA,"","","","",1,"N",NA,"Y","N","N","N",1,1,1,1,1,1,1,1,NA,"N",1,"",NA,NA,"AUD",NA,0,0,"N",NA,NA,NA,NA,"","",2,NA,2,NA,999,"","",NA,"","",NA,NA,"EWILSON1","20/07/2023  6:14:04PM",21,7,2023,"B0811",1,NA
"STAUS-921-1","PERTH","C&I","PREJB","WIP",4,"0-10","Pre job inspection and service of Acid Dosing Skid AU0617 - Unit Green Tagged Already from WO858",226653,"5010","23808","AU0617","AU0617","Acid Dosing Skid",2023,30,"STAUS",921,1,10,"B0811","BUSTR",0,NA,0,0,16,NA,"APAC07",1,2023-07-20,"05/07/2023","12:00:00.000000AM",2023-07-06,"12:00:00.000000AM","12/07/2023","11:59:00.000000PM","14/07/2023","11:59:00.000000PM",NA,"","","","",NA,"",22,"","",NA,0,0,0,0,0,0,0,0,0,0,0,0,0,NA,0,"N",NA,NA,0,NA,"","","","",1,"N",NA,"Y","N","N","N",1,4,5,1,1,1,1,1,NA,"N",1,"",NA,NA,"AUD",NA,0,0,"N",NA,NA,NA,NA,"","",2,NA,2,NA,999,"","",NA,"","",NA,NA,"AWTAYLOR","20/07/2023  8:19:11PM",18,7,2023,"B0811",32,"BUSTR-23808"
"STAUS-921-2","PERTH","C&I","PREJB","PMRV",4,"0-10","Configuration of the ADS Skid with 40Gal Bladder & LOAD TESTING",226653,"4010",NA,NA,NA,NA,2023,30,"STAUS",921,2,20,"B0811","BUSTR",0,NA,0,0,16,NA,"",1,2023-07-20,"05/07/2023","12:00:00.000000AM",2023-07-06,"12:00:00.000000AM","12/07/2023","11:59:00.000000PM","20/07/2023","11:59:00.000000PM",NA,"20/07/2023"," 8:00:00.000000AM","20/07/2023"," 5:00:00.000000PM",NA,"",22,"","",NA,0,0,0,0,0,0,0,0,0,0,0,0,0,NA,0,"N",NA,NA,0,NA,"","","","",1,"N",NA,"Y","N","N","N",1,1,4,1,1,1,1,1,NA,"N",1,"",NA,NA,"AUD",NA,0,0,"N",NA,NA,NA,NA,"","",2,NA,2,NA,999,"","",NA,"","",NA,NA,"AWTAYLOR","20/07/2023  8:19:41PM",18,7,2023,"B0811",32,NA
"STAUS-930-1","PERTH","DECOMM","NEWBD","TSCD",4,"0-10","Tubing Shear Tool Assembly",221546,"3660",NA,NA,NA,NA,2023,30,"STAUS",930,1,10,"B0811","",0,NA,0,0,6,NA,"",1,2023-07-20,"16/07/2023","12:00:00.000000AM",2023-07-16,"12:00:00.000000AM","31/07/2023","11:59:00.000000PM","31/07/2023","11:59:00.000000PM",NA,"","","","",NA,"",17,"","",NA,0,0,0,0,0,0,0,0,0,0,0,0,0,NA,0,"N",NA,NA,0,NA,"","","","",1,"N",NA,"Y","N","N","N",1,1,1,1,1,1,1,1,NA,"N",1,"",NA,NA,"AUD",NA,0,0,"N",NA,NA,NA,NA,"","",2,NA,2,NA,999,"","",NA,"","",NA,NA,"AWTAYLOR","20/07/2023  8:05:19PM",8,7,2023,"B0811",8,NA
"STAUS-930-3","PERTH","DECOMM","NEWBD","WIP",4,"0-10","Tubing Shear Tool Inventory",221546,"3660",NA,NA,NA,NA,2023,30,"STAUS",930,3,30,"B0811","",0,NA,0,0,1,NA,"",1,2023-07-20,"16/07/2023","12:00:00.000000AM",2023-07-16,"12:00:00.000000AM","31/07/2023","11:59:00.000000PM","31/07/2023","11:59:00.000000PM",NA,"21/07/2023"," 8:00:00.000000AM","23/07/2023"," 5:00:00.000000PM",NA,"",17,"","",NA,0,0,0,0,0,0,0,0,0,0,0,0,0,NA,0,"N",NA,NA,0,NA,"","","","",1,"N",NA,"Y","N","N","N",1,1,2,1,1,1,1,1,NA,"N",1,"",NA,NA,"AUD",NA,0,0,"N",NA,NA,NA,NA,"","",2,NA,2,NA,999,"","",NA,"","",NA,NA,"ASTANIMIROVIC","23/07/2023  6:18:44PM",8,7,2023,"B0811",8,NA
"STAUS-931-4","PERTH","C&I","NEWBD","PSCH",4,"0-10","Assembly of the Intervention Panel",225129,"4030",NA,NA,NA,NA,2023,30,"STAUS",931,4,30,"B0811","",0,NA,0,0,1,NA,"",1,2023-07-20,"24/07/2023","12:00:00.000000AM",2023-07-24,"12:00:00.000000AM","28/07/2023","11:59:00.000000PM","28/07/2023","11:59:00.000000PM",NA,"","","","",NA,"",31,"","",NA,0,0,0,0,0,0,0,0,0,0,0,0,0,NA,0,"N",NA,NA,0,NA,"","","","",1,"N",NA,"N","N","N","N",1,1,1,1,1,1,1,1,NA,"N",1,"",NA,NA,"AUD",NA,0,0,"N",NA,NA,NA,NA,"","",2,NA,2,NA,999,"","",NA,"","",NA,NA,"AWTAYLOR","23/07/2023  6:29:56PM",0,7,2023,"B0811",1,NA
"STAUS-931-5","PERTH","C&I","NEWBD","PSCH",4,"0-10","FAT Intervention Panel",225129,"5030",NA,NA,NA,NA,2023,30,"STAUS",931,5,40,"B0811","",0,NA,0,0,1,NA,"",1,2023-07-20,"24/07/2023","12:00:00.000000AM",2023-07-24,"12:00:00.000000AM","28/07/2023","11:59:00.000000PM","28/07/2023","11:59:00.000000PM",NA,"","","","",NA,"",31,"","",NA,0,0,0,0,0,0,0,0,0,0,0,0,0,NA,0,"N",NA,NA,0,NA,"","","","",1,"N",NA,"N","N","N","N",1,1,1,1,1,1,1,1,NA,"N",1,"",NA,NA,"AUD",NA,0,0,"N",NA,NA,NA,NA,"","",2,NA,2,NA,999,"","",NA,"","",NA,NA,"AWTAYLOR","23/07/2023  6:29:56PM",0,7,2023,"B0811",1,NA
"STAUS-934-1","PERTH","SSR-TOOLS","PREJB","WIP",4,"0-10","CHOPSAW 22IN PRE-JOB",224870,"7000","17987","AU0048","AU0048","CHOP SAW 22 IN ASSEMBLY",2023,30,"STAUS",934,1,10,"B0811","BUSTR",0,NA,0,0,1,NA,"APAC07",1,2023-07-20,"19/07/2023","12:00:00.000000AM",2023-07-19,"12:00:00.000000AM","26/07/2023","11:59:00.000000PM","26/07/2023","11:59:00.000000PM",NA,"","","","",NA,"",11,"","",NA,0,0,0,0,0,0,0,0,0,0,0,0,0,NA,0,"N",NA,NA,0,NA,"","","","",1,"N",NA,"Y","N","N","N",1,1,2,1,1,1,1,1,NA,"N",1,"",NA,NA,"AUD",NA,0,0,"N",NA,NA,NA,NA,"","",2,NA,2,NA,999,"","",NA,"","",NA,NA,"EWILSON1","20/07/2023  6:15:37PM",5,7,2023,"B0811",8,"BUSTR-17987"
"STAUS-936-1","PERTH","CLIENTOWN","PREJB","PSCH",4,"0-10","PRVs re-certified, to be install back in HPU unit.",221546,"4200",NA,NA,NA,NA,2023,30,"STAUS",936,1,10,"B0811","",0,NA,0,0,1,NA,"",1,2023-07-20,"20/07/2023","12:00:00.000000AM",2023-07-20,"12:00:00.000000AM","20/07/2023","11:59:00.000000PM","20/07/2023","11:59:00.000000PM",NA,"","","","",NA,"",27,"","",NA,0,0,0,0,0,0,0,0,0,0,0,0,0,NA,0,"N",NA,NA,0,NA,"","","","",1,"N",NA,"N","N","N","N",1,1,1,1,1,1,1,1,NA,"N",1,"",NA,NA,"AUD",NA,0,0,"N",NA,NA,NA,NA,"","",2,NA,2,NA,999,"","",NA,"","",NA,NA,"LMATYKOWSKA","20/07/2023  1:11:37AM",4,7,2023,"B0811",1,NA
"STAUS-937-1","PERTH","DECOMM","PREJB","PSCH",4,"0-10","Preparation of PCRT and ancillaries",227216,"7000",NA,NA,NA,NA,2023,30,"STAUS",937,1,10,"B0811","BUSTR",0,NA,0,0,1,NA,"",1,2023-07-20,"20/07/2023","12:00:00.000000AM",2023-07-20,"12:00:00.000000AM","15/09/2023","11:59:00.000000PM","15/09/2023","11:59:00.000000PM",NA,"","","","",NA,"",30,"","",NA,0,0,0,0,0,0,0,0,0,0,0,0,0,NA,0,"N",NA,NA,0,NA,"","","","",1,"N",NA,"N","N","N","N",1,1,1,1,1,1,1,1,NA,"N",1,"",NA,NA,"AUD",NA,0,0,"N",NA,NA,NA,NA,"","",2,NA,2,NA,999,"","",NA,"","",NA,NA,"TJDESPAIN","24/07/2023  1:48:58AM",4,7,2023,"B0811",1,NA
"STAUS-937-2","PERTH","DECOMM","PREJB","OPEN",4,"0-10","SIT",227216,"5000",NA,NA,NA,NA,2023,30,"STAUS",937,2,20,"B0811","BUSTR",0,NA,0,0,16,NA,"",1,2023-07-20,"31/08/2023","12:00:00.000000AM",2023-07-20,"12:00:00.000000AM","15/09/2023","11:59:00.000000PM","01/09/2023","11:59:00.000000PM",NA,"","","","",NA,"",30,"","",NA,0,0,0,0,0,0,0,0,0,0,0,0,0,NA,0,"N",NA,NA,0,NA,"","","","",1,"N",NA,"N","N","N","N",1,1,1,1,1,1,1,1,NA,"N",1,"",NA,NA,"AUD",NA,0,0,"N",NA,NA,NA,NA,"","",2,NA,2,NA,999,"","",NA,"","",NA,NA,"TJDESPAIN","24/07/2023  1:48:58AM",4,7,2023,"B0811",1,NA
"STABO-618-1","ABERDEEN","DRILL SUPP","PLAN","PSCH",3,"0-10","Frame, Launch & Recovery Complete strip down and rebuild.",184031,"4260","8921","BP00094","BP00094","Frame, Launch & Recovery",2023,30,"STABO",618,1,10,"B0551","BUSTR",0,NA,0,0,15,NA,"EMEA0501",1,2023-07-21,"21/07/2023","12:00:00.000000AM",2023-07-21,"12:00:00.000000AM","31/08/2023","11:59:00.000000PM","31/08/2023","11:59:00.000000PM",NA,"","","","",NA,"",16,"","",NA,0,0,0,0,0,0,0,0,0,0,0,0,0,NA,0,"N",NA,NA,0,NA,"","","","",1,"N",2020502,"Y","N","N","N",1,1,1,1,1,1,1,1,NA,"N",1,"WOMUK",NA,NA,"GBP",NA,0,0,"N",NA,NA,NA,NA,"","BP_ABO_FRAME_L&R_2YEARLY",2,NA,2,NA,999,"STABO","ABERDEEN",NA,"","",NA,NA,"PMAHAJAN","21/07/2023  5:20:17AM",3,7,2023,"B0551",1,"BUSTR-8921"
"STABO-619-1","ABERDEEN","DRILL SUPP","PLAN","PSCH",3,"0-10","Frame, Launch & Recovery Complete strip down and rebuild.",184031,"4260","8920","BP00093","BP00093","Frame, Launch & Recovery",2023,30,"STABO",619,1,10,"B0551","BUSTR",0,NA,0,0,15,NA,"EMEA0501",1,2023-07-21,"21/07/2023","12:00:00.000000AM",2023-07-21,"12:00:00.000000AM","31/08/2023","11:59:00.000000PM","31/08/2023","11:59:00.000000PM",NA,"","","","",NA,"",16,"","",NA,0,0,0,0,0,0,0,0,0,0,0,0,0,NA,0,"N",NA,NA,0,NA,"","","","",1,"N",2020502,"Y","N","N","N",1,1,1,1,1,1,1,1,NA,"N",1,"WOMUK",NA,NA,"GBP",NA,0,0,"N",NA,NA,NA,NA,"","BP_ABO_FRAME_L&R_2YEARLY",2,NA,2,NA,999,"STABO","ABERDEEN",NA,"","",NA,NA,"PMAHAJAN","21/07/2023  5:23:55AM",3,7,2023,"B0551",1,"BUSTR-8920"
"STABO-620-1","ABERDEEN","DRILL SUPP","PLAN","PSCH",3,"0-10","Frame, Launch & Recovery Complete strip down and rebuild.",184031,"4260","21778","BP00532","BP00532","Frame, Launch & Recovery",2023,30,"STABO",620,1,10,"B0551","BUSTR",0,NA,0,0,15,NA,"EMEA0502",1,2023-07-21,"21/07/2023","12:00:00.000000AM",2023-07-21,"12:00:00.000000AM","31/08/2023","11:59:00.000000PM","31/08/2023","11:59:00.000000PM",NA,"","","","",NA,"",16,"","",NA,0,0,0,0,0,0,0,0,0,0,0,0,0,NA,0,"N",NA,NA,0,NA,"","","","",1,"N",2020502,"Y","N","N","N",1,1,1,1,1,1,1,1,NA,"N",1,"WOMUK",NA,NA,"GBP",NA,0,0,"N",NA,NA,NA,NA,"","BP_ABO_FRAME_L&R_2YEARLY",2,NA,2,NA,999,"STABO","ABERDEEN",NA,"","",NA,NA,"PMAHAJAN","21/07/2023  5:30:48AM",3,7,2023,"B0551",1,"BUSTR-21778"
"STABO-621-1","ABERDEEN","DRILL SUPP","PLAN","PSCH",3,"0-10","FTP Single / Dual Drive Unit",184031,"4260","9085","BP00272","BP00272","Fly-to-Place (FTP) Tool, Dual Drive Unit",2023,30,"STABO",621,1,10,"B0551","BUSTR",0,NA,0,0,3,NA,"EMEA0501",1,2023-07-21,"21/07/2023","12:00:00.000000AM",2023-07-21,"12:00:00.000000AM","31/08/2023","11:59:00.000000PM","31/08/2023","11:59:00.000000PM",NA,"","","","",NA,"",16,"","",NA,0,0,0,0,0,0,0,0,0,0,0,0,0,NA,0,"N",NA,NA,0,NA,"","","","",1,"N",2020502,"Y","N","N","N",1,1,1,1,1,1,1,1,NA,"N",1,"WOMUK",NA,NA,"GBP",NA,0,0,"N",NA,NA,NA,NA,"","BP_ABO_FTP_DRIVE_PP",2,NA,2,NA,999,"STABO","ABERDEEN",NA,"","",NA,NA,"PMAHAJAN","21/07/2023  5:42:17AM",3,7,2023,"B0551",1,"BUSTR-9085"
"STAUS-925-6","PERTH","C&I","NEWBD","PSCH",3,"0-10","FAT of CRM Plugs",208539,"5000",NA,NA,NA,NA,2023,30,"STAUS",925,6,60,"B0811","",0,NA,0,0,24,NA,"",1,2023-07-21,"25/07/2023","12:00:00.000000AM",2023-07-14,"12:00:00.000000AM","21/07/2023","11:59:00.000000PM","27/07/2023","11:59:00.000000PM",NA,"","","","",NA,"",32,"","",NA,0,0,0,0,0,0,0,0,0,0,0,0,0,NA,0,"N",NA,NA,0,NA,"","","","",1,"N",NA,"N","N","N","N",1,1,1,1,1,1,1,1,NA,"N",1,"",NA,NA,"AUD",NA,0,0,"N",NA,NA,NA,NA,"","",2,NA,2,NA,999,"","",NA,"","",NA,NA,"SACHARYA","23/07/2023  8:44:00PM",10,7,2023,"B0811",48,NA
"STAUS-937-3","PERTH","DECOMM","PREJB","PSCH",3,"0-10","Electrical Reel Mobilization",227216,"7000","18763","AU0380","AU0380","Electrical Reel PCRT",2023,30,"STAUS",937,3,30,"B0811","BUSTR",0,NA,0,0,1,NA,"APAC02",1,2023-07-21,"20/07/2023","12:00:00.000000AM",2023-07-20,"12:00:00.000000AM","15/09/2023","11:59:00.000000PM","15/09/2023","11:59:00.000000PM",NA,"","","","",NA,"",30,"","",NA,0,0,0,0,0,0,0,0,0,0,0,0,0,NA,0,"N",NA,NA,0,NA,"","","","",1,"N",NA,"Y","N","N","N",1,1,1,1,1,1,1,1,NA,"N",1,"",NA,NA,"AUD",NA,0,0,"N",NA,NA,NA,NA,"","",2,NA,2,NA,999,"","",NA,"BTM-10-02","",NA,NA,"TJDESPAIN","24/07/2023  1:48:58AM",4,7,2023,"B0811",1,"BUSTR-18763"
"STAUS-937-4","PERTH","DECOMM","PREJB","PSCH",3,"0-10","Master blaster/ PCRT Mobilization",227216,"7000","18764","AU0215","AU0215","Master Blaster",2023,30,"STAUS",937,4,40,"B0811","BUSTR",0,NA,0,0,1,NA,"APAC02",1,2023-07-21,"20/07/2023","12:00:00.000000AM",2023-07-20,"12:00:00.000000AM","15/09/2023","11:59:00.000000PM","15/09/2023","11:59:00.000000PM",NA,"","","","",NA,"",30,"","",NA,0,0,0,0,0,0,0,0,0,0,0,0,0,NA,0,"N",NA,NA,0,NA,"","","","",1,"N",NA,"Y","N","N","N",1,1,2,1,1,1,1,1,NA,"N",1,"",NA,NA,"AUD",NA,0,0,"N",NA,NA,NA,NA,"","",2,NA,2,NA,999,"","",NA,"BTM-FLOOR","",NA,NA,"TJDESPAIN","24/07/2023  1:48:58AM",4,7,2023,"B0811",1,"BUSTR-18764"
"STAUS-937-5","PERTH","DECOMM","PREJB","PSCH",3,"0-10","Hydraulic control panel - PCRT MOB",227216,"7000","18757","AU0378","AU0378","Hydraulic Control Panel PCRT",2023,30,"STAUS",937,5,50,"B0811","BUSTR",0,NA,0,0,1,NA,"APAC07",1,2023-07-21,"20/07/2023","12:00:00.000000AM",2023-07-20,"12:00:00.000000AM","15/09/2023","11:59:00.000000PM","15/09/2023","11:59:00.000000PM",NA,"","","","",NA,"",30,"","",NA,0,0,0,0,0,0,0,0,0,0,0,0,0,NA,0,"N",NA,NA,0,NA,"","","","",1,"N",NA,"Y","N","N","N",1,1,1,1,1,1,1,1,NA,"N",1,"",NA,NA,"AUD",NA,0,0,"N",NA,NA,NA,NA,"","",2,NA,2,NA,999,"","",NA,"","",NA,NA,"TJDESPAIN","24/07/2023  1:48:59AM",4,7,2023,"B0811",1,"BUSTR-18757"
"STLAD-247-1","LUANDA","C&I","PSTJB","PMRV",3,"0-10","TSR 223 - X-Part Multi - Sea Camera SN1860-T, SN1808-T, SN250-T 3x OII Part N: 0322047R",703088,"1",NA,NA,NA,NA,2023,30,"STLAD",247,1,10,"B0078","",0,NA,0,0,1,NA,"",1,2023-07-21,"20/01/2023","12:00:00.000000AM",2023-01-20,"12:00:00.000000AM","25/01/2023","11:59:00.000000PM","25/01/2023","11:59:00.000000PM",NA,"","","","",NA,"",16,"","",NA,0,0,0,0,0,0,0,0,0,0,0,0,0,NA,0,"N",NA,NA,0,NA,"","","","",1,"N",NA,"Y","N","N","N",1,1,2,1,1,1,1,1,NA,"N",1,"WORKORDER",NA,NA,"AOA",NA,0,0,"N",NA,NA,NA,NA,"","",2,NA,2,NA,999,"","",NA,"","",NA,NA,"DANTONIO","21/07/2023  9:13:21AM",185,1,2023,"B0078",1,NA
"STLAD-351-1","LUANDA","DRILL SUPP","PREJB","WIP",3,"0-10","TSR 53 - MIL121 0282917 QTY:02 Manipulator MM021-037-01-X QTY:02 Master Controller",703088,"1",NA,NA,NA,NA,2023,30,"STLAD",351,1,10,"B0078","",0,NA,0,0,1,NA,"",1,2023-07-21,"05/07/2023","12:00:00.000000AM",2023-07-05,"12:00:00.000000AM","12/07/2023","11:59:00.000000PM","12/07/2023","11:59:00.000000PM",NA,"18/07/2023"," 8:00:00.000000AM","21/07/2023"," 5:00:00.000000PM",NA,"",16,"","",NA,0,0,0,0,0,0,0,0,0,0,0,0,0,NA,0,"N",NA,NA,0,NA,"","","","",1,"N",NA,"Y","N","N","N",1,1,4,1,1,1,1,1,NA,"N",1,"WORKORDER",NA,NA,"AOA",NA,0,0,"N",NA,NA,NA,NA,"","",2,NA,2,NA,999,"","",NA,"","",NA,NA,"JGONGA","21/07/2023 10:35:24AM",19,7,2023,"B0078",1,NA
"STLAD-353-1","LUANDA","C&I","PSTJB","TCOM",3,"0-10","TSR 57 - T4 Wrist motor need to be tested and passed to SCM for MG159",703088,"1",NA,NA,NA,NA,2023,30,"STLAD",353,1,10,"B0078","",0,NA,0,0,1,NA,"",1,2023-07-21,"03/07/2023","12:00:00.000000AM",2023-07-03,"12:00:00.000000AM","14/07/2023","11:59:00.000000PM","07/07/2023","11:59:00.000000PM",NA,"21/07/2023"," 8:00:00.000000AM","21/07/2023"," 5:00:00.000000PM",NA,"",16,"","",NA,0,0,0,0,0,0,0,0,0,0,0,0,0,NA,0,"N",NA,NA,0,NA,"","","","",1,"N",NA,"Y","N","N","N",1,1,1,1,1,1,1,1,NA,"N",1,"WORKORDER",NA,NA,"AOA",NA,0,0,"N",NA,NA,NA,NA,"","",2,NA,2,NA,999,"","",NA,"","",NA,NA,"JGONGA","21/07/2023 10:33:30AM",21,7,2023,"B0078",1,NA
"STLAD-361-1","LUANDA","C&I","PSTJB","WIP",3,"0-10","Offload TMS and Vehicle from red container.",703088,"1",NA,NA,NA,NA,2023,30,"STLAD",361,1,10,"B0078","",0,NA,0,0,1,NA,"",1,2023-07-21,"19/07/2023","12:00:00.000000AM",2023-07-19,"12:00:00.000000AM","19/07/2023","11:59:00.000000PM","19/07/2023","11:59:00.000000PM",NA,"19/07/2023"," 8:00:00.000000AM","19/07/2023"," 5:00:00.000000PM",NA,"",16,"","",NA,0,0,0,0,0,0,0,0,0,0,0,0,0,NA,0,"N",NA,NA,0,NA,"","","","",1,"N",NA,"Y","N","N","N",1,1,4,1,1,1,1,1,NA,"N",1,"WORKORDER",NA,NA,"AOA",NA,0,0,"N",NA,NA,NA,NA,"","",2,NA,2,NA,999,"","",NA,"","",NA,NA,"JGONGA","21/07/2023 10:52:56AM",5,7,2023,"B0078",1,NA
"STLAD-364-1","LUANDA","DRILL SUPP","PREJB","TSCD",3,"0-10","Load test the 10T ROV emergency recovery latch",703088,"1",NA,NA,NA,NA,2023,30,"STLAD",364,1,10,"B0078","",0,NA,0,0,1,NA,"",1,2023-07-21,"24/07/2023","12:00:00.000000AM",2023-07-24,"12:00:00.000000AM","28/07/2023","11:59:00.000000PM","28/07/2023","11:59:00.000000PM",NA,"","","","",NA,"",16,"","",NA,0,0,0,0,0,0,0,0,0,0,0,0,0,NA,0,"N",NA,NA,0,NA,"","","","",1,"N",NA,"Y","N","N","N",1,1,2,1,1,1,1,1,NA,"N",1,"WORKORDER",NA,NA,"AOA",NA,0,0,"N",NA,NA,NA,NA,"","",2,NA,2,NA,999,"","",NA,"","",NA,NA,"DANTONIO","21/07/2023  9:21:14AM",0,7,2023,"B0078",1,NA
"STLAD-368-1","LUANDA","DRILL SUPP","PREJB","OPEN",3,"0-10","DEMOB RCU ER00620 CAME FROM BAKER HUGHES - SOYO",212153,"7000",NA,NA,NA,NA,2023,30,"STLAD",368,1,10,"B0078","",0,NA,0,0,1,NA,"",1,2023-07-21,"24/06/2023","",NA,"","","","30/06/2023","",NA,"","","","",NA,"",NA,"","",NA,0,0,0,0,0,0,0,0,0,0,0,0,0,NA,0,"N",NA,NA,0,NA,"","","","",1,"N",NA,"N","N","N","N",1,1,1,1,1,1,1,1,NA,"N",1,"WORKORDER",NA,NA,"AOA",NA,0,0,"N",NA,NA,NA,NA,"","",2,NA,2,NA,999,"","",NA,"","",NA,NA,"MFOFANA","21/07/2023 10:23:47AM",NA,NA,NA,"B0078",1,NA
"STAUS-903-4","PERTH","CLIENTOWN","PLAN","PSCH",1,"0-10","PSM-224334- P30 Plug Pre-Deployment Checks & Pressure Tests",224334,"8100",NA,NA,NA,NA,2023,30,"STAUS",903,4,40,"B0811","",0,NA,0,0,64,NA,"",1,2023-07-23,"03/07/2023","12:00:00.000000AM",2023-07-03,"12:00:00.000000AM","31/08/2023","11:59:00.000000PM","31/08/2023","11:59:00.000000PM",NA,"","","","",NA,"",25,"","",NA,0,0,0,0,0,0,0,0,0,0,0,0,0,NA,0,"N",NA,NA,0,NA,"","","","",1,"N",NA,"N","N","N","N",1,2,1,1,1,1,1,1,NA,"N",1,"",NA,NA,"AUD",NA,0,0,"N",NA,NA,NA,NA,"","",2,NA,2,NA,999,"","",NA,"","",NA,NA,"AWTAYLOR","23/07/2023  7:35:37PM",21,7,2023,"B0811",156,NA
"STAUS-903-5","PERTH","CLIENTOWN","PLAN","WIP",1,"0-10","PSM-224334- SW2 Plug Pre-Deployment Checks & Pressure Tests",224334,"8100",NA,NA,NA,NA,2023,30,"STAUS",903,5,50,"B0811","",0,NA,0,0,1,NA,"",1,2023-07-23,"03/07/2023","12:00:00.000000AM",2023-07-03,"12:00:00.000000AM","31/08/2023","11:59:00.000000PM","31/08/2023","11:59:00.000000PM",NA,"","","","",NA,"",25,"","",NA,0,0,0,0,0,0,0,0,0,0,0,0,0,NA,0,"N",NA,NA,0,NA,"","","","",1,"N",NA,"Y","N","N","N",1,2,2,1,1,1,1,1,NA,"N",1,"",NA,NA,"AUD",NA,0,0,"N",NA,NA,NA,NA,"","",2,NA,2,NA,999,"","",NA,"","",NA,NA,"DFARNWORTH","23/07/2023  7:53:41PM",21,7,2023,"B0811",156,NA
"STAUS-922-1","PERTH","DECOMM","NEWBD","TCOM",1,"0-10","Inventory check of Modified TCT parts",221546,"4650",NA,NA,NA,NA,2023,30,"STAUS",922,1,10,"B0811","",0,NA,0,0,1,NA,"",1,2023-07-23,"08/07/2023","12:00:00.000000AM",2023-07-08,"12:00:00.000000AM","15/07/2023","11:59:00.000000PM","15/07/2023","11:59:00.000000PM",NA,"10/07/2023"," 8:00:00.000000AM","13/07/2023"," 5:00:00.000000PM",NA,"",29,"","",NA,0,0,0,0,0,0,0,0,0,0,0,0,0,NA,0,"N",NA,NA,0,NA,"","","","",1,"N",NA,"Y","N","N","N",1,1,4,1,1,1,1,1,NA,"N",1,"",NA,NA,"AUD",NA,0,0,"N",NA,NA,NA,NA,"","",2,NA,2,NA,999,"","",NA,"","",NA,NA,"AWTAYLOR","23/07/2023  6:43:11PM",16,7,2023,"B0811",40,NA
"STAUS-938-1","PERTH","OPG-CLIENT","PSTJB","PSCH",1,"0-10","SUPER CLASS 1-4 TORQUE TOOL - POST-JOB",205870,"7000","23872","AUX0003","AUX0003","Super Class 1-4 Torque Tool",2023,30,"STAUS",938,1,1,"B0811","BUSTR",0,NA,0,0,1,NA,"AUS00002",1,2023-07-23,"24/07/2023","12:00:00.000000AM",2023-08-18,"12:00:00.000000AM","18/08/2023","11:59:00.000000PM","04/08/2023","11:59:00.000000PM",NA,"","","","",NA,"",11,"","",NA,0,0,0,0,0,0,0,0,0,0,0,0,0,NA,0,"N",NA,NA,0,NA,"","","","",1,"N",NA,"N","N","N","N",1,1,1,1,1,1,1,1,NA,"N",1,"",NA,NA,"AUD",NA,0,0,"N",NA,NA,NA,NA,"","",2,NA,2,NA,999,"","",NA,"","",NA,NA,"TVICAREY","24/07/2023 12:37:12AM",-25,8,2023,"B0811",1,"BUSTR-23872"
"STAUS-938-2","PERTH","OPG-CLIENT","PSTJB","PSCH",1,"0-10","RCU - POST-JOB",205870,"7000","18657","SI0229","SI0229","Remote Control Unit RCU",2023,30,"STAUS",938,2,20,"B0811","BUSTR",0,NA,0,0,32,NA,"AUS00002",1,2023-07-23,"24/07/2023","12:00:00.000000AM",2023-08-18,"12:00:00.000000AM","18/08/2023","11:59:00.000000PM","04/08/2023","11:59:00.000000PM",NA,"","","","",NA,"",11,"","",NA,0,0,0,0,0,0,0,0,0,0,0,0,0,NA,0,"N",NA,NA,0,NA,"","","","",1,"N",NA,"N","N","N","N",1,1,1,1,1,1,1,1,NA,"N",1,"",NA,NA,"AUD",NA,0,0,"N",NA,NA,NA,NA,"","",2,NA,2,NA,999,"","",NA,"","",NA,NA,"TVICAREY","24/07/2023 12:37:12AM",-25,8,2023,"B0811",1,"BUSTR-18657"
"STBAK-109-1","BAKU","DRILL SUPP","PLAN","PMRV",1,"0-10","4 STATION RCU4 BP 002",199224,"0110","21566","BP002","BP 002","4 STATION NORWEGIAN REMOTE CONTROL UNIT (RCU)",2023,30,"STBAK",109,1,10,"B0564","BUSTR",0,NA,0,0,5,NA,"EMEA0091",1,2023-07-23,"30/06/2023","12:00:00.000000AM",2023-06-30,"12:00:00.000000AM","06/07/2023","11:59:00.000000PM","06/07/2023","11:59:00.000000PM",NA,"20/07/2023"," 8:00:00.000000AM","20/07/2023"," 5:00:00.000000PM",NA,"",8,"","",NA,0,0,0,0,0,0,0,0,0,0,0,0,0,NA,0,"N",NA,NA,0,NA,"","","","",1,"N",NA,"Y","N","N","N",1,1,1,1,1,1,1,1,NA,"N",1,"WORKORDER",NA,NA,"AZN",NA,0,0,"N",NA,NA,NA,NA,"","",2,NA,2,NA,999,"","",NA,"","",NA,NA,"GQTAGIYEV","20/07/2023  4:01:47AM",24,6,2023,"B0564",5,"BUSTR-21566"
"STBAK-110-1","BAKU","DRILL SUPP","PLAN","PMRV",1,"0-10","5"" Mechanical Lockout Tool SD028",199224,"0110","21741","SD028","SD028","5"" Mechanical Lockout Tool",2023,30,"STBAK",110,1,10,"B0564","BUSTR",0,NA,0,0,5,NA,"EMEA0091",1,2023-07-23,"30/06/2023","12:00:00.000000AM",2023-06-30,"12:00:00.000000AM","07/07/2023","11:59:00.000000PM","07/07/2023","11:59:00.000000PM",NA,"04/07/2023"," 8:00:00.000000AM","04/07/2023"," 5:00:00.000000PM",NA,"",8,"","",NA,0,0,0,0,0,0,0,0,0,0,0,0,0,NA,0,"N",NA,NA,0,NA,"","","","",1,"N",NA,"Y","N","N","N",1,1,1,1,1,1,1,1,NA,"N",1,"WORKORDER",NA,NA,"AZN",NA,0,0,"N",NA,NA,NA,NA,"","",2,NA,2,NA,999,"","",NA,"","",NA,NA,"OHAYBATOV","21/07/2023 12:12:47AM",24,6,2023,"B0564",5,"BUSTR-21741"
"STBAK-111-1","BAKU","DRILL SUPP","PM","PMRV",1,"0-10","5"" Mechanical Lockout Tool SD030",199224,"0110","21743","SD030","SD030","5"" Mechanical Lockout Tool",2023,30,"STBAK",111,1,10,"B0564","BUSTR",0,NA,0,0,5,NA,"EMEA0091",1,2023-07-23,"30/06/2023","12:00:00.000000AM",2023-06-30,"12:00:00.000000AM","07/07/2023","11:59:00.000000PM","07/07/2023","11:59:00.000000PM",NA,"17/07/2023"," 8:00:00.000000AM","17/07/2023"," 5:00:00.000000PM",NA,"",8,"","",NA,0,0,0,0,0,0,0,0,0,0,0,0,0,NA,0,"N",NA,NA,0,NA,"","","","",1,"N",NA,"Y","N","N","N",1,1,1,1,1,1,1,1,NA,"N",1,"WORKORDER",NA,NA,"AZN",NA,0,0,"N",NA,NA,NA,NA,"","",2,NA,2,NA,999,"","",NA,"","",NA,NA,"OHAYBATOV","21/07/2023 12:17:11AM",24,6,2023,"B0564",5,"BUSTR-21743"
"STBAK-112-1","BAKU","DRILL SUPP","PLAN","PMRV",1,"0-10","2"" Mechanical Lockout Tool SD027",199224,"0110","21740","SD027","SD027","2"" Mechanical Lockout Tool",2023,30,"STBAK",112,1,10,"B0564","BUSTR",0,NA,0,0,5,NA,"EMEA0091",1,2023-07-23,"30/06/2023","12:00:00.000000AM",2023-06-30,"12:00:00.000000AM","07/07/2023","11:59:00.000000PM","07/07/2023","11:59:00.000000PM",NA,"18/07/2023"," 8:00:00.000000AM","18/07/2023"," 5:00:00.000000PM",NA,"",8,"","",NA,0,0,0,0,0,0,0,0,0,0,0,0,0,NA,0,"N",NA,NA,0,NA,"","","","",1,"N",NA,"Y","N","N","N",1,1,1,1,1,1,1,1,NA,"N",1,"WORKORDER",NA,NA,"AZN",NA,0,0,"N",NA,NA,NA,NA,"","",2,NA,2,NA,999,"","",NA,"","",NA,NA,"OHAYBATOV","21/07/2023 12:19:47AM",24,6,2023,"B0564",5,"BUSTR-21740"
"STBAK-113-1","BAKU","DRILL SUPP","PLAN","PMRV",1,"0-10","Rescue Shears BP 030",199224,"0110","21520","BP 030","BP 030","Lancier Rescue Shears",2023,30,"STBAK",113,1,10,"B0564","BUSTR",0,NA,0,0,5,NA,"EMEA0091",1,2023-07-23,"30/06/2023","12:00:00.000000AM",2023-06-30,"12:00:00.000000AM","07/07/2023","11:59:00.000000PM","07/07/2023","11:59:00.000000PM",NA,"21/07/2023"," 8:00:00.000000AM","21/07/2023"," 5:00:00.000000PM",NA,"",8,"","",NA,0,0,0,0,0,0,0,0,0,0,0,0,0,NA,0,"N",NA,NA,0,NA,"","","","",1,"N",NA,"Y","N","N","N",1,1,1,1,1,1,1,1,NA,"N",1,"WORKORDER",NA,NA,"AZN",NA,0,0,"N",NA,NA,NA,NA,"","",2,NA,2,NA,999,"","",NA,"","",NA,NA,"OHAYBATOV","21/07/2023 12:28:55AM",24,6,2023,"B0564",5,"BUSTR-21520"
"STBAK-114-1","BAKU","DRILL SUPP","PLAN","PMRV",1,"0-10","Multipurpose skid SD043",199224,"0110","21756","SD043","SD043","BOPAS TEST SKID",2023,30,"STBAK",114,1,10,"B0564","BUSTR",0,NA,0,0,5,NA,"EMEA0091",1,2023-07-23,"30/06/2023","12:00:00.000000AM",2023-06-30,"12:00:00.000000AM","07/07/2023","11:59:00.000000PM","07/07/2023","11:59:00.000000PM",NA,"10/07/2023"," 8:00:00.000000AM","21/07/2023"," 5:00:00.000000PM",NA,"",8,"","",NA,0,0,0,0,0,0,0,0,0,0,0,0,0,NA,0,"N",NA,NA,0,NA,"","","","",1,"N",NA,"Y","N","N","N",1,1,3,1,1,1,1,1,NA,"N",1,"WORKORDER",NA,NA,"AZN",NA,0,0,"N",NA,NA,NA,NA,"","",2,NA,2,NA,999,"","",NA,"","",NA,NA,"OHAYBATOV","21/07/2023 12:33:39AM",24,6,2023,"B0564",5,"BUSTR-21756"
"STAUS-827-12","PERTH","C&I","PSTJB","WIP",0,NA,"HIGH-LOW INTERVENTION SKID POST-JOB",222656,"7000","12854","HILOS-006","HILOS-006","USE BUROV ASSET HILOS0006 FOR ASSET TRACKING",2023,30,"STAUS",827,12,120,"B0811","BUSTR",0,NA,0,0,1,NA,"ROVMG224",1,2023-07-24,"24/04/2023","12:00:00.000000AM",2023-04-24,"12:00:00.000000AM","28/07/2023","11:59:00.000000PM","01/06/2023","11:59:00.000000PM",NA,"18/07/2023"," 8:00:00.000000AM","24/07/2023"," 5:00:00.000000PM",NA,"",11,"","",NA,0,0,0,0,0,0,0,0,0,0,0,0,0,NA,0,"N",NA,NA,0,NA,"","","","",1,"N",NA,"Y","N","N","N",1,1,4,1,1,1,1,1,NA,"N",1,"",NA,NA,"AUD",NA,0,0,"N",NA,NA,NA,NA,"","",2,NA,2,NA,999,"","",NA,"","",NA,NA,"TCONNELL","24/07/2023  2:23:38AM",91,4,2023,"B0811",1,"BUSTR-12854"
"STAUS-931-1","PERTH","C&I","NEWBD","WIP",0,NA,"Visual Inspection of the free-issued parts",225129,"4030",NA,NA,NA,NA,2023,30,"STAUS",931,1,10,"B0811","",0,NA,0,0,1,NA,"",1,2023-07-24,"24/07/2023","12:00:00.000000AM",2023-07-24,"12:00:00.000000AM","28/07/2023","11:59:00.000000PM","28/07/2023","11:59:00.000000PM",NA,"24/07/2023"," 8:00:00.000000AM","24/07/2023"," 5:00:00.000000PM",NA,"",31,"","",NA,0,0,0,0,0,0,0,0,0,0,0,0,0,NA,0,"N",NA,NA,0,NA,"","","","",1,"N",NA,"Y","N","N","N",1,1,1,1,1,1,1,1,NA,"N",1,"",NA,NA,"AUD",NA,0,0,"N",NA,NA,NA,NA,"","",2,NA,2,NA,999,"","",NA,"","",NA,NA,"ASTANIMIROVIC","24/07/2023 12:24:04AM",0,7,2023,"B0811",1,NA
"STAUS-937-7","PERTH","DECOMM","PREJB","PSCH",0,NA,"Supergrinder with Shroud for cutting reo-mesh",227216,"7000","18158","AU0405","AU0405","SUPER GRINDER 14 IN",2023,30,"STAUS",937,7,70,"B0811","BUSTR",0,NA,0,0,4,NA,"APAC07",1,2023-07-24,"20/07/2023","12:00:00.000000AM",2023-07-20,"12:00:00.000000AM","15/09/2023","11:59:00.000000PM","15/09/2023","11:59:00.000000PM",NA,"","","","",NA,"",30,"","",NA,0,0,0,0,0,0,0,0,0,0,0,0,0,NA,0,"N",NA,NA,0,NA,"","","","",1,"N",NA,"N","N","N","N",1,1,1,1,1,1,1,1,NA,"N",1,"",NA,NA,"AUD",NA,0,0,"N",NA,NA,NA,NA,"","APAC_SUPER GRINDER_PRE",2,NA,2,NA,999,"","",NA,"","",NA,NA,"TJDESPAIN","24/07/2023  1:54:48AM",4,7,2023,"B0811",1,"BUSTR-18158"
"STAUS-937-8","PERTH","DECOMM","PREJB","PSCH",0,NA,"Pre-Job inspection for Winch.",227216,"7000","18765","AU0242","AU0242","Hydraulic Winch 957042926",2023,30,"STAUS",937,8,80,"B0811","BUSTR",0,NA,0,0,8,NA,"APAC07",1,2023-07-24,"20/07/2023","12:00:00.000000AM",2023-07-20,"12:00:00.000000AM","15/09/2023","11:59:00.000000PM","15/09/2023","11:59:00.000000PM",NA,"","","","",NA,"",30,"","",NA,0,0,0,0,0,0,0,0,0,0,0,0,0,NA,0,"N",NA,NA,0,NA,"","","","",1,"N",NA,"Y","N","N","N",1,1,1,1,1,1,1,1,NA,"N",1,"",NA,NA,"AUD",NA,0,0,"N",NA,NA,NA,NA,"","APAC_WINCH_PRE",2,NA,2,NA,999,"STAUS","PERTH",NA,"","",NA,NA,"TJDESPAIN","24/07/2023  1:59:35AM",4,7,2023,"B0811",1,"BUSTR-18765"
"STAUS-938-3","PERTH","OPG-CLIENT","PSTJB","PSCH",0,NA,"Seadraulics Class 5 Test Jig Demob",205870,"7000",NA,NA,NA,NA,2023,30,"STAUS",938,3,30,"B0811","BUSTR",0,NA,0,0,1,NA,"",1,2023-07-24,"24/07/2023","12:00:00.000000AM",2023-07-24,"12:00:00.000000AM","04/08/2023","11:59:00.000000PM","04/08/2023","11:59:00.000000PM",NA,"","","","",NA,"",11,"","",NA,0,0,0,0,0,0,0,0,0,0,0,0,0,NA,0,"N",NA,NA,0,NA,"","","","",1,"N",NA,"N","N","N","N",1,1,1,1,1,1,1,1,NA,"N",1,"",NA,NA,"AUD",NA,0,0,"N",NA,NA,NA,NA,"","",2,NA,2,NA,999,"STAUS","PERTH",NA,"","",NA,NA,"TVICAREY","24/07/2023 12:37:12AM",0,7,2023,"B0811",1,NA
"STAUS-939-1","PERTH","DECOMM","NEWBD","TSCD",0,NA,"2.69"" LOT Assembly",221546,"3660",NA,NA,NA,NA,2023,30,"STAUS",939,1,10,"B0811","",0,NA,0,0,7,NA,"",1,2023-07-24,"24/07/2023","12:00:00.000000AM",2023-07-24,"12:00:00.000000AM","08/08/2023","11:59:00.000000PM","08/08/2023","11:59:00.000000PM",NA,"","","","",NA,"",17,"","",NA,0,0,0,0,0,0,0,0,0,0,0,0,0,NA,0,"N",NA,NA,0,NA,"","","","",1,"N",NA,"Y","N","N","N",1,1,1,1,1,1,1,1,NA,"N",1,"",NA,NA,"AUD",NA,0,0,"N",NA,NA,NA,NA,"","",2,NA,2,NA,999,"","",NA,"","",NA,NA,"WNOURI","24/07/2023  2:47:25AM",0,7,2023,"B0811",24,NA
"STAUS-939-2","PERTH","DECOMM","NEWBD","TSCD",0,NA,"2.69"" LOT Parts Inventory",221546,"3660",NA,NA,NA,NA,2023,30,"STAUS",939,2,20,"B0811","",0,NA,0,0,1,NA,"",1,2023-07-24,"24/07/2023","12:00:00.000000AM",2023-07-24,"12:00:00.000000AM","08/08/2023","11:59:00.000000PM","08/08/2023","11:59:00.000000PM",NA,"","","","",NA,"",17,"","",NA,0,0,0,0,0,0,0,0,0,0,0,0,0,NA,0,"N",NA,NA,0,NA,"","","","",1,"N",NA,"Y","N","N","N",1,1,1,1,1,1,1,1,NA,"N",1,"",NA,NA,"AUD",NA,0,0,"N",NA,NA,NA,NA,"","",2,NA,2,NA,999,"","",NA,"","",NA,NA,"WNOURI","24/07/2023  2:47:25AM",0,7,2023,"B0811",24,NA
"STAUS-939-3","PERTH","DECOMM","NEWBD","TSCD",0,NA,"5"" LOT Assembly",221546,"3660",NA,NA,NA,NA,2023,30,"STAUS",939,3,30,"B0811","",0,NA,0,0,7,NA,"",1,2023-07-24,"24/07/2023","12:00:00.000000AM",2023-07-24,"12:00:00.000000AM","08/08/2023","11:59:00.000000PM","08/08/2023","11:59:00.000000PM",NA,"","","","",NA,"",17,"","",NA,0,0,0,0,0,0,0,0,0,0,0,0,0,NA,0,"N",NA,NA,0,NA,"","","","",1,"N",NA,"Y","N","N","N",1,1,1,1,1,1,1,1,NA,"N",1,"",NA,NA,"AUD",NA,0,0,"N",NA,NA,NA,NA,"","",2,NA,2,NA,999,"","",NA,"","",NA,NA,"WNOURI","24/07/2023  2:47:25AM",0,7,2023,"B0811",24,NA
"STAUS-939-4","PERTH","DECOMM","NEWBD","PSCH",0,NA,"5"" LOT Parts Inventory",221546,"3660",NA,NA,NA,NA,2023,30,"STAUS",939,4,40,"B0811","",0,NA,0,0,1,NA,"",1,2023-07-24,"24/07/2023","12:00:00.000000AM",2023-07-24,"12:00:00.000000AM","08/08/2023","11:59:00.000000PM","08/08/2023","11:59:00.000000PM",NA,"","","","",NA,"",17,"","",NA,0,0,0,0,0,0,0,0,0,0,0,0,0,NA,0,"N",NA,NA,0,NA,"","","","",1,"N",NA,"Y","N","N","N",1,1,1,1,1,1,1,1,NA,"N",1,"",NA,NA,"AUD",NA,0,0,"N",NA,NA,NA,NA,"","",2,NA,2,NA,999,"","",NA,"","",NA,NA,"WNOURI","24/07/2023  2:47:25AM",0,7,2023,"B0811",24,NA
"STAUS-939-6","PERTH","DECOMM","NEWBD","PSCH",0,NA,"2.69"" LOT FAT",221546,"3660",NA,NA,NA,NA,2023,30,"STAUS",939,6,60,"B0811","",0,NA,0,0,4,NA,"",1,2023-07-24,"24/07/2023","12:00:00.000000AM",2023-07-24,"12:00:00.000000AM","08/08/2023","11:59:00.000000PM","08/08/2023","11:59:00.000000PM",NA,"","","","",NA,"",17,"","",NA,0,0,0,0,0,0,0,0,0,0,0,0,0,NA,0,"N",NA,NA,0,NA,"","","","",1,"N",NA,"Y","N","N","N",1,1,1,1,1,1,1,1,NA,"N",1,"",NA,NA,"AUD",NA,0,0,"N",NA,NA,NA,NA,"","",2,NA,2,NA,999,"","",NA,"","",NA,NA,"WNOURI","24/07/2023  2:48:18AM",0,7,2023,"B0811",24,NA
"STAUS-939-7","PERTH","DECOMM","NEWBD","PSCH",0,NA,"5"" LOT FAT",221546,"3660",NA,NA,NA,NA,2023,30,"STAUS",939,7,70,"B0811","",0,NA,0,0,4,NA,"",1,2023-07-24,"24/07/2023","12:00:00.000000AM",2023-07-24,"12:00:00.000000AM","08/08/2023","11:59:00.000000PM","08/08/2023","11:59:00.000000PM",NA,"","","","",NA,"",17,"","",NA,0,0,0,0,0,0,0,0,0,0,0,0,0,NA,0,"N",NA,NA,0,NA,"","","","",1,"N",NA,"Y","N","N","N",1,1,1,1,1,1,1,1,NA,"N",1,"",NA,NA,"AUD",NA,0,0,"N",NA,NA,NA,NA,"","",2,NA,2,NA,999,"","",NA,"","",NA,NA,"WNOURI","24/07/2023  2:48:18AM",0,7,2023,"B0811",24,NA
"STLAD-365-1","LUANDA","DRILL SUPP","PREJB","TCOM",0,NA,"HILOS0008 FROM MIL 201-202 B805 13 -06-2023 ANG-EMO-IN-2023-34",221576,"7000","9125","BP00312","BP00312","Torque Tool, Retlock (6000 Nm)",2023,30,"STLAD",365,1,10,"B0078","BUROV",0,NA,0,0,1,NA,"ROVML201",1,2023-07-24,"12/07/2023","12:00:00.000000AM",2023-07-12,"12:00:00.000000AM","25/07/2023","11:59:00.000000PM","25/07/2023","11:59:00.000000PM",NA,"24/07/2023"," 8:00:00.000000AM","24/07/2023"," 5:00:00.000000PM",NA,"",15,"","",NA,0,0,0,0,0,0,0,0,0,0,0,0,0,NA,0,"N",NA,NA,0,NA,"","","","",1,"N",NA,"Y","N","N","N",1,1,1,1,1,1,1,1,NA,"N",1,"WORKORDER",NA,NA,"AOA",NA,0,0,"N",NA,NA,NA,NA,"","",2,NA,2,NA,999,"STLAD","LUANDA",NA,"","",NA,NA,"PSEBASTIAO","24/07/2023  3:04:19AM",12,7,2023,"B0078",1,"BUSTR-9125"
"STLAD-366-1","LUANDA","DRILL SUPP","PREJB","TCOM",0,NA,"PREP SUPER GRINDER ER00182 FOR MIL144 NORMAND ENERGY",213455,"9900","11368","ER00182","ER00182","SUPER GRINDER",2023,30,"STLAD",366,1,10,"B0078","BUSTR",0,NA,0,0,1,NA,"EMEA0089",1,2023-07-24,"21/06/2023","12:00:00.000000AM",2023-06-21,"12:00:00.000000AM","23/06/2023","11:59:00.000000PM","23/06/2023","11:59:00.000000PM",NA,"24/07/2023"," 8:00:00.000000AM","24/07/2023"," 5:00:00.000000PM",NA,"",15,"","",NA,0,0,0,0,0,0,0,0,0,0,0,0,0,NA,0,"N",NA,NA,0,NA,"","","","",1,"N",NA,"Y","N","N","N",1,1,1,1,1,1,1,1,NA,"N",1,"WORKORDER",NA,NA,"AOA",NA,0,0,"N",NA,NA,NA,NA,"","",2,NA,2,NA,999,"STLAD","LUANDA",NA,"","",NA,NA,"PSEBASTIAO","24/07/2023  2:44:34AM",33,6,2023,"B0078",1,"BUSTR-11368"
"STLAD-367-1","LUANDA","DRILL SUPP","PREJB","TCOM",0,NA,"PREP LVOT FOR ESSO ER01643 / ER01743",212153,"7000","12095","ER01643","ER01643","LVOT OVERRIDE TOOL, LINEAR VALVE LVOT-TYPE A",2023,30,"STLAD",367,1,10,"B0078","BUSTR",0,NA,0,0,1,NA,"EMEA0089",1,2023-07-24,"28/06/2023","12:00:00.000000AM",2023-06-28,"12:00:00.000000AM","30/06/2023","11:59:00.000000PM","30/06/2023","11:59:00.000000PM",NA,"24/07/2023"," 8:00:00.000000AM","24/07/2023"," 5:00:00.000000PM",NA,"",15,"","",NA,0,0,0,0,0,0,0,0,0,0,0,0,0,NA,0,"N",NA,NA,0,NA,"","","","",1,"N",NA,"Y","N","N","N",1,1,1,1,1,1,1,1,NA,"N",1,"WORKORDER",NA,NA,"AOA",NA,0,0,"N",NA,NA,NA,NA,"","",2,NA,2,NA,999,"STLAD","LUANDA",NA,"","",NA,NA,"PSEBASTIAO","24/07/2023  2:50:37AM",26,6,2023,"B0078",1,"BUSTR-12095"
"STLAD-367-2","LUANDA","DRILL SUPP","PREJB","TCOM",0,NA,"PREP LVOT FOR ESSO ER01643 / ER01743",212153,"7000","12171","ER01743","ER01743","LVOT OVERRIDE TOOL, LINEAR VALVE LVOT-TYPE A",2023,30,"STLAD",367,2,20,"B0078","BUSTR",0,NA,0,0,1,NA,"EMEA0091",1,2023-07-24,"28/06/2023","12:00:00.000000AM",2023-06-28,"12:00:00.000000AM","30/06/2023","11:59:00.000000PM","30/06/2023","11:59:00.000000PM",NA,"24/07/2023"," 8:00:00.000000AM","24/07/2023"," 5:00:00.000000PM",NA,"",15,"","",NA,0,0,0,0,0,0,0,0,0,0,0,0,0,NA,0,"N",NA,NA,0,NA,"","","","",1,"N",NA,"Y","N","N","N",1,1,1,1,1,1,1,1,NA,"N",1,"WORKORDER",NA,NA,"AOA",NA,0,0,"N",NA,NA,NA,NA,"","",2,NA,2,NA,999,"STLAD","LUANDA",NA,"","",NA,NA,"PSEBASTIAO","24/07/2023  2:56:19AM",26,6,2023,"B0078",1,"BUSTR-12171"
